微博内容,类标签
听说电影院要解禁了小同事说我想去看姜子牙我忽然想起来春节前v已经放假很憧憬地规划着春节要看的几部电影姜子牙大护法2我好像也想看什么来着花木兰吗还是别的什么这些悲催的作品以为被新冠延期没想到被延期了半年还不知道能不能排上1月明明是很正常的日子家庭工作健康留学安排旅行计划所有事都还在原来的轨道上而现在什么都莫名其妙地不确定起来收起全文d,3
国考医生遇到医疗纠纷也不走合法渠道为什么因为他们也知道走合法渠道根本就走不通就像医害太原市卫健委滥用职权剥夺患者医疗鉴定权合法渠道被他们人为堵死让老百姓怎么办打击医害还患者风清气正的医疗环境为民服务他不行祸害百姓他第一因我母亲普通感冒去世为了指出是太原市太航医院的医疗责任我申请了医疗鉴定这个权利是国家赋予每个公民的医疗鉴定中太航医院和太原市卫健委对我指出是医院的医疗责任以及病历的缺失无异议但不知为何太原市卫健委在拖了1年7个月后已过法律时效同医院又一起否认当时我指出的医疗责任为何有操作有内幕还剥夺了我的医疗鉴定权自此我丧失了可以定责医院的权利国家给公民解决医疗纠纷的渠道被野蛮堵死太原市卫健委由执法者变为违法者国家法律被他踩于脚下我人权被剥夺投诉渠道被堵死已无路可走我只能选择网上寻求帮助我实名举报太原市卫健委权力寻租太原市太航医院就是权力的受益者我真诚希望监察纪检卫生系统的上级部门能来审查先查我举报是否属实不属实法办我如果查出太原市卫健委确实违法请对曱甴别手软我的资料他们2方全有患者儿子李杰日期20184如果本人突然不发贴了那就是在无依法处理医疗纠纷前就被某部门控制自由了那就意味着我的自由人权被侵犯本人既然敢发就无惧后果因为所说全部属实不要总想搞死发现问题的受害者却放了那些制造矛盾违法行政单位山西省人民政府山西卫视山西广播电视台南方周末男方婚前患艾滋未告知婚姻关系被撤销知乎声明拼多多身份真实无误央视评不能让奋斗变了味中了5000万会立刻离职吗31省区市新增确诊33例民法典将怎样影响我们的生活新冠病毒疫苗接种须知新冠病毒疫苗全民免费2021年第一条微博快进2020广东一男生朝女生泼化学物质如何防范疫情下的春运低龄未成年人刑责范围再调整一张照片告别2020阿里巴巴涉嫌垄断被立案调查2021考研两头婚如何应对被社会性死亡侄子侄女可继承叔伯遗产微盘点国考行测股票今日看盘拜登特朗普省考美国大选四六级成绩国考国考公告国考职位表平安2020第十四个五年规划初级会计成绩中级会计四六级护考教师资格证微信福奇白宫基金A股创业板新冠疫苗疫苗核酸检测口罩美国疫情收起全文d,3
王一博王一博天天向上王一博UNIQ王一博,1
原神泻药我就不该十连还不如单抽,2
新浪看点联盟历史五大恶人马龙第一巴克利上榜现役无人上榜O联盟历史五大恶人马龙第一巴克利上榜现役无人上榜,0
盛龙看世界第一季第10期新型冠状病毒肺炎盛龙看世界新冠新型冠状病毒关注新冠肺炎更多精彩关注王盛龙2河源河源百利龙城国际酒店L王盛龙的微博视频,3
王一博紧跟韩剧的流行趋势现在越来越多的人们喜欢把自己的家打造成韩式风情的感觉浪漫而又温馨尤其是年轻人们我们推出三套韩式风格的小屋与你一同分享主人家的搭配心得,1
过于真实原神L红玩App的微博视频,2
科技科技资讯新冠1仿制药法匹拉韦被指与原研有差距并非新冠用药2微信小程序生鲜果蔬业态访问量同比增长1683海能达在一版权诉讼案中败诉需赔偿摩托罗拉近765亿美元4快手科技与歌华有线达成合作双方将推进在内容版权等方面的合作5科技部可以明确磷酸氯喹治疗新冠肺炎具有疗效收起全文d,3
微博视频新冠不得不说中国在疫情防控方面真的做的比日本好太多一句话形容现在的日本状况医疗系统崩溃死亡人数上升经济萧条人心惶惶健康日本2日本L千寻酱_chihiro的微博视频,3
新冠病毒爆发担忧令美元受益金银TD晚盘双双下跌新冠黄金白银黄金价格周一回落因美元受益于对第二波冠状病毒感染的担忧引发的避险买盘我看到美元的短期需求非常强劲他补充称黄金还被夹在巨大的货币通胀前景和疲弱经济数据带来的通缩压力之间前者应该会支撑金价表现FX168财经报社香港讯上海黄金交易所黄金TD周二5月12日晚盘收盘下跌053报37955元克上海黄金交易所黄金TD周一收盘下跌041元或011报38124元克最高报价38437元克最低报价38001元克国际现货黄金周一亚市早盘开于170240美元盎司最高上涨至171230美元盎司最低下探169095美元盎司收于169582美元盎司下跌536美元或032上海黄金交易所白银TD周二晚盘收盘下跌050报37470元千克上海黄金交易所白银TD周一收盘下跌120元或031报377700元千克最高报价3814元千克最低报价3722元千克国际现货白银周一亚市早盘开于1548美元盎司最高上涨至1560美元盎司最低下探1524美元盎司收于1547美元盎司上涨002美元或013收起全文d,3
美议员怒斥全世界只有我们把戴不戴口罩当成政治议题我无法呼吸特朗普第二次进入地堡躲避大型双标现场美国退出联合国人权理事会联合国人权高专谴责美警方暴力执法联合国人权二十周年联合国人权联合国人权高专联合国人权理事会联合国人权高专办联合国人权专家联合国人权委员会全球疫情美国美国疫情新冠病毒新冠新冠肺炎疫情疫情全知道抗击疫情美利坚美利坚灯塔国威虎堂军事新闻茶余饭后我的2020新闻启示录美国部分示威者焚烧美国国旗美国部分示威者焚烧美国国旗美国明尼阿波利斯市进入紧急状态美国500多名士兵前往明尼阿波利斯等地美国示威现场发生枪击事件美国警察暴力执法致黑人死亡引抗议黑龙江吉林新闻哈尔滨新闻新疆塔里木北京天津生活河北燕京贵州云南西藏陕西身边事西安甘肃青海山西河南浙江湖北山东四川广西福建两广两湖广州从化齐齐哈尔安徽上海浙江江苏安徽江西桂林湖南香港内蒙古深圳宁夏义乌海南省澳门湛江深圳南京南昌辽宁L太乙亘0956的微博视频收起全文d,3
我一直都很喜欢的香水祖马龙英国梨与小苍兰朱星杰J_zen哥哥了解一下,0
王一博鬼鬼为什么会因为看了个十几秒的视频就突然对这对邪教产生兴趣我这人一般不嗑拉郎啊我靠逃不出狮子天秤的手掌心,1
王一博UNIQ王一博国家公祭日血泪记忆永远不会被遗忘以国家之名祭奠共同守望和平,1
原神最帅啦来自男神的花式笔芯,2
原神满命女仆能到什么强度,2
转,0
原神原神从1030到现在一个五星武器都没有出过这合理吗仓检真的存在吗为什么检测不到我缺武器,2
芦丹氏柏林少女祖马龙伯爵茶与小黄瓜拜里朵无人区玫瑰阿蒂仙冥府之路蒂普提克杜桑帕尔玛之水桃金娘加州桂,0
我参与了85号成为我最后的爱把发起的王一博上好佳田园薯片wyb王一博我投给了王一博有翡这个选项你也快来表态吧,1
原神异世界的重云和砂糖的约会日常尼亚大王晚安2南京LXYF的一的微博视频,2
王一博王一豹王一博酷盖王一博将热爱做到极致王一博滑板王一博不愧是我王一博职业赛车手85号车手王一博王一博摩托车王一博卡通黑豹形象王一博一波王炸王一博酷盖黑豹王一博滑雪展开全文c,1
原神bug遥控刻晴原神原神L三祈啊的微博视频,2
原神胡桃的PV哪去了,2
甘雨ちゃんめくりたい原神Genshin_Impactヨシモト_acguy_O网页链接,2
吴尊友老龄化严重国家应最先群体免疫3月20日在中国发展高层论坛2021年会上中国疾病预防控制中心流行病学首席专家吴尊友ChinaCDC表示要科学有效地在全球推广疫苗接种而不是全世界所有国家齐步走往前推进高年龄组的国家也就是老龄化严重的国家应该是最先实现群体免疫的国家刘轩廷中新视频L中新视频的微博视频收起全文d,3
王一博这就是街舞3王一博扒别人的来跳很不respect尊重原创尊重每个舞者的心血,1
原神原神原神四格漫画原神四格漫画第十三话安柏与兔兔伯爵既然如此只好使用我的绝招了,2
动漫壁纸美图原神感谢各位小伙伴们的赞和关注ﾉ画师Rei_kun,2
其实我们现在必须要面对一个现实许昕和马龙这批优秀的中国乒乓球队员已经逐渐的老去了目前来说中国在国际上比较有影响力的年轻乒乓球运动员只有樊振东一个人未来对中国有威胁的国家主要有日本因为张本智和这么小的年纪就已经在国际赛场上和中国的顶尖告诉对绝了虽然成绩很不理想但是他却积累了很多的经验虽然樊振东很厉害也很年轻但是他和张本智和之间的年龄差距也挺大的我虽然很讨厌日本但是我觉得日本在培养人才放面比我们国家做得好一点我希望能够在国际赛场上看见更多的少年代表祖国参塞尽管成绩不会太理想但是他们会收获很多的经验与其让他们在国内参加魔鬼一般的地狱比赛还不如让他们放飞自我去国际赛场上展现自己2绍兴绍兴县收起全文d,0
我真的想我哥,0
公费氪金原神五星角色循循守月甘雨冰红魔5S全程60帧顶级画质这手感简直不要太丝滑芜湖起飞点赞吸一吸欧气祝大家早日拥有甘雨L红魔游戏手机的微博视频,2
简讯韩国新增例新冠确诊病例累计10635例据韩国中央防疫对策本部17日通报截至当天0时韩国较前一天0时新增22例感染新型冠状病毒COVID19的确诊病例累计确诊O网页链接,3
钟离钟离原神钟离我和老公的第一个情人节,2
果窖_1988图4马龙突然两米八,0
王一博梦幻独家营业wyb王一博梦幻西游三维版碰撞潮流精致的梦幻西游三维版独一无二的国风打造最自由舒适的玩家体验梦幻西游三维版手游代言人王一博UNIQ王一博邀您共探辽阔三界𐂂wyb王一博正能量王一博有礼貌王一博好帅王一博气质王一博跳舞好王一博很酷展开全文c,1
王一博王一博首次单人三封哪一封都想要千面酷盖唯爱一博你好你坏你坏我们都在只要是王一博他什么风格我都喜欢都爱时尚表现力太绝了还有什么是王一博做不到的啊啊啊啊啊啊啊啊啊啊啊啊啊啊啊啊啊啊啊啊啊啊啊啊啊啊啊啊啊啊啊啊啊啊啊啊每期杂志出来都是惊艳啊啊啊啊啊太绝了这个展开全文c,1
德国德国疫情拜恩疫情500支疫苗从上弗兰肯行政区往中弗兰肯行政区运输过程中由于保存不当现确定失效,3
密集了吗亲们原水印不是我切的马龙2抚州潭湖,0
阳光信用每日一善每日一善XUzy9杰伦和马龙我先听马龙呲牙,0
王一博老公,1
有钱了就买一瓶祖马龙2保山,0
Lordylord马龙工作室马龙致敬一线防疫医护人员祝福武汉我们肩并肩火龙果们也要做好防护平安健康武汉加油captain龙武汉加油众志成城一起打赢这场防疫战加油,0
王一博啵啵子晚安UNIQ王一博偶尔还是可以再尝试下丹丹风格想看,1
预定3到4天发货祖马龙限量版睡莲香水30ml前调橙花中调睡莲后调白麝香据说灵感来源于首尔的昌德宫后苑我听见雨滴落在青草地我听见远处下课钟声敲响千玺穿着白衬衫骑车来接我放学的味道雨后清晨加上春日青草散发的自然芬芳尾调的白麝香又让它从大自然中走回来又冷又欲是我寻觅的神仙香气收起全文d,0
分享一波打新冠疫苗的盛况等下给大家更新期间的细节中国新冠肺炎疫苗2长沙浏阳河街道社区卫生服务中心,3
只看出来了马龙是你们乒乓球圈所有人的爹连带着球迷说的话都被你们乒乓球圈所有人当圣旨一样天天捏着嗓子就搁旁边等着接旨球迷放个屁也要在旁边赶紧先闻闻判断成分,0
原神阿贾克斯14图片来自推特已授权链接O网页链接原神原神,2
突发波士顿城区水管爆裂断水断电至少24小时新冠疫苗或在秋季问世美国生活波士顿美国疫情新冠特朗普新iphonese留学生宅家美国到底欠了世卫组织多少会费O突发波士顿城区水管爆裂断水断电至少24小时新冠疫苗或在秋季问世,3
胡萝卜青菜鸡蛋炒面今天中午这个炒面吃了不少最近饭饭吃的有点渣老母亲又没有动力了今天两个胳膊各打了一针居然没有哭大概医生速度太快没反应过来已经打完了麻腮风甲肝疫苗2上海,3
王一博代言肯德基王一博,1
疫苗寒冬里有风的日子测温扫码后在细致的问询下来到3号接种室细细的针筒在温柔的女大夫手中不知不觉地完成了使命毫无察觉之下结束了第一针没有所传说的疼痛也没有任何不适一切如常,3
王一博wyb王一博有翡wyb王一博谢允公子谢允有翡君子看似风流油滑实则深情温柔只许一人我命我主心怀天下温柔的倔强冰雪里重生简直完美自此以后再也忘不了我们青年演员王一博演绎鲜活的谢允了UNIQ王一博,1
洱海晚霞晚安人也许不认识人但灵魂认识灵魂马龙詹姆斯晚安2大理市,0
马龙马俊俊,0
憋了一个月阿贝多甘雨到魈终于爽了就这材料太阴间了策划的肛塞掉率低的跟策划的智商一样还他妈要我的金石头箭头也换成了史莱姆清一周的箭头白刷了温蒂要钟离也要魈还要策划就这么喜欢用史莱姆清吗我肏死策划亲爹亲妈的时候也没用这么多润滑油你游策划为了卡玩家资源可谓是无所不用其极原神原神原神魈收起全文d,2
原宿香水小众香水祖马龙祖马龙jomaloneHARAJUKULove原宿娃娃小爱爱心女士香水5ml10ml甜美花果香鹿晗吴磊王源易烊千玺王源迪丽热巴白敬亭王子异王俊凯张艺兴陈伟霆范丞丞罗云熙周震南陈宥维焉栩嘉王子异李汶翰陈学冬朱正廷戴景耀HARAJUKULove原宿娃娃小爱爱心女士香水5ml10ml甜美花果香收起全文d,0
寻找绿洲创想家风格万变时尚家祖马龙蓝风玲买正品上洋葱风吹散了姑娘的披肩长发吹开了细高跟上方的短裙而远方的路人只闻到了风送来的香水味祖马龙蓝风玲O绿洲,0
原神今天的海灯节任务要找若心但是我的还卡在古云有魑任务里我真的打不过去啊之前又不小心开了天遒谷的任务也过不去到现在一直连不了机体会到了绝望,2
王一博天天向上wyb王一博我哥哥什么都会,1
原神冰深渊法师娘化图片来自推特已授权未经允许不得擅自转载链接O网页链接原神原神,2
原神大家现在还在用迪卢克吗,2
龙哥不要急慢慢来果窖_1988回归赛场还需要恢复调整的时间马龙按照队医体能教练的计划一步一步来吧,0
有句话说得好再光鲜亮丽的副驾驶都不如自己握紧方向盘护肤想用lp化妆想使全套TFCPB喷厕所想用祖马龙参加聚会想穿Dior高订逛街想背爱马仕出门想开阿斯顿马丁想过更好的生活没什么不,0
本来是为了啵啵看的冲浪结果被每一次吃饭时候的小贾笑得找不到头王一博王一博,1
樱色香氛型保湿护手霜4支屈臣氏一只19元我们4只99元香氛型护手霜淡香跟祖马龙的淡香版特好闻涂上保湿一整天30元券微博专享限时领券,0
疫苗消息一出黄金直接再次走跌我们1895再次大赚和时光周末判断的一直拜当选会极力参与控制疫情MODERNA公司表示三期试验疫苗有效性为945其新冠疫苗的保质期更长在冰箱温度下可维持稳定30天黄金疫苗新冠,3
王一博他从黑夜里走来值得所有美好但凡你在那个十年里的某一天放弃了走开了我都见不到今天的你我的idol新剧有翡很香期待王一博wyb王一博有翡Leliza_10的微博视频,1
马龙不管时光如何流逝你永远是那个赤子初心的你,0
绝了原神这就是快乐吗,2
全国新冠疫苗已接种74956万剂次全年疫苗产量完全可以满足全国人民接种需求疫情疫苗,3
国产肺炎13价结合疫苗亮相2020年3月31日来自云南沃森的全球第二个肺炎13价结合疫苗首批14万支获得国家药品监督管理局签发的生物制品批签发证明国产13价疫苗接种对象是6周龄5岁儿童目前比进口13价疫苗覆盖的年龄组大了很多世界卫生组织在疫苗立场文件指出肺炎13价结合疫苗对于预防肺炎肺炎球菌侵袭感染和降低鼻咽部带菌率都有很好的效果是婴幼儿最优先推荐接种的疫苗之一中国肺炎13价结合疫苗上市打破了辉瑞公司全球一家独大的垄断优势让中国儿童有机会选择性价比更高的疫苗以预防肺炎球菌性疾病在中国疫苗史上具有里程碑的意义收起全文d,3
原神救命命借巴巴托斯翅膀拍个照怎么感受到了蒙德深深的恶意亲爱的原神可莉做的一次性羽球已经迫不及待了,2
臭屁小孩七妹合冲浪修女哈哈哈哈哈哈哈哈哈哈哈哈哈图2不错王一博嗑王老师专用又在暗爽讨厌生姜哈哈哈哈哈哈哈哈狮子啵妈别装哥哥又给你爽到了吧土啵鼠不上火王勃内心爽但是我应得的,1
哈哈哈哈哈哈傻fufu的,0
原神钟离达达利亚图片来自推特同意转载原神原神,2
VERYBLUE全反网馈洗套护装又一小个红书上的心走测评从味道使到用感一了目然的好评祖马龙同款味道的护洗系列马卡龙同款色颜的高颜值产品是不是迫及不待想入了手感受一下皮头被彻放底松用过绝对爱会上,0
画画以不变应万变人类新冠,3
原神我擦啊啊啊啊啊啊,2
狂奔的高速鹿祖马龙的橙花走一路被太多人问过的味道,0
原神原神作为社畜这个女的任务太恶心了我好心帮你特么还怪我然后还叫我去和他上级求情求完情居然还继续叫我做事自己没手没脑子吗玩个游戏一肚子气,2
王一博有翡王一博谢允正能量艺人王一博青年演员王一博茴本超王一博是爱滑板的酷盖是在全世界任何角落跳舞都没差的舞台王者是不惧挑战的85号摩托赛车手是好奇心满满的魔术少年是咬着筷子练台词的王演员是多才多艺的主持人是一人千面的青年演员滑板少年街舞队长专展开全文c,1
祖马龙新香水樱花味道春天的气息少女心爆棚祖马龙JoMalone,0
原神原神来个大佬我这阵容能通关深渊可太难了2高州市,2
三文鱼新冠今天家庭聚餐前几天本来想买二斤三文鱼早上看到新闻后惊,3
倾楠的废话纸条原神心如死灰攒了快一个多月的保底你歪个七七我都能接受,2
祖马龙第一单下好2四平铁东欧亚,0
王一博王一博有翡王一博谢允康康帅气迷人的谢允迫不及待想要早点看剧了期待允呀,1
王一博王一博肖思博啊啊啊啊啊啊啊啊啊啊啊啊啊啊啊宇宙银我的角度查看图片,1
2020年全世界被新冠病毒打败我们龟缩在巢穴里渴望生存2021年新春快乐利好消息疫苗全民免费接种开始新的生活,3
Real爱captain龙崽初心DragonJoe马龙这个背影一看就非常有安全感,0
放火烧山煽风点火组合现场疑留下犯罪嫌疑人作案影像原神原神可莉LOF西子酿葡萄,2
王一博方否认恋情美合王一博害当时他也不是最好的从头到尾都是造谣黑子自娱自乐而已我们圈地自萌对所有恶意无感反弹biubiubiuO王一博三次辟谣仍有绯闻算人红是非多吗,1
原神学到了新的握法,2
原神原神0命甘雨简评定位分析武器圣遗物配队推荐O原神0命甘雨简评定位分析武器圣遗物配队推荐文案视频anshiajiao后期阿田汽水呀出场嘉宾机灵的997,2
疫毒人间新冠2天津,3
原神阳光正好,2
王一博为全国滑板锦标赛助阵王一博粉丝后援会王一博wyb王一博为全国滑板锦标赛助阵让我们和中国滑板运动推广大使王一博一起为运动员们加油助威吧UNIQ王一博王一博,1
祖马龙香薰蜡烛睡个安稳觉,0
祖马龙啊啦啦啦,0
BaiduMaLongBar马龙超话敲黑板近期返回7月集训有望8月重启赛事06kkIEz22了好久终于等到今天梦了好久终于把梦实现那些没马龙看的日子真的太有所谓了,0
原神原神胡桃原神胡桃胡桃桃大可爱我激情摸鱼,2
疫苗的副作用真的挺大的有个朋友刚打不久临床表现为逢人就说自己打了疫苗关键是这位朋友还是一个美女,3
每日单词辨析Day18昨日答案疫苗的英文是vaccine今天我们来看看沙尘暴怎么用英语说呢易酱每日单词辨析沙尘暴朋友圈文案沙尘暴是以下哪个选项,3
我要你祖玛珑糊糊不是FUFU本条卷破2K啾一位纯纯的孟母送祖马龙蓝风铃一瓶糊糊不是FUFU孟母永远是你的后盾和底气宝贝岐岐放心飞妈妈给你撑腰,0
得马龙者得天下,0
现在开始陪你一路成长是否能弥补没有早点认识你的遗憾以后会加倍爱你UNIQ王一博王一博,1
因我母亲普通感冒去世为了指出是太原市太航医院的医疗责任我申请了医疗鉴定这个权利是国家赋予每个公民的医疗鉴定中太航医院和太原市卫健委对我指出医院的医疗责任无异议但不知为何太原市卫健委在拖了1年7个月后竟然剥夺了我的医疗鉴定权它玩忽职守滥用职权人权被随意剥夺投诉渠道被堵死已无路可走某斌就直接找医生我只能选择网上寻求帮助我实名举报太原市卫健委权力寻租太原市太航医院就是权力的受益者我真诚希望监察纪检卫生系统的上级部门能来审查先查我举报是否属实不属实法办我如果查出太原市卫健委确实违法请对蛀虫别手软我的资料他们2方全有患者儿子李杰日期20199如果本人突然不发贴了那就是在无依法处理医疗纠纷前就被某部门控制自由了那就意味着我的自由人权被侵犯本人既然敢发就无惧后果因为所说全部属实不要总想搞死发现问题的受害者却放了那些制造矛盾违法行政单位sxrtv新闻中心山西综合广播太原晚报国际疫情新冠病毒新冠新冠肺炎疫情疫情全知道抗击疫情抗击新型肺炎第一线人类命运共同体疫情防控全球疫情疫情抗疫抗疫行动海外抗疫日记世界卫生组织谭德塞美国疫情全球疫情每日速递关注新冠肺炎共同战疫那些没烦恼的夏天收起全文d,3
国产VS进口疫苗对比3疫苗L盖世英雄Gsx的微博视频,3
王一博我不是花瓶他说到做到了把热爱做到极致每一面都很精彩UNIQ王一博王一博的b面人生,1
云南省的马龙曾经是一个寂寂无名的地方这个处于乌蒙山脉南部云贵高原滇东北丘陵区的小县今为曲靖市马龙区自古以来就是一个惊不了天地泣不了鬼神的平凡之地因为平凡所以无名不过自从有了史光柱有了史光柱在收复老山作战时面对险境临危不惧无惧生死冲上越军阵地的英雄气,0
肖战超话肖战王一博直到遇见了你我只喜欢你喜欢只因是你L玩妮媚的微博视频,1
