微博内容,类标签
王一博第128天打卡20191124涨粉情况统计今日关注量28405981昨日关注量28375980涨粉量30001今日涨粉三万哈哈哈哈哈哈好整啊今天哈哈哈哈而且今天也是时隔多天之后第一次破三万哎今日热搜相关无碎碎念分割线woc哥哥生图太绝了这喉展开全文c,1
马龙马龙选手身体健康比赛顺利,0
首届中国东盟阳光健身舞蹈公开赛圆满结束感谢老师们给我们这次在比赛中工作的机会多比赛能更加看清自己多工作能更加积累自己爱马龙爱大家爱心,0
原神砂糖图片来自推特已授权链接O网页链接原神原神,2
马龙2021年加油马龙L派克特别闹嗷的微博视频,0
12月29日国乒结束在海口的冬训出发前往深圳刘诗雯在海口冬训期间下车时意外崴脚在国乒医疗和康复团队的帮助下刘诗雯一直在积极恢复冬训结束时刘诗雯脚伤还未达到高强度比赛的要求所以这次地表最强12人赛刘诗雯遗憾退出单打和混双的比赛在刘诗雯退赛后混双方面许昕的搭档变更为孙颖莎于子洋搭档朱雨玲仍旧有6对混双选手出战直通赛混双比赛女单方面由钱天一替补刘诗雯参赛单打最终参赛名单男单马龙许昕樊振东林高远梁靖崑赵子豪薛飞周启豪周恺徐晨皓马特张煜东女单丁宁陈梦王曼昱孙颖莎朱雨玲陈幸同王艺迪何卓佳顾玉婷钱天一刘斐张瑞混双最终参赛名单马龙丁宁许昕孙颖莎樊振东顾玉婷林高远王曼昱梁靖崑陈梦于子洋朱雨玲收起全文d,0
云南马龙乡街子搭起群众便民桥O云南马龙乡街子搭起群众便民桥,0
观点严秀丽上周海外市场深度回调疫情在海外的快速扩散是导致大跌的主要因素这与A股市场1月末2月初的表现有些类似关注点有本周的超级星期二若当天出现市场近期的低点则可以适当参与反弹从技术面上看短期已出现超卖现象但是市场是否立即企稳仍需继续观察不排除有惯性下跌的风险A股新冠收起全文d,3
Happydrinkingsday原神,2
原神原神魈大号被盗了换来的是小号一发十连就出魈再带一个天空大剑这就是等价交换吗,2
新浪看点央视直播男子世界杯张本智和为祖国而战马龙高兴回到赛场O央视直播男子世界杯张本智和为祖国而战马龙高兴回到赛场,0
中国的新冠疫苗全球领先③疫苗医学科普L氪财经的快手视频,3
国药集团的新冠疫苗新冠看到推送新闻的时候都一激动婷大每天分享的护肤品就是国药的一池云锦太有安全感了ceo6778,3
又是一年冬季该准备的要准备起来啦祖马龙最喜欢的一款身体乳凑在银泰365打了个折香喷喷跪安了2杭州绿地旭辉城,0
青岛部分单位职工和家属今天已经可以集中打新冠疫苗了期待疫苗生产企业尽快扩大产能满足社会需求新冠疫苗美国发生多起新冠疫苗报废事件,3
芬DUA推荐全是草单推荐祖马龙黑莓与月桂英国梨与小苍兰宝格丽大吉岭茶并不简单等我好好用完它们我再买黑线,0
原神大家辅助一般要拉多少级还有大家圣遗物是40还是45级刷,2
全世界的疫情爆发为了家人和自己的健康从今往后的杀菌消臭产品必须需要准备的了介绍这款韩国的NON品牌杀菌除臭棒这个杀菌棒已经拿到了美国欧洲日本韩国的各项检验合格证而且可以确定的是他可以有效地清除使用周围的新冠细菌使用方法也是非常的简单哦只要把产品放置到需要杀菌的地方之后轻轻折断听到啪的声响后就开始启动杀菌的作用了呢使用场景有冰箱衣柜鞋柜室内宠物车载等等这款产品已经在欧洲美国等地区热卖中中国也在今年正式的通关上市了小伙伴们不要错过发掘新商机的好机会哦韩诚商贸等待大家的问询韩国健康消毒杀菌杀菌棒抗疫行动新冠净化空气韩国产品招代理收起全文d,3
八宝酱Marrisa恭喜Victoria_柴1名用户获得纪梵希小羊皮303沉昼_Chase1名用户获得祖马龙伯爵香水30ml微博官方唯一抽奖工具微博抽奖平台对本次抽奖进行监督结果公正有效公证链接O微博抽奖平台,0
体育人NBA历史贴NBA历史上五十大球星首例进球根据时间划分从贾巴尔马拉维奇怕里什到魔术师约翰逊乔丹奥拉朱旺马龙再到科比邓肯姚明詹姆斯韦德看看你都认识多少NBAL原汁篮球的秒拍视频,0
原神单抽出砂糖原神砂糖欧皇,2
原神抽不中前几天刚保底,2
原神原神兄弟们我的刻晴应该怎么提升天天刷雷本有两个极品平雷,2
萤火虫动漫游戏嘉年华原神可莉蹭拍了木愈myu哥哥一波二妹出镜二妹aa摄影及后期PO主抄送萤火虫动漫游戏嘉年华摄影9课官方微薄唔影组妖摄萌蛋壳安利协会推软妹君安利摄漫展菌TC视界映像茄子云漫展漫摄会吐槽部部长_FrosV硬核馆幻星社爱妹子萌妹传送门爱优摄萝莉萌妹收藏君收起全文d,2
耶啵晚安王一博粉丝后援会王一博wyb王一博晚安UNIQ王一博,1
陈情令不说再见陈情令大结局2019的夏日限定整个暑假都在沉迷虽然大结局了有点舍不得不过也认识了王一博这个酷盖dd王一博所以这个夏日限定注定是来日方长后会有期米奇比心Lwing_穎子的微博视频,1
马龙为什么总能赢O马龙为什么总能赢来源知乎,0
我都要一罐糖粥啊我都喜欢jnnyii我也喜欢帕恰狗限定飲料博我也爱hellokitty五啊姐姐最喜欢kitty王一博土啵鼠不上火等了一周的库洛米终于来了,1
恭喜发财财源广进进出平安安居乐业音大人广广纳人才财富五车金水马龙龙腾虎跃越上高层常驻不穷崇仁翻身身居高位位高权重重要看得开开心又快乐残阳祝你们美梦成真真的爱你们拜拜2云浮郁南县,0
存图肖战王一博,1
问首页个问题你们觉得祖马龙的油桃与蜂蜜好闻吗,0
给卢老爷魈啥啥都有的人随手那么一点之图一惨不忍睹的自己之图二图三也不知道我是什么命原神,2
爱死了马龙分享单曲KGoodbyes网易云音乐,0
陪猪长大王一博王一博陈情令以来有关王一博的相关复盘原po在某乎原文很长挺完整可以存下1O那些年王一博被肖先生拉踩的那些事一2O那些年王一博被肖先生拉踩的那些事二3O那些年王一博被肖先生拉踩的那些事三4O那些年王一博被肖先生拉踩的那些事四5O那些年王一博被肖先生拉踩的那些事五,1
王一博也许你已经学会了看淡一切也许你已经不再需要安慰你也正在真正的成为自己想要成为的那个人我们只会期盼你越来越好,1
王一博wyb王一博谢允王一博有翡王一博今天好甜实力一博正能量艺人王一博给王一博的999封信每天对王一博说晚安No93现在每次和小伙伴谈起你都眉飞色舞小伙伴说我眼睛都放光其实今天心情并不是太好但是一聊起你我就特别开心了心情立马就很好了感谢有你耶啵你是我心中的展开全文c,1
原神喜欢一个人好累2包头,2
antivaxxer是什么人考研考研英语疫苗个税嘿嘿嘿选吧,3
有人打了流感疫苗以后发现再次感冒反而症状加重很多可以理解为一朝被蛇咬再遇先吓死感染一次后免疫过度敏感也就是ADE抗体依赖增强新冠肺炎这种最担心的事情还是发生了疫苗面临全面科研挑战流感关注新冠肺炎多国发现新冠病毒变异毒株新冠最担心的事发生有人接种新冠疫苗可能导致疾病加重大河报网O最担心的事发生有人接种新冠疫苗可能导致疾病加重收起全文d,3
原神爱莉丝是谁几乎不记得NPC的名字不会是博士吧我也想看看钟离先生哈哈大笑的样子,2
半年不开张开张吃三年马龙的新专要听烂了CirclesPostMalone,0
原神原神明霄升海平原神拜年纪明霄升海平UP主们来拜年旅行者们大家好UP主联合同人作品原神拜年纪应邀参与哔哩哔哩游戏拜年纪活动节目直播播出时间O2021年2月6日1900单品正片解锁时间2021年2月6日2030欢迎旅行者们前往哔哩哔哩平台收看节目地址O网页链接感谢所有喜爱原神热爱创作的UP主们带来精彩的节目欢迎旅行者踊跃参与各平台的内容招募活动收起全文d,2
明霄灯海HuniPB_huni_原神二次元推,2
新冠美国特朗普数据观察者网新媒体听闻特朗普称可以注射消毒剂来杀死病毒澳洲首席医疗官当众笑场当地时间4月24日在澳大利亚的记者会上有记者提问称特朗普称可以注射消毒剂来抵抗病毒对此澳洲首席医疗官布伦丹墨菲在会上直接笑场燃新闻L燃新闻的微博视频特朗普称注射消毒液的说法只是讽刺收起全文d,3
原神旅者与命运的相遇跨越尘世的探索之旅iOS立即下载L原神,2
北京健康教育疫苗北京春节前将完成9类重点人群新冠疫苗接种O北京春节前将完成9类重点人群新冠疫苗接种,3
木羽子那下辈子就去祖马龙做员工吧,0
马龙马龙2020年加油20102020年乒乓球男子单打运动员世界排名top10关于马龙的世界排名纪录世界排名第一累计64个月连续34个月创造并保持着世界男乒历史上累计和连续排名世界第一时间最长的纪录未完待续PS世界排名第一时期2010012010121220111020120582013032013042201307201402820150420171234videocreatedbyGoBeessLHappLe_MVP的微博视频收起全文d,0
原神大家都抽到护lao摩po了吗刻晴卡池将于3月2日结束up让我猜猜小胡桃是不是即将登场啦,2
嘻嘻嘻魈宝贝我来啦原神,2
王一博LOVEUNIQ王一博FOREVER王一博王一博天天向上看看是哪只猫,1
王一博天天向上从漫画里走出来的人儿啊UNIQ王一博周日见王一博,1
原神原神原神超话目前51级兄弟姐妹们有没有原神群拉我下一起交流学习,2
王一博有翡wyb王一博谢允wyb王一博晚安六公主,1
艳红樱桃树苗报价艳红樱桃树哪里有李佳琦直播艳红樱桃树苗批发商被父亲烧伤男孩称常被爸妈打艳红樱桃树管理技术该树形结果早抗风雨能力较强更新容易适合平泊地栽培2改良纺锤形定干70厘米中心干分四层配备2025个单轴水平枝该树形易操作结果早抗风雨能力稍差适合山地密植园栽培3不同时期1扩冠期从定植开始到株距间有部分新梢交接约23年基金泰安开发区泽雨苗圃的微博视频马龙收起全文d,0
原神原神白垩与黑龙亲爱的旅行者原神12版本白垩与黑龙现已开启旅行者可点击O网页链接或前往原神官方网站下载游戏新活动即将上线点击下方长图了解详情,2
请勿在原神中起一些奇奇怪怪的名字crdy小奇奇解说原神,2
拜托拜托让马龙赶快好起来吧,0
新冠核酸检测亲眼见证的震撼打心里尊敬你们谢谢2北京大观园LKylinLi的微博视频,3
我分享了中国网的头条文章马龙超级全满贯马龙2018年加油O中外外交官首届友谊杯乒乓球赛在京举行,0
原神护法夜叉的璃月仙人魈一起来看看技能介绍吧,2
转天天快报国乒3大将突发退赛刘诗雯一轮游后战伊藤又没戏马龙樊振东休战O网页链接,0
3分鐘國情深圳定向招聘港澳居民任內地公務員大灣區新里程系列工聯會會長今集和大家介紹內地公務員及港澳居民任職內地公務員的條件工聯會香港疫情疫苗大湾区深圳首次招录港澳籍公务员香港吴秋北麥美娟Alice香港立法會議員香港立法會議員郭偉强鄧家彪_BillTangL工聯會_轆出嚟講的微博视频收起全文d,3
101太原市一场大火带走13条生命根源就是职能部门人浮于事漏检导致表面上的火扑灭了可扎根于公务员心理混日子的邪火仍熊熊燃烧这就是太原市卫健委吞咽着患者鲜血踩着患者带血的纱布残肢尸体捞政绩向上爬太原市应该吸取教训整顿吏治抓蛀虫造福百姓否则还有冤魂会缓缓走来为民服务他不行祸害百姓他第一因我母亲普通感冒去世为了指出是太原市太航医院的医疗责任我申请了医疗鉴定这个权利是国家赋予每个公民的医疗鉴定中太航医院和太原市卫健委对我指出是医院的医疗责任以及病历的缺失无异议但不知为何太原市卫健委在拖了1年7个月后已过法律时效同医院又一起否认当时我指出的医疗责任为何有操作有内幕还剥夺了我的医疗鉴定权自此我丧失了可以定责医院的权利国家给公民解决医疗纠纷的渠道被野蛮堵死太原市卫健委由执法者变为违法者国家法律被他踩于脚下我人权被剥夺投诉渠道被堵死已无路可走我只能选择网上寻求帮助我实名举报太原市卫健委权力寻租太原市太航医院就是权力的受益者我真诚希望监察纪检卫生系统的上级部门能来审查先查我举报是否属实不属实法办我如果查出太原市卫健委确实违法请对曱甴别手软我的资料他们2方全有患者儿子李杰日期20184如果本人突然不发贴了那就是在无依法处理医疗纠纷前就被某部门控制自由了那就意味着我的自由人权被侵犯本人既然敢发就无惧后果因为所说全部属实不要总想搞死发现问题的受害者却放了那些制造矛盾违法行政单位山西省人民政府山西卫视山西广播电视台南方周末新冠病毒疫苗全民免费2021年第一条微博2021新年贺词我们啃下了最难啃的硬骨头快进2020广东一男生朝女生泼化学物质如何防范疫情下的春运钢琴家傅聪感染新冠去世西藏冒险王坠入冰川离世低龄未成年人刑责范围再调整刑法最新修改内容一张照片告别2020英国宣布完成脱欧考研气氛组B站将离世用户账号列为纪念账号阿里巴巴涉嫌垄断被立案调查2021考研劳荣枝拒绝认罪两头婚如何应对被社会性死亡侄子侄女可继承叔伯遗产女性的生育成本微盘点国考行测股票今日看盘拜登特朗普省考美国大选四六级成绩国考国考公告国考职位表平安2020第十四个五年规划初级会计成绩中级会计四六级护考教师资格证微信福奇白宫基金A股创业板新冠疫苗疫苗核酸检测口罩美国疫情北京收起全文d,3
蛛网搜奇趣大量发展中国家转向购买中国疫苗疫苗发展中国家祖国潜龙爆料幽默话题蛛网搜奇趣蛛网搜奇趣话题杭州我的大余杭L蛛网搜奇趣的微博视频,3
医药资讯新冠博安生物继融资后迎来新冠中和抗体好讯药融圈本月获悉绿叶制药集团旗下山东博安生物技术有限公司博安生物已完成一轮战略融资累积融资金额达到人民币682亿元该融资以博安生物本次增资前估值人民币485亿元为基础投资方包括元生创投尚珹投资前海方舟百奥维达蓝海资本博睿资本等多家国内及国际知名的投资机构O博安生物继融资后迎来新冠中和抗体好讯收起全文d,3
马龙许昕男双夺冠马龙也太幽默了吧在国际乒联颁奖仪式上自嘲自己和队友年纪大了体育L体育甜甜圈的微博视频,0
原神板绘菜鸟新手多多包涵,2
国际知名企业入滇布局绿色食品产业O国际知名企业入滇布局绿色食品产业海盛花卉新西兰TG等知名企业也在曲靖马龙等地开展花卉种植和水果试种为今后云南省高原特色农业完善供应链体系带动冷链物流发展以及打造深加工产业链奠定了良好基础交流关注乐活曲靖农牧业,0
陈情令王一博王一博陈情令恭喜酷盖UNIQ王一博电视剧综艺赛车三面猛开花认真努力的酷盖wyb继续冲鸭新浪娱乐本期明星势力榜五个榜冠军分别是UNIQ王一博陈立农尤长靖JustinBieberR1SE刘也你的爱豆在哪里快来为TA打榜应援O明星势力榜,1
马大龙同学笑成这样符合您的人设吗马龙为什么这么可爱,0
阳光信用阳光信用原神bilibili,2
也门新冠死亡率死亡率高达30五年多的战争摧毁了数以千万计也门人的生活使国家机构濒临崩溃并使数十年来的发展成果发生逆转联合国秘书长古特雷斯表示随着2019冠状病毒病大流行通过谈判达成政治解决方案以结束冲突的紧迫性越来越大也门目前有2000例确诊新冠病例但是专家估计可能有多达100万人受到这一致命病毒的感染由于战争摧毁了医疗设施也门的新冠死亡率可高达30收起全文d,3
新冠拼的就是免疫力人体免疫球蛋白IgG正在保护我们L重链抗体研究院的微博视频,3
我放假了抽空爬也要爬上来新闻把我给激动哭了更好的日子要来啦马龙冲鸭马龙captain龙一起战东京,0
刘璇马龙冠军出圈记刘璇马龙都来做金领冠的代言人,0
新角色甘雨登场原神浮生孰来卡池UP开启L原神,2
谢允花式抱周翡阿翡好幸福啊啊啊抱了一天呀不数都觉得可把谢允UNIQ王一博累坏了太有男友力了可王一博谢允王一博有翡王一博L有翡独家花絮周翡化身人形挂件受伤累惨谢允,1
我来一个王一博王一博植村秀全球品牌代言人,1
武汉志愿者救助群新冠花与汉娜蜘蛛猴面包转发微博,3
王一博王一博L518wanan的微博视频,1
日常新冠我朋友圈裡的這些人的貨源都沒有人查的嗎全球的物資都在積極應援湖北其他地區一罩難求很多基層工作人員老人孩子都沒有防護條件的情況下他們是怎麼能天天公然售賣這些醫療防護用品的有關部門可以查查嗎,3
马龙白兰度的表演太迷人了我一直认为从马龙登上奥斯卡舞台开始奥斯卡才真正地开始焕发魅力一改之前十几届陈腐无趣的情况豆瓣上OTW的短评夸得让人不好意思,0
王一博0805生日快乐wyb王一博王一博希望你快乐别再一个人紧锁着眉头独自难过希望你幸福因为看你幸福也是我最快乐的事情UNIQ王一博Tôihyvọngbạnhạnhphúcđừngcôđơnnhíumàyvàbuồnmộtmìnhtôih展开全文c,1
群众体育汇来自新浪NBA如果以生涯场均272分记詹姆斯生涯得分距离追上科比还需要49场距离马龙还需要170场距离贾巴尔还需要224场你觉得他有机会成为NBA历史总得分王么今夜NBA图片链接O网页链接约附近的人打球查看自己篮球队的排名请用微信搜索小程序群众体育汇NBA零距离只因为篮球篮球收起全文d,0
澳大利亚研究院27页报告实锤揭穿美国如何借疫情抹黒中国我无法呼吸特朗普第二次进入地堡躲避大型双标现场美国退出联合国人权理事会联合国人权高专谴责美警方暴力执法联合国人权二十周年联合国人权联合国人权高专联合国人权理事会联合国人权高专办联合国人权专家联合国人权委员会全球疫情美国美国疫情新冠病毒新冠新冠肺炎疫情疫情全知道抗击疫情美利坚美利坚灯塔国威虎堂军事新闻茶余饭后我的2020新闻启示录美国部分示威者焚烧美国国旗美国部分示威者焚烧美国国旗美国明尼阿波利斯市进入紧急状态美国500多名士兵前往明尼阿波利斯等地美国示威现场发生枪击事件美国警察暴力执法致黑人死亡引抗议黑龙江吉林新闻哈尔滨新闻新疆塔里木北京天津生活河北燕京贵州云南西藏陕西身边事西安甘肃青海山西河南浙江湖北山东四川广西福建两广两湖广州从化齐齐哈尔安徽上海浙江江苏安徽江西桂林湖南香港内蒙古深圳宁夏义乌海南省澳门湛江深圳南京南昌辽宁L易道老庄8046的微博视频收起全文d,3
马龙选手的可爱也是GOAT级别的,0
队明年继续加油新浪乒乓球马龙获年度最佳男运动员恭喜,0
王一博粉丝王一博我正在为王一博打榜王一博已获得14494000票本周实时排名第1名本月第2名wx搜索小程序星饭应援榜加入王一博队伍一起用爱解锁最强福利星饭应援榜,1
马龙队长加油,0
原神早安,2
哟祖马龙可以吗,0
原神原神参见,2
高考完追的第一部剧wyb王一博陪你到世界之巅要说高考完追的第一部剧那必须是王一博在剧中饰演季向空的陪你到世界之巅啊正好6月10日在芒果TV上线高考完正适合看啊电竞题材的剧燃爆青春季向空是个打法另类的电竞高手一直被群众误解想看空空怎么带领战队到世界之巅展开全文c,1
买到了一瓶假祖马龙万恶的代购非说是真的现在它只能沦落到用来喷卫生间了,0
粉丝认证号我刚刚领取了7天闪耀的王一博粉丝认证号No2087228好嗨森成为微博会员即刻保留认证号官方盖章你值得拥有O粉丝认证号王一博,1
王一博羸读léi雷,1
日本开始打新冠疫苗了1如果因为副作用导致死亡国家给4420万日元丧葬费20万7千2没打死的一级残障需要护理每年505万68003不住院在家多给介护84万3000玩命呀疫苗健康2日本日本东京,3
德甲塞弗特新冠本次国家队比赛期间已经有包括霍村前锋阿达米扬莱比锡前锋黄喜灿狼堡后卫庞格拉契奇在内的多名德甲球员感染了新冠塞弗特表示我能够理解各个足协处于经济原因需要去踢比赛但国际比赛应该得到合理安排有些相对不重要的比赛应该被暂停,3
原神这个绝云间和华光林的地貌真的好看应该是参考了武陵源流水侵蚀切割重力崩塌风化作用形成高大石柱林典型的喀斯特地貌谷地其实还可以做点溶洞地下河更大地利用一下地图还有雪山图莹星山洞里的石钟乳和石笋妙啊雪山图真的是挖空了一座雪山太妙了,2
王一博对女嘉宾的感觉王一博态度疏离这个我觉得角度不太对还有用词过于强硬首先不熟悉的男女之间本来就不应该有过多的互动或者接触从绅士的角度来说也应该是两者之间有适当的距离可以算是尊重也可以说是自律如果节目有需要他是会按照节目要求去和女嘉宾互动但是在没有要求的情况下展开全文c,1
2020挑战不可能我们要坚持下去在困境之中求得生路股市高考降薪失业新冠,3
比利时钢琴家尚马龙为中国创作了一首战疫防疫的国际公益曲黎明的钟声CHIMEOFTHEDAWNBELLS歌曲中融入编钟等湖北元素还有一段自己的中文独白夜走了天亮了天空和钟声一同醒来了樱花在温暖的春风中飞扬武汉我们在等你我喜歡的歌詞黑夜終將过去站在黃鶴樓上黎明總會來到L林才竣公的微博视频收起全文d,0
原神原神北斗新的一期角色培养误区视频来啦本期讲解的角色是北斗北斗的主要输出手段并非弹反L哔哩哔哩下雪夜晚的微博视频,2
新冠抗疫行动疫区居民积极主动配合封自家门他们在自家大门外贴上了下面这些愛心字条糖果防疫用品L咱们微博吧的微博视频,3
王一博光耀少年wyb王一博喜欢王一博这件事开始莫名最后心甘情愿地沉沦王一博的魅力就是他甜甜一笑我就没抵抗力希望你开心快乐UNIQ王一博K无感王一博KFire王一博展开全文c,1
党啊清理清理庸政懒政的官员吧把漠视百姓的官员带走老百姓在他们手里没活路啊下面介绍几位欺压百姓的官员因我母亲普通感冒去世为了指出是太原市太航医院的医疗责任我申请了医疗鉴定这个权利是国家赋予每个公民的医疗鉴定中太航医院对我指出的医疗责任无异议不知为何太原市卫健委在拖了1年7个月后竟然剥夺了我的医疗鉴定权太原市卫健委由执法者变为违法者国家法律被他踩于脚下它玩忽职守滥用职权人权被随意剥夺投诉渠道被堵死已无路可走某斌就直接找医生我只能选择网上寻求帮助我实名举报太原市卫健委权力寻租太原市太航医院就是权力的受益者我真诚希望监察纪检卫生系统的上级部门能来审查先查我举报是否属实不属实法办我如果查出太原市卫健委确实违法请对蛀虫别手软我的资料他们2方全有患者儿子李杰日期20199如果本人突然不发贴了那就是在无依法处理医疗纠纷前就被某部门控制自由了那就意味着我的自由人权被侵犯本人既然敢发就无惧后果因为所说全部属实不要总想搞死发现问题的受害者却放了那些制造矛盾违法行政单位山西晚报山西省人民政府国际疫情新冠病毒新冠新冠肺炎疫情疫情全知道抗击疫情抗击新型肺炎第一线人类命运共同体疫情防控全球疫情疫情抗疫抗疫行动海外抗疫日记世界卫生组织谭德塞美国疫情全球疫情每日速递关注新冠肺炎共同战疫男朋友敷衍起来是什么样收起全文d,3
澳元汇率没下限是机会吗最近随着新冠病毒疫情在全球的扩散大家都成为了历史的见证者美股道琼斯指数第6次熔断巴菲特老先生活了89岁终于可以看到股票市场六次熔断了而我们还年纪轻轻就遇到了同此同时全球货币汇也承受了巨大的下行压力O澳元汇率没下限是机会吗,3
王一博陪你到世界之巅王一博极限青春,1
马龙选手比赛加油用户3458728397xv55yjd6e,0
原神迪卢克老爷终于来了现在除了可莉火元素的角色都有了零氪玩家37级现在五星除了老爷还有刻晴和甘雨坚强玩下去,2
新冠病毒疫苗接种问答科普疫苗O新冠病毒疫苗接种问答,3
原神原神可可爱爱的小太阳w米游社末那想要变欧已获得授权,2
原神原神甘雨和美女贴贴,2
想问一下大家魈是带风杯还是攻击杯受益比较大原神,2
