微博内容,类标签
王一博497今天也在努力生活了当然对比一下王一博我觉得我的人生过得大概可以算是特别轻松了就保持这样的心态一直努力活下去吧今天也依然在超级超级爱王一博的路上晚安啦王一博最酷UNIQ王一博,1
北京新增10例麻酱饼说好的雪呢新冠北京身边事北京爆料钟南山称cdc的地位太低了2北京,3
原神三个广告真的好评,2
名品痣今天小葵翻煎饼了吗中国少年如水沉谧从这里走出去一身锐利音乐为弓街头人潮市井马龙间是文化碰撞与交流包容所有视角他领我至巴黎见浪漫热情巴黎带我至温柔月夜遇自由追梦东方歌手蔡徐坤此刻此间东西文化因他互融相通荣幸之至,0
魈wehaveajobtodo原神,2
原神原神尘世的光影,2
原神11剧情即视感图片来源推特原神原神,2
王一博wyb王一博王一博天天向上你喜欢玩滑板我尝试过虽不精但甚喜欢你喜欢尺螺蛳粉好巧我喜欢上螺蛳粉已经一年有余你喜欢榴莲和菠萝蜜开心我也是爱得甚欢窃喜与你拥有越来越多的喜好那样让我感觉和你又更近了一步呢UNIQ王一博今天的你在哪里展开全文c,1
这次的情敌可不是开玩笑哦王一博,1
原神我操,2
啊啊啊啊啊啊啊啊,0
新冠抗疫行动北京疫情经过一个多小时的疏导好像看开了好多东西回家以后也想了好多不管怎么样你们都是最辛苦的人反正暂时睡不着所以送给你们我辛苦的同事们加油ง_ง,3
来啦12月守护爱豆王一博wyb王一博摩托姐姐守护王一博冲UNIQ王一博,1
国庆假期第四天已收纳的小电风扇又返竹岗工作做做家务锻炼身体也是度假的好方式全国乒乓球锦标赛今日上演女团与男团决赛拥有孙颖莎的河北女队最终夺冠晚上拥有马龙的北京队与广东队苦战五场广东男队笑到最后夺冠团体赛比单项赛更难打因为承受的压力更大晚上陪妻在球馆练练球出出汗如果她能坚持锻炼一定会有效果假期过半生活依旧健康快乐人生目标收起全文d,0
愿疫情早点结束武汉加油重庆加油NASA立扫把挑战武汉新冠2重庆茶园新区L扶不起的那笨瓜的微博视频,3
新浪乒乓球马龙现在新生代的冲击都是正常的也希望自己能从他们学到一些东西全国乒乓球锦标赛2020年乒乓球全锦赛,0
两只喵想躲在自己的世界恭喜你吃了吗171名用户获得马龙签名狂飙龙5球拍微博官方唯一抽奖工具微博抽奖平台O高级版对本次抽奖进行监督结果公正有效公示链接O微博抽奖平台,0
罗三炮猪马龙首席合作伙伴,0
原神终于出刻晴啦开心,2
新冠关于新冠肺炎意大利南部奶奶的建议真的是贴心又有趣建议都看下哦疫情一定会过去让我们互相帮助即便是很远的距离L南窗文化生活的微博视频,3
原神摩拉克斯魈图片来自推特已授权链接O网页链接原神原神,2
全民免费接种新冠病毒疫苗4个最新消息北京同心抗疫为爱而行健康科普汇北京疾控提醒您健康北京战疫有我北京战疫新冠肺炎关注新冠肺炎生活百科健康生活新冠终止疫情北京疫情疫情健康大连健康养生健康生活健康小知识健康一冬防疫疫情防控新型冠状病毒加油北京北京抗疫创建全国文明城区抗疫创卫进行时文明大兴青云古镇微博协和胖大夫潘慧北京大兴北京发布首都健康微信公众平台京南福地医药圈爱我大兴社区网健康大兴北京市社区卫生服务管理中心北京大兴北京健康教育北京市城市管理委员会L北京市大兴区青云店镇中心卫生院的微博视频收起全文d,3
是丽莎她总叫我小可爱此时大家一定在想这是哪个菜狗画画指绘原神丽莎同人,2
我正在游戏新春市集抢原神的礼包晒游戏最牛道具赢原神游戏福利11O游戏新春市集原神,2
原神bgm太好听了,2
新生儿疫苗萌娃养成记关于新生儿疫苗接种你是否有以下疑问接种疫苗后是不是就一定不得传染病了孩子接种疫苗能提前或延迟么两种疫苗是否可以同时接种为什么接种疫苗后要留观至少30分钟2杭州杭州菁华妇儿医院L杭州菁华妇儿医院的微博视频,3
原神为啥上热搜,2
王一博麻烦你用笑容治愈我吧O绿洲,1
陈情令肖战王一博晚上享受电影般的视觉效果是给自己的小小私人空间大屏电脑和好的音箱是必须的天呀姐姐入坑了怎么办,1
肖战王一博因为陈情令爱上你们的颜和演技但是更爱看你们越来越好往后会更好所以不管是怎样的你们我们都爱不用担心tls677tzy转发微博,1
王一博wyb王一博平安喜乐好心疼啊看一博捂着胃要哭了一博一定要照顾好自己好好吃饭胃不好一定要好好养胃一博UNIQ王一博,1
晶视频戴眼镜不容易得新冠最新研究称戴眼镜者感染几率较低中国研究人员在美国医学会杂志眼科学卷上发表的一篇论文提出佩戴眼镜可能对预防新冠提供一定程度的保护这个来自湖北省随州市曾都医院的研究小组称该小组分析了医院的276名新冠肺炎患者其中只有58的患者每天佩戴眼镜超过8小时而湖北省的近视人群占总人口的315这表明戴眼镜可能起到预防感染病毒的作用戴眼镜防新冠晶视频L晶视频的秒拍视频收起全文d,3
2018中国乒乓球队瑞典团体世乒赛热身赛赛程男队4月15日1430男一队vs男四队男一队马龙樊振东许昕男四队方博闫安夏易正,0
重复笑肖战王一博,1
原神目前来说大家认为真正意义上的专武有哪些,2
新冠深圳防疫急寻同车密接者经过深圳惠州潮汕等地3月14日福建省厦门市通报新型冠状病毒肺炎疫情情况其中有人曾从南非入境深圳在深圳隔离14天后乘坐D2284次动车返回厦门随后在厦门检测出阳性诊断为新冠肺炎无症状感染者,3
借火柴的小纸团儿我死亡西瓜冰茶来一杯亲亲阿盐啊真可爱了果窖_1988马龙这一眼看过来基本无人生还被可爱死,0
安柏twinaha07455336原神二次元推,2
注意啦多家保险公司延长拓展新冠保障时间疫情再度严峻内蒙古赤峰市进入战时状态河北疫情梧桐君提醒大家要做好防护梧桐树保险经纪与您共抗新冠肺炎梧桐君寄语关注梧桐树保险网进入我们的主页可以获取更多保险相关知识哦如有任何保险相关疑问私信必回,3
原神圣遗物笑话系列呦呦呦这不是双暴攻圣遗物嘛鬼原神原神,2
原神大家比较绝缘的四星角色是谁,2
JK罗琳出现新冠症状后康复著名哈利波特系列小说作者JK罗琳发推表示她在过去的两个星期经历了所有新冠感染的特征但没做检测称目前她已经完全康复她表示是接受了自己身为医生的丈夫NeilMurray的建议称技术帮了很多忙并分享了一个医生关于如何缓解呼吸系统症状的建议收起全文d,3
永远的Vicky回复感情在左那不是奥运临近没有时间给他慢慢康复了吗人家做个微创手术都要恢复个一年多又是生理又是心理的马龙这么大手术两个多月瘸着腿就上去了哎谁能想到当年害羞怕黑内向的小奶龙长成了向死而生的铁血战士以自己的血肉之躯撑起国乒队的半壁江山,0
近日芬兰因出现变异新冠病毒导致该国疫情持续恶化鉴于此当局决定宣布进入紧急状态芬兰政府将有权关闭餐馆进一步关闭学校以及限制地区间人员流动等世卫组织卫生紧急项目负责人迈克尔瑞安在3月1日世卫组织举行的新冠肺炎例行发布会上称年底前结束疫情的想法还为时尚早较为不现实聪明的做法是尽可能减少住院病例数量中国专家钟南山称全球群体免疫需两至三年须以科学为基准由此可见疫情结束犹如病好如抽丝是一个循序渐进的过程还需要一段时间的努力在此期间戴口罩是性价比最高的防疫方式为了保证口罩的持续供应口罩生产不能停歇目前全球公认的制造业大国就是中国2020年中国累计出口口罩2242亿只防护服231亿件护目镜289亿副外科手套292亿双呼吸机271万台检测试剂盒108亿份中国制造的口罩呼吸机等医疗类商品被全球市场广泛采购并一度成为全球硬通货据统计中国在2020年相当于为全球每个人提供了40片口罩中国如此高效的口罩生产得益于先进的口罩生产技术和智能口罩设备从制造到智造的转变正是中国制造业的飞速发展的马达suntech以50年的技术沉淀和设计经验以精工制造标准研发生产智能纺粘无纺布机纺熔无纺布机和熔喷机助力中国口罩生产助力人类健康全球疫情收起全文d,3
原神有没有大佬告诉我咋整,2
马龙也开始好好拍mv了新专质量爆炸,0
悬空术嘛原神原神,2
原神150点血的我在神像面前变成了穿山甲L叫我孔方大人的微博视频,2
原神原神魈今日份高兴,2
王一博哇先马着,1
王一博web王一博有匪,1
因疫情暂时关闭的5A级景区神仙居景区2月20日重新开放同时神仙居旅游集团下属淡竹休闲谷永安溪漂流永安溪绿道景区也一并开放全国医务人员免门票哦新冠医务人员丁香医生2临海市,3
魔都cos招募上海cos招募原神原神coscosplay大佬们快来玩啊已有角色女主温迪可莉芭芭拉阿贝多暂定皇女丽莎等所有人衣服出货后定时间微审颜最好出过片注仅蒙德不接受心态随意玻璃心公主病,2
原神作为一款手游还能说原神什么呢感动2北京回龙观,2
王一博王一博王一博王一博王一博王一博王一博王一博王一博王一博王一博王一博就算荧光棒变成了拐杖你也依旧是我的信仰UNIQ王一博L用户7175182446的微博视频,1
王一博粉丝王一博我正在为王一博打榜王一博已获得2315307票本周实时排名第3名本月第5名wx搜索小程序星饭应援榜加入王一博队伍一起用爱解锁最强福利星饭应援榜2河池都安瑶族自治县,1
98太狠了乔鲨佛还有手套这种攻守都超强的控卫马龙就不说了得分第二,0
真的介意萌新不要去抽up池以外的卡一万r也是够黑的了入坑一个月原神2汕尾,2
粉丝认证号我刚刚领取了7天闪耀的王一博粉丝认证号No1074970好嗨森成为微博会员即刻保留认证号官方盖章你值得拥有O粉丝认证号王一博,1
怎么这么可爱啊啊啊啊啊啊啊啊王一博,1
马龙马龙杜塞尔多夫世乒赛加油两个小可爱饞嘴路过这儿,0
我们是不是没有批评的权利了我国每68名孩子中约有1名患自闭症云南新增4例本土确诊云南新增4例本土确诊反复低俗营销该重罚吗疫苗陈情令山河令电视剧锦心似玉大宋宫词股票,3
拜仁前锋格纳布里今天早些时间被爆新冠检测呈阳性他将在家进行隔离治疗目前足坛确诊新冠的球员越来越多但对应的复出速度也是越来越快对身体素质强悍的职业球员来说新冠是不是小菜一碟,3
画的是可莉原神可莉,2
王一博舌尖的诱惑今晚炒个大白菜吃深夜食客Ⅲ晚上准时营业了httptcnEM53RpXhttptcnEM5iGhu,1
2019最值得买的美妆日历大盘点今年美妆圣诞倒数日历你偏爱哪一家每天一个惊喜礼物O网页链接本君特选美妆护肤超多圣诞倒数礼盒竟然已经发售了祖马龙Diptyque欧舒丹兰蔻阿玛尼超多礼盒现已公布O网页链接,0
王一博Lucky我来了,1
菲律宾NickelAsia暂停一矿山运营因爆发新冠疫情10月28日讯据外媒消息菲律宾最大的镍矿石生产商和出口商NickelAsia公司周三表示在新冠疫情爆发后该公司已暂停了其四个矿山中一个矿山的运营①NickelAsia在一份声明中称作为遏制措施公司旗下位于Caraga地区镍矿中心的Hinatuan矿工作已在周二暂停直至11月10日此前19名员工新冠肺炎测试呈阳性Hinatuan矿位于SurigaodelNorte省去年产量占NickelAsia矿石总销售量的11②菲律宾是中国镍矿的替代供应来源中国主要依靠印尼的高品位矿石但是印度尼西亚暂时禁止出口未经加工的矿物菲律宾的矿石用于制造镍生铁这是中国庞大的不锈钢行业的原料③NickelAsia表示其子公司HinatuanMiningCorp已从10月19日起将整个矿场封锁七天然而该矿所在的Taganaan市政府已下达了封锁该矿的命令直到发出进一步的命令为止该公司预期Hinatuan矿山关闭不会对其业绩产生重大影响因为该矿已经处于采矿季节的尾声新冠疫情镍镍矿期货收起全文d,3
原神太难了想要个老卢想要个温蒂2徐州沛县,2
原神说实话什么时候宝贝心肝女儿复刻啊广告都打了你倒是复刻啊,2
原神原神明霄升海平机关棋谭机关棋谭挑战视频征集活动今日开启期待旅行者的精彩视频投稿活动时间2021年2月10日2021年3月4日参与方式在原神中带机关棋谭的tag发布机关棋谭挑战活动相关视频即视为参与活动1视频内容需与机关棋谭活动相关2视频内容不限包括但不限于打法攻略创意玩法等内容打法攻略活动打法讲解通关技巧展示阵容搭配讲解快速通关技巧创意玩法展示与机关棋谭活动相关的趣味剪辑视频尺寸时长不限竖版视频横版视频均可参加更多详情请查看下方长图收起全文d,2
低情商你帮我打一下深镜螺旋高情商你想不想试玩儿一下我的角色原神原神低情商高情商2AmericanNewJerseyHudson,2
我在京东发现了一个不错的商品赶快来看看吧经喜道足金999十二生肖酉鸡黄金礼品摆件收藏投资礼物纯真金属羊虎兔马龙蛇猴鸡狗猪送亲人朋友保值增值亥猪京东经喜道足金999十二生肖酉鸡黄金礼品摆件收藏投资礼物纯真金属羊虎兔马龙蛇猴鸡狗猪送亲人,0
马龙希望大家每场都这么争气这样哥哥就会很开心哈哈,0
我参与了花城YiBo发起的BioE品牌代言人王一博王一博0805生日快乐我投给了王一博0805生日快乐这个选项你也快来表态吧,1
我都喜欢王一博,1
司法太原市要创建全国文明城市请先把太原市卫健委的曱甴抓干净吧这样举全市之力创文明城市是哄鬼呢老百姓会信你们你们捞政绩老百姓的事没人管少点标语口号公务员上街装样子捡烟头搞点实际的吧为民服务他不行祸害百姓他第一因我母亲普通感冒去世为了指出是太原市太航医院的医疗责任我申请了医疗鉴定这个权利是国家赋予每个公民的医疗鉴定中太航医院和太原市卫健委对我指出是医院的医疗责任以及病历的缺失无异议但不知为何太原市卫健委在拖了1年7个月后已过法律时效同医院又一起否认当时我指出的医疗责任为何有操作有内幕还剥夺了我的医疗鉴定权自此我丧失了可以定责医院的权利国家给公民解决医疗纠纷的渠道被野蛮堵死太原市卫健委由执法者变为违法者国家法律被他踩于脚下我人权被剥夺投诉渠道被堵死已无路可走我只能选择网上寻求帮助我实名举报太原市卫健委权力寻租太原市太航医院就是权力的受益者我真诚希望监察纪检卫生系统的上级部门能来审查先查我举报是否属实不属实法办我如果查出太原市卫健委确实违法请对曱甴别手软我的资料他们2方全有患者儿子李杰日期20184如果本人突然不发贴了那就是在无依法处理医疗纠纷前就被某部门控制自由了那就意味着我的自由人权被侵犯本人既然敢发就无惧后果因为所说全部属实不要总想搞死发现问题的受害者却放了那些制造矛盾违法行政单位sxrtv新闻中心山西综合广播太原中院太原晚报奔涌吧后浪后浪青春共筑防疫长城美利坚灯塔国美国人权美国大选川普总统美国国债我愿意为你守护ATV头条日报香港头条大公网TVB香港商报华星卫视新闻亚洲电视法国那些事儿法国新闻欧洲新闻新冠病毒新冠新冠肺炎疫情疫情全知道抗击疫情抗击新型肺炎第一线人类命运共同体疫情防控全球疫情疫情抗疫抗疫行动海外抗疫日记世界卫生组织谭德塞美国疫情全球疫情每日速递关注新冠肺炎共同战疫国际疫情收起全文d,3
肌肤之钥祖马龙香水苹果11pro好像有点贪心哈,0
新冠1病毒不会自动停止没有强有力的防控隔离措施根本遏制不住防控为第一步也是最重要的自始至终都要进行的2医疗防护物资不充分会导致病情恶化病毒的进一步传播3在没有彻底消灭病毒之前或者没有做好严密的防控之前不能轻易随便复工复学4目前全球来看完全控制不住因为各国各地发展的不平衡但是病毒要求一视同仁整齐划一5所以短期而言局部可以控制长远来看人类逃不过人类自身的命运6如果局部可以控制其他人死去剩下中国人独自地球美丽收起全文d,3
新疫苗一览欧盟已批准的三个BiontechModerna和AstraZeneca待批准的三个CurevacJohnsonundJohnsonNovavax新冠病毒疫苗2019冠状病毒病L德语健康汇的微博视频,3
不要忘记新冠,3
30ml的祖马龙专柜版的贼精致如果你想要一款好闻不大众不容易撞香又比较有bigger的香水优先推荐祖马龙基本上每个味道都不踩雷9味现货黑莓油桃花牡丹青柠橙花海盐蓝风铃英国梨红玫瑰108香水种草香水种草平价好物种草小红书宝宝的少女心L大牌口红平价买的微博视频收起全文d,0
如每10万人中感染超过150例餐饮业将再次面临关闭目前已有多个自治区超过此数西班牙西班牙疫情疫苗公共卫生委员会开会讨论有关协调应对疫情行动的最新文件此前于10月22日更新被称为健康交通信号灯其中考虑了根据自治社区的不同警报级别对将要采用的建议进行强化根据卫生部警报报告自3月3日以来起草的草案建议关闭在过去14天内每10万居民中有150例以上发病率地区的接待场所内部该草案必须在公共卫生委员会中得到批准并从那里提交给国家卫生系统区域委员会该部门和社区将必须在其中获得最终批准无论如何似乎都不会在圣周之前获得批准根据这份文件自2020年10月22日起的最新版本警报级别为3级在过去14天中每10万居民中有150至250例病例卫生当局应评估场所内部区域的封闭情况否则应将容量减少到最小并禁止在吧台消费但是在最新辩论中此措施得到了加强并建议社区在警报级别3和4的那些地区中也就是说从150病例开始场所内部的服务将受到限制如果病例超过500例则完全关闭除其他新提议外还引入了露台的容量限制将其设置为50并确定了时间限制此外草案提及如果总趋势呈上升趋势每10万例中有500例以上则关闭营业所仅允许外带和外卖送货的服务在第4级警戒级别上新草案提议针对婚礼洗礼等推迟任何类型的仪式并在第3级警戒区内的封闭空间中最多容纳10人在有关社会和家庭关系的措施中本文件的更新内容包括在警报级别为4的区域也就是说在过去的14天中每100000居民中有150例病例的地区公共和私人领域的聚会最多可以容纳四人同居者除外参加同样对于警报级别为3的区域敦促尽可能将稳定的同居群体之外的社交联系限制并将社交聚会限制为最多六个人其他新提议是关于工作的要求特别是在3和4级的区域避免见面吃饭或喝东西以促进远程办公这是10月文案中未包括的一段根据卫生部3月24日发布的最新报告全国14天的累积发病率为每10万居民中有132例但以下五个自治区是150例以上Asturias159加泰罗尼亚172马德里228Navarra185和PaísVasco199以及以下两个自治城市Ceuta253和Melilla51192西班牙收起全文d,3
原神冲,2
原神原神仅存的两个十连歪了个刻师傅送的15个星辉换了三发第一次角色保底就这样出来了2天津,2
2021开工第一天感觉又和boss吵了一架感觉做上司的想要什么东西一定要传达清楚不能让人猜没有人会完全了解另一个人哪怕默契再足也无法做到新的一年调整好心态有些东西不要太过执着温和从容淡定得体的解决问题未雨绸缪避免再像上一年一样兵荒马乱吧晚上回家装好了伸缩杆没事可以做做引体向上装好了纸巾盒再也不用到处找纸巾了祖马龙香水的味道真好闻呀比迪奥之类的高冷多了个人很喜欢快12点了装好淋浴架之后就去睡吧睡前可以做一段骨盆拉伸晚安好梦明天早起收起全文d,0
比起惊讶更多的是惊喜吧这也太好了元神胡桃终于上线了真的好喜欢啊全球游戏联盟原神原神胡桃啊是胡桃没有白等原神这波热度又稳了,2
王一博人处在很糟糕的情况下会忘记很多东西也会做出很多错误的判断人处在颠峰状态下结果就完全不一样了,1
你们先抢东西抢完再立刻回来多多主页抢祖马龙和1111我等你们噢,0
一步一步来mickylydia马龙2019年加油做好当下的事儿小马加油,0
有姐妹知道其其2小时直播那场后面的香水是什么牌子的嘛除了那个勇士杯是不是还有一款祖马龙的黑鸦片啊好想知道呜呜呜,0
OSUNews韦克斯纳医学中心把体育馆设为疫苗接种地点从1月19日起韦克斯纳医学中心WexnerMedicalCenter将把JeromeSchottensteinCenter作为OSU疫苗接种地点率先为患者提供接种随后向公众开放医疗中心估算每天可以提供3000多人次疫苗接种OSUOSUNews疫苗,3
分享王一博动态的绿洲动态王一博吃饱再下班啵啵一口能吃下的绝对不分两口O绿洲,1
甘雨老婆给您请安了这沙漏我愿称之为提瓦特冰套沙漏最强原神原神甘雨,2
原神爸爸带孩子图片来自推特已授权原神原神,2
是的曲今果窖_1988希望国乒就主力的伤病恢复问题再多想点办法吧马龙真的很不容易了今年带领团队一路过关斩将还有帮助国乒教练组过度现在也不知道恢复情况如何了明年是大赛单项年真的伤病不能再反复了,0
应该是王一博弟弟,1
太牛了王一博奶宣站王一博wyb王一博天天向上目瞪口呆精彩到鸡皮疙瘩都起来了UNIQ王一博王一博,1
新浪保险i保日新冠保险新冠反复买什么保险合适小浪保为大家准备了12万疫苗保险金点击免费领O网页链接担心住院开销选医疗险担心后遗症影响赚钱能力选重疾险担心身故选寿险担心就医紧张选高端医疗险保险,3
马龙晚安captain龙,0
一笑给啵啵搓澡1UNIQ王一笑UNIQ王一笑王一博wyb王一博代言肯德基独家圣诞福利等你查收哦UNIQ王一博,1
新冠有个问题马上天热了蚊子出来了这个病毒会不会被蚊子传播啊有没有专家解答一下啊好害怕,3
新冠月余疫除终胜此后百年风调雨顺国泰民安2嘉峪关L惠声慧色与年华的缩影的微博视频,3
王一博我呼唤沉落的夕阳呼唤森林呼唤大海和人名回声全都是你的名字晚安UNIQ王一博O绿洲,1
原神原神七七试下新风格,2
不问终点全力以赴你值得最好的一切马龙谢谢你满足并超出我对美好的所有所能的想象愿你被温柔以待健康快乐追逐所爱马龙获年度最佳男运动员,0
王一博王甜甜宝藏男孩请尽情散发你的魅力你只管优秀我只管你哦2湘西土家族苗族自治州保靖县Lsunshine6787851191的微博视频,1
叝9名军官办集体婚礼他第一次对妻子说土味情话相守一生是不变的承诺7月29日云南马龙县八一建军节前夕南部战区陆军某训练基地9名军官办集体婚礼婚礼上9对新人相拥并互换戒指一位新郎第一次对新娘说土味情话相识是缘相知是爱相守一生是我不变的承诺新娘感动得热泪盈全文O网页链接收起全文d,0
王一博王一博有翡dd真是神仙落泪跟gg一样也是哭美人ttxs2016第一期两个河南弟弟刘昊然互动太有爱了爬个墙喜欢昊然弟弟盯dd昊然弟弟歪头杀给dd擦眼泪好乖好奶的两只两个男孩子在一起真是太美好了Ps展开全文c,1
美国疫苗翻车多人死亡有效率只有29疫苗寻找快手巴菲特我为爸妈刷面墙快手快手为特朗普冲业绩L财经小爱的快手视频,3
王一博晚安宝贝,1
虽然五星是保底但架不住这次四星多啊原神甘雨原神,2
谁能告诉我这个官方dc频道怎么用原神,2
Watermelon_王一博资源博王一博王一博天天向上饭拍210117期天天向上录制UNIQ王一博王一博,1
内地女歌手沈佳欣公开质疑钟南山院士这个自称是内地女歌手的沈佳欣网络上的粉丝有一百多万个人简介是华谊兄弟旗下艺人发文公开质疑钟南山院士并且言辞犀利作为一个一百多万粉丝号称歌手的公众艺人说这么不靠谱的话做这么愚蠢的事真的不应该钟南山院士在新冠疫情期间的一举一动都在全国人民眼里和心里他的付出可能是整个娱乐圈都无法比拟的如此歌手有何资格去评头论足该封沈佳欣无下限拿钟南山院士开玩笑其心可诛新冠钟南山收起全文d,3
原神零氪党攒了20发,2
原神原神甘雨椰羊画了张椰羊头卡池没有几天了看来是没希望抽到了,2
王一博王一博真的好帅好好看尬黑的yxh和强行眼瞎的水军立刻升天背后推手炸成烟花L2046號列車的微博视频,1
王一博希望以后平安健康,1
原神入坑十日纪念希望不要再抽到芭芭拉了,2
