微博内容,类标签
因我母亲普通感冒去世为了指出是太原市太航医院的医疗责任我申请了医疗鉴定这个权利是国家赋予每个公民的医疗鉴定中太航医院和太原市卫健委对我指出医院的医疗责任无异议但不知为何太原市卫健委在拖了1年7个月后竟然剥夺了我的医疗鉴定权它玩忽职守滥用职权人权被随意剥夺投诉渠道被堵死已无路可走某斌就直接找医生我只能选择网上寻求帮助我实名举报太原市卫健委权力寻租太原市太航医院就是权力的受益者我真诚希望监察纪检卫生系统的上级部门能来审查先查我举报是否属实不属实法办我如果查出太原市卫健委确实违法请对蛀虫别手软我的资料他们2方全有患者儿子李杰日期20199如果本人突然不发贴了那就是在无依法处理医疗纠纷前就被某部门控制自由了那就意味着我的自由人权被侵犯本人既然敢发就无惧后果因为所说全部属实不要总想搞死发现问题的受害者却放了那些制造矛盾违法行政单位国际疫情新冠病毒新冠新冠肺炎疫情疫情全知道抗击疫情抗击新型肺炎第一线人类命运共同体疫情防控全球疫情疫情抗疫抗疫行动海外抗疫日记世界卫生组织谭德塞美国疫情全球疫情每日速递关注新冠肺炎共同战疫吉他收起全文d,3
在发行了接近11小时后我宝除了先行曲和与马龙合作单曲外其他的歌曲均被一把子卡在美区iTunes100开外与之对比的是lover发行八小时后全专歌曲进入前100不管怎样我相信目前这样的成绩只是美国人民喜欢在情人节赖床的缘故在美国人民起床之后我宝一定能够如破竹之势般血洗iTunes的贾斯汀比伯新专抄袭比伯抄袭收起全文d,0
原神原神原神微信红包封面原神50万份春节限定微信红包封面即将上线亲爱的旅行者原神50万份春节限定微信红包即将上线2月11日2月15日每日中午1200限量发放10W份红包封面数量有限请旅行者尽快领取哦领取方式方式一打开微信搜一搜搜索原神即可点击对应位置免费领取春节限定微信红包封面方式二进入原神微信公众号发送消息原神到消息界面点击tag快速跳转前往领取红包封面兑换码自领取之日起3个月内有效请旅行者们尽快兑换红包封面有效期自兑换之日起3个月内有效请旅行者们尽快使用更多详情请查看下方长图收起全文d,2
就这一刻疫苗安排上了就是有点小困,3
新冠流感兄弟二人运输偷渡人员不成想引入致命病毒弟弟因此丧命并引起大传播看着好心痛大家有什么看法欢迎留言点赞L蛋疼的生活揉著也要過孩儿的微博视频,3
二中马龙我可太爱龙哥了,0
这些白虾不是都白瞎了吗快哭了快哭了解决办法边吃大虾边喝圣水效果杠杠滴新冠圣水大虾,3
期待期待是马龙啊,0
王一博世界上没有丑女人只有懒女人,1
今天和建筑室内灯光设计的人一起开会感慨好的开发商是真良心一针见血指出些问题我很喜欢日本人扣细节的态度一个项目概念阶段已经开了5次以上的会真是很认真为自己的project骄傲今天我问老板为什么日本和美国都可以出那么多普利兹克奖得主他说可能日本传统建筑蛮符合当代流行趋势买了西米推荐的雅诗兰黛精华安慰自己熬最晚的夜用贵的化妆品我的bodylotion也用完了也想买蜡烛国内祖马龙好贵5年内的愿望是可以集齐所有喜欢味道的香水和蜡烛贫穷让我又开始自己做饭了傅雷家书很好看我很欣赏傅雷这个人20190312收起全文d,0
发布了头条文章乒乓球技术的粘合剂马龙曾应用最好现已退步樊振东也不错O乒乓球技术的粘合剂马龙曾应用最好现已退步樊振东也不错,0
每次听马龙的歌我都放外音后来的后来室友说我唱歌不跑调了感谢马龙,0
海报强尼弗林主演的大卫鲍伊传记新片星尘发布正式海报本片卡司还有吉娜马隆马克马龙美女摔角联盟吉娜饰演鲍伊的妻子马克饰演鲍伊的唱片公司宣传人员影片由加布里尔朗格我是奴隶执导克里斯托弗贝尔操刀剧本故事讲述年大卫鲍伊第一次造访美国这次旅程,0
只能任由回忆填充空虚的情怀年轻时当遇到了合适的人正在这个地方对机会不屑一顾复杂也好他或她就有可能成为她或他的人一旦失去了马龙2湖州木桥村,0
原神原神魈cos偷偷问一下像吗帅吗好看吗修图修的看不出感觉了,2
日上免税店有没有祖马龙香水TFYSL口红要有凭证和包装送人用的最好在途能尽快拿到货的,0
原神这个丘丘人好像在看海灯节的宵灯还在频频点头原神原神汇成明霄L原神海外搬运的微博视频,2
虽然我并没有看不起鲜花饼的意思但说我今晚挑的侍寝香祖马龙英国梨是玫瑰鲜花饼的味道我觉得你有点过于秀了,0
王一博奶宣站王一博wyb王一博猫头们打投辛苦啦又一罐奶粉到手,1
老百姓的命也是命天天讨论人权中国老百姓的人权如黑人般被踩在脚下老百姓的命不如黑人的天理何在太原市卫健委就是法外之地他撒谎他欺骗他推诿他敷衍他给脸色他不担当他不作为他无视法律他每个字都不能信他用幻想出的外国法律来判中国的医疗纠纷扰乱了医疗环境他就是医害太原市卫健委当代汉贼山西的监察纪检你们在那把这些欺压百姓的官员带走吧老百姓没活路了可以对质我敢就怕太原市卫健委不敢为民服务他不行祸害百姓他第一因我母亲普通感冒去世为了指出是太原市太航医院的医疗责任我申请了医疗鉴定这个权利是国家赋予每个公民的医疗鉴定中太航医院和太原市卫健委对我指出是医院的医疗责任无异议但不知为何太原市卫健委在拖了1年7个月后已过法律时效同医院又一起否认当时我指出的医疗责任为何有操作有内幕还剥夺了我的医疗鉴定权自此我丧失了可以定责医院的权利国家给公民解决医疗纠纷的渠道被野蛮堵死太原市卫健委由执法者变为违法者国家法律被他踩于脚下我人权被剥夺投诉渠道被堵死已无路可走某斌就直接找医生我只能选择网上寻求帮助我实名举报太原市卫健委权力寻租太原市太航医院就是权力的受益者我真诚希望监察纪检卫生系统的上级部门能来审查先查我举报是否属实不属实法办我如果查出太原市卫健委确实违法请对蛀虫别手软我的资料他们2方全有患者儿子李杰日期20199如果本人突然不发贴了那就是在无依法处理医疗纠纷前就被某部门控制自由了那就意味着我的自由人权被侵犯本人既然敢发就无惧后果因为所说全部属实不要总想搞死发现问题的受害者却放了那些制造矛盾违法行政单位澳大利亚驻华使领馆澳洲镜报MirrorNews美国侨报网ABC澳大利亚ATV头条日报香港头条大公网TVBTVB剧评社香港文汇报香港商报华星卫视新闻亚洲电视法国那些事儿法国新闻欧洲新闻新冠病毒新冠新冠肺炎疫情疫情全知道抗击疫情抗击新型肺炎第一线人类命运共同体疫情防控全球疫情疫情抗疫抗疫行动海外抗疫日记世界卫生组织谭德塞美国疫情全球疫情每日速递关注新冠肺炎共同战疫国际疫情张晋跳无价之姐收起全文d,3
走啊去炸鱼一只小可莉原神可莉超轻粘土手办,2
希望祖马龙学学贤合庄的留香昨天吃的刚才挂在阳台的衣服还是呛到我了怕是废了2诸城市,0
没有大波浪我也喜欢黑鸦片最近浓烈的香闻多了下次该入个小清新文艺的了祖马龙是首选了哦2齐齐哈尔L普罗旺喵喵的微博视频,0
原神想强氪满命五星的话先充个10w吧,2
王一博西南联大时期教授们的月薪在19381939年间还能维持一家人三个星期的生活后来物价飙升就不能撑到下半个月了梅贻琦的夫人视力不好就与人合作制作定胜糕隐含一定胜利之意梅夫人每天挎着篮子步行45分钟到冠生园寄卖碍于梅贻琦校长的面子卖糕时梅夫人遮遮掩展开全文c,1
新闻看点首先国乒未来还是属于樊振东的这句话最开始源于杜塞尔多夫世乒赛当时男单决赛马龙在决胜局落后时力挽狂澜最后1210击败樊振东获得第二个世乒赛男单冠军在赛后新闻发布会中马龙面对媒体还跟师弟樊O遭遇职业生涯最大瓶颈未来还是樊振东的吗,0
王一博wyb王一博有翡愿你安好祝你平安晚安UNIQ王一博,1
Hello马龙小哥,0
刚看到消息进入的北京的必须持有核酸证明河北的车牌进入北京一律劝返严格才能出结果有序防控河北本轮疫情仍是境外输入病毒新冠,3
逛街逛到腰酸腿疼的一天陪朋友去试了祖马龙的香发现有几支味道还蛮戳我的好像是鼠尾草与海盐蓝风铃青柠罗勒与柑橘又是2021真香打脸系列品牌热卖沙龙香还是有道理的MCM新出的盒子包很好看但好重单拎都重中看不中用粉色大托特倒是挺喜欢的也很能装除了没有拉链这个缺点也许可以找代购看看有没有合适的价Gucci打烊了还想说去试试我想要的那支戒指真可惜不过也帮我省钱了至少今天今天还吃到了上上谦这家在杭州的老洋房里建筑蛮有特色的我很喜欢就是店面风格也太迷惑了就老老实实做成老上海民国复古的风格不好吗内饰本来蛮好看的偏偏又整一大堆霓虹灯瞬间low成夜店风没有说夜店都很low的意思有点糟蹋这么有韵味的老建筑了湖滨银泰大概是我在杭州最喜欢逛的商圈别的也去得不多不过这里是真的还蛮推荐吃饭逛街游玩全都有光是湖滨银泰in77就4个区大概5栋楼对面还有工联cc附近好像也有几个老商场in77旁边就是西湖吃完饭出来沿着西湖散步也不错总之大力推荐收起全文d,0
盲猜59凌晨一点狗霉宣布残夏打单feat马龙然后带了预告封面如果是假的那就当我随便说说本来也是随便猜的ㅋㅋㅋㅋTaylorSwift你说呢,0
原神一发入魂冰系兔兔伯爵就太喜欢了完美,2
看到陈叔的音乐会要开了在广州如此近可是去不了前几天看到老大要参加世乒赛选拔赛了还没消化掉这份久违的激动与开心今晚就心碎了原因不明但是失望是真的老大有生之年我还能看到你出现在大赛赛场上吗听说新赛制特别坑方博周雨他们恐怕都熬不出头了要被新人保护政策玩儿死了更遑论你这个特老的老将肖爸早就走了月半也走了现在的男乒还能看谁曾经的科龙蟒已经成了绝唱现在是龙蟒胖的天下可是马龙和许昕还能打多久还是未知数如果大蟒也谢幕了我大概再也不会看了曾经你说你热爱乒乓球即使你离开了也希望我们不要停止关注这一项你爱的运动可是老大没有了你的男队我看的索然无味输赢都没了心潮起伏就这样吧你的时代过去了一个时代都过去了看到洛枳更博了橘生淮南为何还遥遥无期呢很多人说以前二熊是最好的唯一的洛枳而现在洛枳是朱颜曼滋曼滋真的是有洛枳那股子劲儿从气质到眼神从外在到内在俗话说好饭不怕晚但也不能太晚了吧收起全文d,0
原神交易自打温迪刻晴二命要的直接私没邮箱打王者没时间玩了原神2十堰,2
抗议者背手伏地呐喊我无法呼吸美国退出联合国人权理事会联合国人权高专谴责美警方暴力执法联合国人权二十周年联合国人权联合国人权高专联合国人权理事会联合国人权高专办联合国人权专家联合国人权委员会联合国核心人权文件汇编张伟主编全球疫情美国美国疫情新冠病毒新冠新冠肺炎疫情疫情全知道抗击疫情美利坚美利坚灯塔国威虎堂军事新闻茶余饭后我的2020新闻启示录美国部分示威者焚烧美国国旗美国部分示威者焚烧美国国旗美国明尼阿波利斯市进入紧急状态美国500多名士兵前往明尼阿波利斯等地美国示威现场发生枪击事件美国警察暴力执法致黑人死亡引抗议黑龙江吉林新闻哈尔滨新闻新疆塔里木北京天津生活河北燕京贵州云南西藏陕西身边事西安甘肃青海山西河南浙江湖北山东四川广西福建两广两湖广州从化齐齐哈尔安徽上海浙江江苏安徽江西桂林湖南香港内蒙古深圳宁夏义乌海南省澳门湛江深圳南京南昌辽宁L易道老庄8046的微博视频收起全文d,3
王一博黄婷婷有多少天真倔强有多少在意和付出有多少维护和期盼就有多少心酸心寒多少失望绝望这个事件中说婷婷人设崩溃的说对她失望的说离开的看看前面那句话把黄婷婷当做主语再读一读你能高调或默默离开她是没地方没时间哭告诉你们有什么用呢这是第一次她真的告展开全文c,1
王一博粉丝3王一博我正在为王一博打榜王一博已获得26336990票本周实时排名第1名本月第2名wx搜索小程序星饭应援榜加入王一博队伍一起用爱解锁最强福利星饭应援榜,1
原神钟离达达利亚图片来自推特已授权更新不是吧阿sir这也能挂原神原神,2
王一博王一博晚安晚安今晚听的这首歌分享王胜娚的单曲不打搅的星期几O不打搅的星期几来自网易云音乐,1
这是我最后一件李宁no不w不on不flag不要立了说好的关紧李宁的衣柜呢抽抽抽抽抽小疯这一定是我今年买的最后一件李宁了果窖_1988之前评论有问马龙这件定制的在这里有预售,0
原神无抽无命白嫖角色芭芭拉一轮秒杀满级风魔龙L徐润一的微博视频,2
新冠今天单位组织打新冠疫苗请问有副作用么想临阵脱逃了,3
粉丝认证号我刚刚领取了王一博粉丝认证号No2102094马上领取粉丝认证号官方盖章你值得拥有O粉丝认证号王一博,1
几天来荷兰民众对新冠测试的兴趣日益浓厚GGDGHOR保护伞组织的发言人在deVolkskrant的报告中证实GGD的申请量是往常的一倍还多高达62根据她的说法今天甚至有一个申请测试的高峰然而因为突增的测试人数测试者一般需要等到一至两天才能参与测试新冠,3
原神魈和钟离的新旧官方图对比原神,2
要提前吃退烧药健康疫苗不是发烧确实是疫苗的常见不良反应但也只是一小部分孩子会出现如果出现发烧而且烧得难受可以吃退烧药缓解不适但没必要常规提前吃退烧预防发烧,3
Yi点日常原神,2
原神新角色甘雨你们喜欢吗原神原神新角色甘雨你们喜欢吗,2
王一博梦幻独家营业wyb王一博梦幻西游三维版网易梦幻西游三维版携手代言人王一博亲临三界人心生一念天地悉皆知善恶若无报乾坤必有私为梦一博独家营业UNIQ王一博动漫,1
王一博风起洛阳王一博,1
原神月卡大号次次保底而且老是歪无氪小号刚刚解锁庆云顶仙居后就单抽出甘雨且非触发保底氪金能换来快乐吗,2
circles真好听呀单曲循环马龙的歌是从congratulations开始的,0
马龙马龙2017德国世乒赛加油笑而不語笑而不語笑而不語,0
倒数第二排左数最后一个的小眼睛版刻晴抓住你了原神,2
他真的好开心呜呜呜他开心我就开心马龙马龙的2020马龙2021年加油,0
我会一直支持你,0
王一博王一博赵丽颖年度星动男神女神恭喜王一博年度星动男神在我的世界我有我的态度不被定义只往前看太酷了王一博LWatermelon_王一博资源博的微博视频,1
绝色Realreal希望captain龙健康马龙里约龙,0
太平洋证券新冠疫苗逐步进入兑现期继续推荐疫苗板块太平洋证券表示目前医药行业持仓较为集中标的估值较高存在抱团松动风险我们建议继续推荐质地优良估值相对合理增长确定性强的血制品药店检测板块以及类消费生物药持续推荐血制品天坛生物药店板块检测板块和类消费长春高新新冠疫苗逐步进入兑现期继续推荐疫苗板块以及关注目前估值便宜基本面有变化的丽珠集团山东药玻每日研报研报分享疫苗收起全文d,3
我们的先人总结的瘟疫始于大雪发于冬至生于小寒长于大寒盛于立春弱于雨水衰于惊蛰千百年来发生在中国的历次瘟疫都是按这个规律始终的中国古老的历法一次次证明着这个规律老祖宗留下规矩年前储粮打扫卫生喝屠苏酒过年贴春联放鞭炮辟邪那都是有讲究的始于大雪2019127大雪发于冬至20191222冬至生于小寒202016小寒长于大寒2020120大寒盛于立春202024立春弱于雨水2020219雨水衰于惊蛰202035惊蛰也许真的有道理嘞新冠2滨州收起全文d,3
新浪看点国乒面临最残酷的淘汰马龙张继科和许昕或被换下O国乒面临最残酷的淘汰马龙张继科和许昕或被换下,0
全民免费接种符合条件的群众都能实现应接尽接疫苗商丘好网民,3
泰康同济即日起单纯做核酸检测取消挂号费和诊查费即日起广大市民到泰康同济武汉医院单纯做核酸检测将取消挂号费和诊查费而且为方便广大市民泰康同济武汉医院已开通24小时核酸检测并提供同城快递检测报告单核酸检测新冠新浪新闻湖北医声医事武汉发布,3
王一博哇哇哇说给玫瑰感受到了博主的激动这抖的,1
新冠疫苗既然全民免费那山西省阳泉市平定县所有的民营医院为啥都强制收取个人费用四百多请官方给个说法人民日报山西省卫生局新浪山西山西省人民政府山西日报山西共青团山西新闻网,3
原神原神看完原神拜年祭有感而发我真心喜欢这个游戏我是永远忘不了第一次看到璃月内心的悸动过完蒙德剧情时对巴巴托斯打心底的喜欢听完让风告诉你后的治愈温暖的感觉看完拜年祭的璃月bgm演奏后打心底对中华文化的自信抄袭真的吗当你真正接触后一定不会觉得原神抄袭的它所创造的钟离和魈任何一个游戏都不能达到那种高度因为制作组真的把中国文化融进了这些角色和璃月他们有着愿浮生荡涤四方安得一隅的气魄有着我虽无意逐鹿却知苍生苦楚的责任腾讯的什么什么诺亚之心真的不行我从来没有对一个角色一个剧情这么牵挂甚至对一个NPC一个虚拟城市也常常感叹过小姜剧情时真的很难受谁能想到在屋子拐角就是已故父母的坟墓他还在痴痴的等望着璃月港日日夜夜我看到了很多旅行者也在海灯节为他放了霄灯还有渣男王板子在蒙德喷泉旁边的姐弟等待水精灵的老人我也会为愚人众交替上班的两人重逢感到开心再来说璃月吧最繁华的金融中心永远闪烁着温馨的烟火味和如岩石般坚固的契约海灯节张灯结彩烟花绽放众人欢聚霄灯满空的情景让我真正感觉到了年味岩石味道真的能让人安心呀这种刻在骨子里的文化真的被这个游戏重新激活很喜欢关于钟离先生的一句话欲买桂花同载酒只可惜故人何日再见呢震撼真的震撼这个庞大的世界观几千年沉淀的浪漫正被一个游戏娓娓道来游戏终会结束但回忆永刻心头当你重新开始旅程的时候不要忘了旅行本身的意义希望很久之后我的脑海里还残存着一句话向着星辰与深渊欢迎来到冒险家协会原神收起全文d,2
马龙新年快乐呀马龙captain龙2019还爱你,0
美国小哥讲述在美国的隔离见闻如果美国人开始恐慌囤货状况可能无法想象美国新冠病毒新冠新冠肺炎疫情疫情全知道抗击疫情美利坚美利坚灯塔国美国人权2西安L太乙亘0956的微博视频,3
美国食品药品管理局简称FDA日前表示专家小组支持接种辉瑞公司和德国合作伙伴BioNTechSE开发的疫苗并已完成最后的批准工作辉瑞新冠OFDA推进新冠疫苗批准本周开始接种,3
没肝人了原神,2
Gwendolynry马龙超级全满贯马龙遇见你陪到底captain龙新年快乐散装火龙果超市马龙您的马代言人表情小能手龙已上线小年快乐啊captain龙,0
犯罪一只秦有龙helloThames_只愿你好的金牌我的天哪马龙你这样很围险你知不知道Д,0
马龙专访从征战里约到克服伤病定下目标如今获得国乒主帅认可O网页链接,0
王一博王一博我正在为王一博打榜王一博已获得23440374票本周实时排名第1名本月第2名wx搜索小程序星之最加入王一博队伍一起用爱解锁最强福利星之最,1
为什么每次敷面膜都有一部分敷不到我恨我的额头不过令人开心的是今晚见到了马龙虽然体型较庞大但是是一只温顺的狗子走的时候还跟我再见真是只可爱的拉布拉多遗憾的是我忘记给它拍照了,0
出发总是美丽的尤其是在一个阳光普照的日子里蔡徐坤我想和你睡觉又是我梦婷婷我又来抽奖了原博转发过5000万送祖马龙蔡徐坤超赞阿达,0
220事件爆发柬埔寨新增新冠确诊32例中国籍220事件爆发后引起了很多人的不安特别是确诊者大部分是中国籍又再次的将中国人推向风口浪尖洪森在今天20日上午的直播中表示32名确诊病例大多数是中国人希望大家不要因此歧视中国人或在金边的人柬埔寨新冠,3
马龙自己搞了一个群欢迎各位果果呀喜欢龙队的都可以进群聊天呀为龙队东京奥运加油呀霸王龙球迷群,0
原神麒麟臂奶妈,2
学校压榨学生陕西省教育厅已经说25号之前放假为什么学校不能在25之前放非把考试提前做个样子呢2月11号过春节2月9号才放假学生不能过春节学校就满意了吗学校领导倒是可以回家过春节以为补10天的课真的就能让学生成绩有所提高吗不能只会让学生没有心思在学习上这样的学校教育局管不了吗是不是让新冠病毒进入学校内才能让学生回家呢学校放假新冠收起全文d,3
新冠中国是世界的吹哨人,3
什么都打不倒你的因为你是马龙,0
成都娜娜看台湾广而告知这岛媒新闻上的图片竟然是盗用的我中国大陆的医护人员图片证据见新闻下的评论已被大陆网友给扒皮原图出处了真的我要再说一遍全世界最最最不要脸的东西就是鬼岛贱畜台湾台吹终结者新冠台湾媒体盗用大陆医护人员照片,3
猫新冠如果宠物感染会很麻烦,3
哇好嫩啊当时,0
哇塞可以的很期待这就很二次元原神好家伙原神新角色胡桃PV发布二次元人气女角色又多了一位原神胡桃,2
高血压患者新冠疫苗预防接种指引第一版北京同心抗疫为爱而行健康科普汇北京疾控提醒您健康北京战疫有我北京战疫新冠肺炎关注新冠肺炎生活百科健康生活新冠终止疫情北京疫情疫情健康大连健康养生健康生活健康小知识健康一冬防疫疫情防控新型冠状病毒加油北京北京抗疫创建全国文明城区抗疫创卫进行时文明大兴青云古镇微博协和胖大夫潘慧北京大兴北京发布首都健康微信公众平台京南福地医药圈爱我大兴社区网健康大兴北京市社区卫生服务管理中心北京大兴北京健康教育北京市城市管理委员会收起全文d,3
每日一涂英国新冠插画伦敦英国首相新冠肺炎检测呈阳性感觉金毛鲍哥是被英国大夫一路给忽悠到ICU里面去了祝他能挺过这一关吧,3
马龙加油加油马龙工作室不问终点全力以赴正是带着这样的信念龙队captain龙走过了一个又一个赛场而我们也见证了一次又一次的荣耀时刻永远做好迎接挑战的准备让我们下个赛场见,0
原神驱邪世家少年x爱抖露重云芭芭拉原神,2
王一博靠微博续命王一博有翡,1
车水又马龙,0
我真心建议有和马龙战绩表一样长的再来和马龙一起艹双子星人设,0
全民长高梦刘畅23周岁服用前160服用后净身高164同行请勿盗图盗图追究法律责任黄圣依发文告别我们恋爱吧新冠病毒疫苗正做好大规模生产准备杨丞琳郑元畅林依晨同框琅琊榜第三部于正把椅子坐塌了外交部回应澳大利亚拟向WTO申诉中国Yamy说棒杀和捧杀同时进行才可怕展开全文c,1
万宝龙马龙ONTHEWAYBaiduMaLongBar万宝龙马龙ONTHEWAY我热爱所以我坚持沿途山海踏遍河川凝眸远方目之所望苍穹无垠星河无边携手不凡与1926系列同行攀山越岭继续无惧不迟疑,0
馬龍加油,0
