微博内容,类标签
国考医生遇到医疗纠纷也不走合法渠道为什么因为他们也知道走合法渠道根本就走不通就像医害太原市卫健委滥用职权剥夺患者医疗鉴定权合法渠道被他们人为堵死让老百姓怎么办打击医害还患者风清气正的医疗环境为民服务他不行祸害百姓他第一因我母亲普通感冒去世为了指出是太原市太航医院的医疗责任我申请了医疗鉴定这个权利是国家赋予每个公民的医疗鉴定中太航医院和太原市卫健委对我指出是医院的医疗责任以及病历的缺失无异议但不知为何太原市卫健委在拖了1年7个月后已过法律时效同医院又一起否认当时我指出的医疗责任为何有操作有内幕还剥夺了我的医疗鉴定权自此我丧失了可以定责医院的权利国家给公民解决医疗纠纷的渠道被野蛮堵死太原市卫健委由执法者变为违法者国家法律被他踩于脚下我人权被剥夺投诉渠道被堵死已无路可走我只能选择网上寻求帮助我实名举报太原市卫健委权力寻租太原市太航医院就是权力的受益者我真诚希望监察纪检卫生系统的上级部门能来审查先查我举报是否属实不属实法办我如果查出太原市卫健委确实违法请对曱甴别手软我的资料他们2方全有患者儿子李杰日期20184如果本人突然不发贴了那就是在无依法处理医疗纠纷前就被某部门控制自由了那就意味着我的自由人权被侵犯本人既然敢发就无惧后果因为所说全部属实不要总想搞死发现问题的受害者却放了那些制造矛盾违法行政单位山西省人民政府山西卫视山西广播电视台南方周末全国多地倡议就地过年特朗普签令禁止与8款中国应用交易特朗普称绝不会承认败选这两张照片值得刷屏赖小民一审被判死刑全国冻哭预警男方婚前患艾滋未告知婚姻关系被撤销知乎声明拼多多身份真实无误央视评不能让奋斗变了味中了5000万会立刻离职吗民法典将怎样影响我们的生活2021年第一条微博快进2020低龄未成年人刑责范围再调整一张照片告别2020阿里巴巴涉嫌垄断被立案调查两头婚如何应对被社会性死亡侄子侄女可继承叔伯遗产微盘点国考行测股票今日看盘拜登特朗普省考美国大选四六级成绩国考国考公告国考职位表平安2020第十四个五年规划初级会计成绩中级会计四六级护考教师资格证微信福奇白宫基金A股创业板新冠疫苗疫苗核酸检测口罩美国疫情收起全文d,3
4月17日新闻简报中国修正新冠死亡人数川普质疑新冠肺炎新冠川普特朗普中国最先爆发疫情的武汉市17日修正市内累计死亡人数为3869人较早前公布的人数大幅增加1290人武汉官方也首次承认有些患者没有入院治疗在家中病亡疫情调查存在迟报漏报和误报现象川普在社交网站指中国的死亡人数远高于这个数字亦都远高于美国的死亡人数约翰霍普金斯大学的统计显示美国单日多4000多人不治死亡总数超过37万人总统川普在白宫见记者时再次表示他对中国处理新型冠状病毒疫情的手法不满意他批评中国没有及早向全球警示疫情最初的时候包括世卫等很多人都不能进入中国他希望了解在中国发生的事最终世卫派人到中国但又没有尽早报告疫情他认为疫情原本可以早日结束但现时无法做到所以对中国感到不满被问到是否同意北京应该被剥夺2022年冬奥会的主办权川普说他同中国签署了贸易协议他会看看中国会做些什么会否履行协议随文图片截图来源川普推特收起全文d,3
新冠疫苗生产车间都开始要直播了这应该算是疫情后的一大利好消息吧新冠,3
不信邪的买了祖马龙其他几个香水的试装果然五步散还是五步散,0
惊喜马龙晒漫威手办求与唐尼合影获本尊翻牌O惊喜马龙晒漫威手办求与唐尼合影获本尊翻牌,0
王一博无感遇见你并成为唯粉都觉得很庆幸,1
原神大家觉得大招动画最带感是谁,2
王一博代言优酷vip会员wyb认真你就酷了认真的你UNIQ王一博酷唉LOVEUNIQ王一博FOREVER王一博wyb王一博代言优酷vip会员热爱就要做到极致有梦想谁都了不起,1
五一快乐吖吖吖吖吖肖战王一博博君一肖战山为王,1
特朗普组建反华者联盟默克尔明确拒绝美国想拉俄罗斯入局美国退出联合国人权理事会联合国人权高专谴责美警方暴力执法联合国人权二十周年联合国人权联合国人权高专联合国人权理事会联合国人权高专办联合国人权专家联合国人权委员会联合国核心人权文件汇编张伟主编全球疫情美国美国疫情新冠病毒新冠新冠肺炎疫情疫情全知道抗击疫情美利坚美利坚灯塔国威虎堂军事新闻茶余饭后我的2020新闻启示录美国部分示威者焚烧美国国旗美国部分示威者焚烧美国国旗美国明尼阿波利斯市进入紧急状态美国500多名士兵前往明尼阿波利斯等地美国示威现场发生枪击事件美国警察暴力执法致黑人死亡引抗议黑龙江吉林新闻哈尔滨新闻新疆塔里木北京天津生活河北燕京贵州云南西藏陕西身边事西安甘肃青海山西河南浙江湖北山东四川广西福建两广两湖广州从化齐齐哈尔安徽上海浙江江苏安徽江西桂林湖南香港内蒙古深圳宁夏义乌海南省澳门湛江深圳南京南昌辽宁L易道老庄8046的微博视频收起全文d,3
王一博王一博陪你到世界之巅自从看完了陪你到世界之巅我满脑子都是王一博演的季向空感觉是电竞圈男神本人了从此路转粉请问有没有王一博笑起来贼帅的那种图片求推荐呀,1
拜托了魈大人原神,2
早上被蚊子叮了脑海中第一时间想到的是这个蚊子会不会叮过有新冠的患者那么我会被传染吗人类为什么就不能善待一下我们赖以生存的地球呢中国新闻网中国日报新冠2北京,3
马龙白兰度呢,0
北京语言大学网上北语eblcunet周博士关注新冠肺炎互粉大厅互粉互粉涨粉大厅互粉新冠肺炎疫情期间作为疫情防控的重要举措练练太极能提高免疫力吗这个还真说不好在海外疫情特别是美国疫情欧洲疫情依然居高不下死亡累计约291万之际还是赶紧打新冠肺炎疫苗吧武术套路长期练习未必出什么功夫练出闫芳大师隔山打牛的凌空劲也不现实对付冬瓜肯定没戏想马保国被ko也不一定但一般健身养生还是毫无问题的视频虚实清楚动作舒缓神清气爽招式有模有样音乐悠扬反映出很高的修养回放一把还真是不错的视听享受支持中国再出发中国文化特别是中国传统文化的大咖举手之劳开始点赞吧海内存知己天涯若比邻太极拳列入人类非遗名录海内外太极爱好者数亿何妨评头论足一番L太极漫步周博士的微博视频收起全文d,3
原神甘雨原神,2
原神摸鱼委屈巴巴钟离先生,2
体育世界杯中国女乒九连冠刘国梁带几十人面对电视机高唱国歌网友飙泪了中国女团30横扫日本队实现乒乓球世界杯女团9连冠的成就同样在中国男队实现8连冠伟业就在女团奏国歌升国旗的时候中国乒协主席刘国梁带领马龙等男团冠军队员及其他随队成员一起高唱国歌全场几十人面对电视机感受全文httpmweibocn39747467924438080310657255收起全文d,0
想拥有祖马龙的香水,0
原神原神参展萤火虫达达利亚寒冰的风暴正吹向其余六国提瓦特的天气要变了达达利亚O网页链接PHX教主Shadow抄送猫尾酒馆广州萤火虫场照置顶评论有请查收,2
王一博王一博香奈儿蔚蓝wyb王一博今天hz都疯了吗怎么突然这么多要开始了吗服2西安,1
王一博啊啊啊啊每一天向我们家小可爱也是大帅哥王一博表白最爱最喜欢你啦王一博啵啵猪还有要恭喜我们家王一博王一博作为冰雪运动推广大使愿我们国家在运动员在冰雪运动上取得优异成绩王一博冰雪运动推广大使想家了王一博宝贝啦UNIQ王一博,1
马龙新专弃曲今日公布,0
行动好快呀新冠安联新型冠状病毒保障计划_安联意外健康综合保险_安联意外综合保险_意外险_移动端手机浏览器O网页链接,3
天天向上王一博真牛逼学什么会什么L翼朗的微博视频,1
原神原神闪耀的群星原神6选1大家都选了谁,2
原神vivox60哎玩原神b服大约十分钟卡退两次我TM直接爆炸画质已经是最低了这种卡退在晚上和下午尤其严重在玩官服的时候却没这种情况怎么办啊,2
这个抽签比较绝妙原本国乒男队就仅有2名种子选手而资格赛也仅有梁靖崑一人闯进正赛不过在正赛对阵分组上大胖如愿分在了与张本智和同样的18半区梁靖崑在116淘汰赛的对手是非洲一哥来自尼日利亚的阿鲁纳而张本智和的对手则是韩国名将郑荣植这一关可不好过如果按照正常水平的发挥梁靖崑战胜阿鲁纳晋级的胜率很高即使是资格赛闯进来的选手但没人敢轻视大胖的实力在中国公开赛上与马龙鏖战7局O网页链接收起全文d,0
瓶子太好看了祖马龙最爱就是英国梨与小苍兰了LaSolaSola_索拉车专发评论原微博揪2位平分400元AirPods基金香水的意义之一在于将心情用味道呈现手捧洁白花束的少女恰如小苍兰般纯真又浓情的诱人之美稚嫩将脱未脱成熟方兴未艾沉默是学会了眼神代替语言你愿与我一起跨越成,0
马龙首先觉得今天自己发挥得还是不错吧雨果我认为马龙是目前世界上最好的选手L果窖_1988的秒拍视频L果窖_1988的秒拍视频,0
原神本来想在常驻池里垫一发的结果出了刻晴我还以为魈池无了结果还好三十发俩五星还行,2
这个我见转这是什么级别的大帅哥新粉必看晴日幻想岛王一博拿洛阳铲挖了挖自己的微博,1
上半年最常临幸的小宝贝top5了芦丹氏八月夜桂花啊好闻啊上头很温柔的香夏秋都合适第一名第一名我觉得这是约会香欧珑赤霞橘光就是新鲜剥开的大橘子无敌fresh留香两小时吧作为柑橘调古龙水很优秀了睡前小宝贝Diptyque无花果edp人生挚爱fig留香一般般玄学了明明是edp我质疑了但是我沉迷像喷花洒一样喷啊爽我觉得这棵无花果树还蛮甜的诶祖马龙油桃花和蜂蜜很甜大概是我能接受的最甜程度但是闻起来超开心了持香也有两三个小时我之前有持香46h的神奇经验太感人了季节限制很强只适合天气热的时候喷吧但是睡前就算冬天也爽TomFord阳光琥珀edt知名椰奶香了后调奶甜我觉得夏天冬天都可以诶前中调我对她爱恨交织了柠檬豆蔻加上中调小白花联盟整体我不管我觉得这个味道闻起来挺聪明的我挺喜欢小白花的就很夏秋但是不喜欢柠檬所以umm前调不喜欢得等到中后调才总之春夏就是甜甜甜了但其实只有赤霞橘光是我一闻到就走不动路必须拥有的啊柑橘调真是绝了调剂心情第一名晚安朋友们收起全文d,0
风景旅行青山位于洱岭西侧以云岭山脉南端的主峰路云雪泉石而闻名19个山峰以北向南以云烧烤沧浪五台莲花白云鹤云三阳兰峰雪人应乐观音龙川玉国马龙胜应佛正魔阳每两座山峰之间都有一条溪流有河雪东流注入二海是著名的福建十八界,0
芜湖玄学抽卡原神魈欧原神,2
8奕香蓝风铃小苍兰香水沐浴露洗完的皮肤细腻滑嫩把香水披在身上的感觉颜值超高28元买沐浴露的jia格买到祖马龙赚大发了赠运费险,0
祖马龙的润唇膏吹得天花乱坠好用是挺好用但是这个味道我感觉每天嚼着药睡觉,0
祖马龙橙花香水HelloKitty拍立得施华洛世奇星星项链我还是不喜欢你们了软妹集真实樱桃子Moko哈哈哈都是陷阱颜文字君ὢ太坏了我有药所以你有病吗哈哈哈我我我干红重机如果不是没有钱谁会不喜欢OK一_韭保带人野生的Ero妹抖喜欢的我都没钱了,0
何时何地哪些时候能接种新冠疫苗医疗新冠L带你走近白衣天使的微博视频,3
王一博很喜欢你像鲸沉于海底温柔呼吸痴极嗔极UNIQ王一博,1
马龙我们蛋崽好嫩啊,0
防新冠无症状感染做到2点杜绝风险1密闭空间例如电梯戴口罩不触碰2出门手不触碰眼鼻回家立刻洗净网络L四方坦然的微博视频,3
现在的潜规则太多预约了也不行早就把名额给别人打了不能打也不提前通知白跑一趟跑了几十公里疫苗泸州新闻网泸州在线泸州快播报泸州日报泸州论坛泸州2泸州,3
想念顶峰时期的张继科马龙真的帅拉了,0
肖战失格艺人新冠肖战肖战粉丝称中国需要向全世界道歉为了疫情新冠病毒是发源于中国吗到现在美国意大利英国都有医学专家发现早在去年这些国家就出现过像新冠患者一样患者出现但当时都被当作感冒处理了这说明新冠病毒并非最早在中国出现而且疫情出现后中国政府已经及时向世卫组织做出了通报同时积极进行防疫措施目前中国自己的疫情得到了完全控制而西方国家疫情却呈蔓延趋势中国还为各国提供帮助提供充足抗疫物资给他们帮助他们渡过难关这么有大国担当为什么要向全世界道歉就因为被网暴的227网友们揭露了肖战纵容粉丝作恶网暴人肉ao3论坛众多作者并让人家几年心血作品一夜间化为乌有还是因为揭露了肖战养营销号打压同期其他艺人通过不正当竞争方式上位谋取利益太奇葩了你还是中国人吗中国人就要爱自己的国家不爱国胳膊肘往外是何意光明日报新华社南方日报共青团中央人民日报人民日报评论检察风云杂志观察者网光明网中国日报网新华社客户端中国新闻网收起全文d,3
专题报道解疑释惑联合国专家谈新冠疫苗相关问题随着中国国际公益慈善论坛领导参阅新冠疫苗免疫接种工作在全球多个国家逐步展开在燃起战胜疾病希望的同时围绕疫苗所产生的问题也日益增多在不到一年时间里快马加鞭研发出来的疫苗是否安全有效接种后有哪些不良反应孕妇和儿童是否可以接种普通百姓要等到何时才能接种联合国儿童基金会免疫项目专家罗宾南迪为您答疑解惑O网页链接收起全文d,3
voguefilm时装电影盛典wyb王一博周四是去见你的日子好想你呀,1
这两天在B站套环刷视频张继科马龙许昕樊振东可太炸了,0
王一博王一博青年演员王一博王一博我们爱你永远支持你和你的梦想UNIQ王一博,1
有没有伙伴原神指点一下怎么发展才好,2
原神钟离加强了图片来自推特原神原神,2
20200403新冠隔离日记Day5不想工作的一天有些东西明明开始做了也没啥难度可是决定开始做之前就是很抵触不想做啊,3
原神质变仪真好玩L柠檬优多不加冰的微博视频,2
为什么疫苗注射有不同位置疫苗接种一般分肌肉注射皮下注射皮内注射3种注射药物和注射疫苗的方式有不同考虑注射药物与药物动力学有关不同给药途径可影响药物吸收率而注射疫苗关键在于注射位置有无免疫组织或免疫细胞巡逻疫苗和免疫系统要在一个有利位置相遇才可诱发免疫反应产生抗体疫苗收起全文d,3
哥哥可以跟我碰个杯吗王一博UNIQ王一博,1
詠牡丹宋人周濂溪愛蓮說有云自李唐以来世人甚愛牡丹此說并非虚言自盛唐迄今千二百載欣恋𡻕年年年年𡻕𡻕每每季春節候紅男綠女長安侠少一時車陣馬龍黄塵滾滾歡閙喧嘩聲動洛陽愛其雍荣華貴者有之愛其國色天香者有之可謂深得牡丹之風韻者全文收起全文d,0
王一博wyb王一博好潮一男的王一博时尚感极强每一套都好看UNIQ王一博YIBO加油站丨王一博王一博wyb正能量艺人王一博这个好有趣呀一博穿哪套都是帅的UNIQ王一博,1
原神用甘雨挑战风魔龙第一次爆了这么多好东西原神搞笑视频创作计划搞笑L老亚瑟来了的微博视频,2
分享酷安用户吹吹风更凉爽的动态原神魈池出来歪了刻晴见我往期动态本人老非酋了原本是老老实实月卡党对魈不是很感兴趣现在只能说xp跟着米忽悠走对上头了把328以下的首充清了然后月卡续满了总计159抽强氪了出来怎么说呢还算满意doge笑哭猫猫6辛焱3北斗0O网页链接分享自酷安App收起全文d,2
马龙世乒赛首日国乒轻取开门红_手机新浪网O世乒赛首日国乒轻取开门红,0
第一针新冠疫苗打完了感觉我这个体质应该什么反应都木有感谢祖国感谢党新冠,3
UNIQ全世界最好的UNIQ这几天因为家里有事一直没逛团超发现到处弥漫着柠檬味一博迪迪的已经在芒果台播出的季向空王一博陪你到世界之巅翰翰的即将播出的云高洋李汶翰追球轩哥六月份也要播出的邓泽周艺轩我不能恋爱的女朋友给大柱子安展开全文c,1
王一博数据组王一博wyb王一博时装男士小摩托们真的很厉害UNIQ王一博对你的爱我们大声喊出来,1
米抠门你可真行不限时的玩家都快长草了限时的连任务都没过完连一次修改的机会都不给原神超话原神原神米哈游miHoYo,2
今天的矿都不掉血重启也还是一样原神,2
原神V12攻略角色攻略甘雨全方位解析之前那条不知道为什么被吞了我最近才发现现在重新发一次OV12攻略角色攻略甘雨全方位解析,2
王一博王一博啊啊啊啊啊新年快乐一博,1
面对疫情所有行业都应该居安思危O疫情影响下家居行业怎么活未来怎么干新冠新型冠状病毒,3
加油Thames_只愿你好的金牌马龙加油,0
草哈哈哈哈哈哈哈哈哈哈哈哈哈哈哈哈哈哈哈哈哈哈哈哈哈哈哈哈哈哈哈哈哈哈哈哈哈哈哈哈哈哈哈哈哈哈哈哈哈哈哈哈哈哈哈哈哈哈哈哈哈哈哈哈哈哈哈哈哈哈哈哈哈哈哈哈哈哈哈哈哈哈尖椒麻麻鱼寄给马龙沙拉麻酱店家说会无偿给我补发马龙态度挺好的但是我请问这4060的刘国梁我何处安放,0
王一博新歌熹微wyb有翡耳朵怀孕了阿酸pick耶啵王一博的放松秘笈一边听熹微一边放松哟王一博FLY飞0805王一博的放松秘笈又酷又好看还很舒服UNIQ王一博,1
近日定安各镇逐步开始接种疫苗大家快快报名成为苗星人吧疫苗定安L今日定安的微博视频,3
原神原神hxd们帮帮忙超话里有没有风景党问问兄弟们雪山这张图哪里风景比较优美适合拿来录像啊之前开图的时候都没怎么关注除了最顶上那根柱子知道很好看之外其他地方都是为了开荒而开荒开荒完就很少去了现在想给原神摸个视频但是发现自己对于风景区是一脸茫然哪里好看自己一概不知收起全文d,2
532祖马龙的沐浴油也有的现在预定他家都是港币085啊,0
微博贴纸跟我妈说着祖马龙她突然问我小时候有个游戏也是祖马龙什么的有个蛇我祖马龙游戏祖马龙祖马中间有个蛤蟆吐球的,0
刘璇马龙冠军出圈记支持顶哥们你真给力,0
2020年最喜欢王一博了我投给了喜欢王一博这个选项你也快来表态吧,1
王一博粉丝王一博我正在为王一博打榜王一博已获得27156725票本周实时排名第1名本月第2名wx搜索小程序星之最加入王一博队伍一起用爱解锁最强福利星之最,1
王一博wyb王一博Lucky今日净化开始净化要求点击净化词条停留10s以上O王一博电竞O王一博跳舞O王一博植村秀O王一博直播O王一博fireO王一博天天向上O王一博舞蹈O王一博陈情令O王一博蓝忘机展开全文c,1
原神累了毁灭吧攒了好久的原石没忍住首个五星歪到了刻晴当事人真的很后悔,2
年龄演技相貌集优秀与一身的他难免会遭受他其他人的打压造谣确实人红是非多多娱乐圈没那么好混大家的不容易坚于本心不忘初衷希望这个九七年的大男孩能挺过所有的是是非非风风雨雨加油UNIQ王一博王一博王一博超话O王一博三次辟谣仍有绯闻算人红是非多吗,1
英超新冠阿森纳后卫加布里埃尔的新冠病毒检测结果呈阳性他将缺席与布莱顿和西布朗的两场比赛阿森纳俱乐部在官网发布了一份声明加布里埃尔的新型冠状病毒检测结果呈阳性根据英国政府和英超联赛的相关规定他正在进行自我隔离我们将继续关注和支持加布里埃尔希望他能在接下来的两场比赛后复出赛场收起全文d,3
幽默5217天津全运会男双决赛马龙和许昕拼尽了全力尽管未能夺冠但却赢得了尊重L李武军的秒拍视频,0
原神原神救命原来bbl平a的时候这么可爱瞅瞅这优越的神颜L勇敢的干饭狗勾的微博视频,2
伤心的刻晴和小饼干设定图原图有爱请私戳啦原神,2
孝感身边事周六晚继续排长龙的民众疫苗中国制药集团收购德国制药厂2孝感L孝感身边事的微博视频,3
支持上海联通乒乓在沃极速起航来看看马龙龙队的备战宣言,0
原神来人啊救命啊换两个紫一个褐色为什么要给我那么多蓝色uid101605638,2
王一博找打呢找打呢UNIQ王一博王一博平安喜乐,1
最爱祖马龙的产品了很不错的,0
道琼斯三天跌了一个A股出来新冠这只黑天鹅可能开启了新一轮的全球金融危机06zqxOC20美股A股金融危机新冠,3
我牙倒了Thames_只愿你好的金牌国界只有不好意思让一下_Tarantella艾特马那个龙国界什么时候能等到这句妹妹满窗清梦压星河陈满堆马龙你飘了,0
骑士客场对雄鹿的比赛首节9分11秒詹姆斯拿下个人本场比赛的前2分这也让他的生涯总得分达到27410分超越摩西马龙27409分升至历史得分榜第8位,0
分享最近两个月用的四款唇膏雅诗兰黛露铭堂凡士林祖马龙入秋以来我已经得了至少两次唇炎了有可能是因为我喝水少现在喝水少的时候通过唇膏对我的嘴进行表面上物理化的滋润至少是我以为但是总体下来我是有点失望我还买了blistex的唇膏在路上到了再试用一下唉没想到冬天会被嘴爆皮折磨我真的很想涂口红啊可是涂上就全是皮儿我咋涂啊收起全文d,0
陈情令王一博肖战博君一肖快本录制结束后哥哥弟弟露出的两个小脑袋好可爱L今日让你有戏的微博视频,1
男乒30轻取德国九连冠2018年团体世乒赛在瑞典继续进行男团决赛中国队对阵德国队比赛没有太多悬念德国队由于主将奥恰洛夫因伤缺席实力大损马龙樊振东直落三局获胜许昕先丢一局后连扳三局逆转中国队总比分30轻取对手实现九连冠历史上第21次夺冠,0
肖战王一博我追的不是星是陪你们一起破界跨界闯世界fighting2银川,1
每每想要放弃一句马龙的球迷不能认输又给我燃起熊熊希望之火真好想龙晚安,0
马龙小颤音都颤惹,0
哈哈哈哈好可爱网瘾少女3c要在美国好好康复吖刹那之后大家都想马龙,0
原神心累副词条又是元素2深圳西乡,2
菲谢尔原神,2
原神我朋友刚给我发的笑死我了这丘丘人是把蒙德城门给拆下了吗来人啊快去请铠之巨人原神原神甘雨,2
王一博王一博陪你到世界之巅王一博极限青春刚看了空哥现在吃手手好跳脱UNIQ王一博,1
冲浪小博王一博王一博夏日冲浪店,1
王一博极限青春15年7月web可以看了吗可以看了吗姐姐19年7月web可以吃吗可以吃吗王一博耶啵不用问只要是你都可以都可以统统拿去统统拿去命都展开全文c,1
王一博肖战王一博太难了刚到可以结婚的年龄就被问面对催婚该怎么办L星综艺速递的微博视频,1
原神甘雨又心血来潮挖坑可耐小椰羊这次一定不会烂尾,2
3月1日至17日马龙区首届樱花节将靓装登场看场玩场吃场场场精彩O3月1日至17日马龙区首届樱花节将靓装登场看场玩场吃场场场精彩,0
把热爱做到极致王一博把热爱做到极致王一博把热爱做到极致,1
王一博wyb王一博加盟818全球汽车夜我投给了王一博加盟818全球汽车夜你也快来表态吧,1
真好看原神原神原神汇成明霄明霄升海平我们的光芒终会汇聚于夜空里成为白昼一般明亮的光,2
这个动画爱了爱了今天玩到的时候我狂起鸡皮疙瘩原神原神原神汇成明霄明霄升海平我们的光芒终会汇聚于夜空里成为白昼一般明亮的光,2
原神越想越气我玩这游戏都这么菜,2
断舍离祖马龙黑莓与月桂,0
好可爱焦糖小白du视频封面的哥哥好好看暖光浅笑m_l原来是集体活动看到马龙哥哥敲开心,0
原神一些老图,2
原神强娶成功,2
太难了为了找白胡萝卜把璃月岛上的一座小山都翻了一遍带刻晴老婆刮痧刮了个遍原神,2
JOMALONE祖马龙2018圣诞限量金瓶英国梨与小苍兰金瓶黑石榴蓝风玲海盐香水金光闪闪100ml2018圣诞的祖马龙除了倒数年例礼盒最美的就是这樽金光闪闪的金粉瓶浑身上下通体金粉除了绑在身上的标签瓶身上下也是没有任何logo标签如此一来更像居家摆设装饰的好东西是火火自留的一款产品大爱收起全文d,0
