微博内容,类标签
流云飞舞8888王一博这排面太牛了,1
今天结束的常规赛掘金轻取湖人湖人七连胜终结赛后掘金主帅马龙接受了采访马龙说今晚胜利最好的一部分就是他们没有让湖人打出他们的节奏和气势10天之前输给湖人的比赛掘金出现了15次失误的同时仅有19次助攻让湖人队用转换进攻击败了他们本场比赛掘金全队送出28次助攻的同时仅有10次失误湖人队利用对手失误得分只有6分此外马龙还称赞了纳吉和坎帕佐的表现坎帕佐是这场胜利的重要组成部分他毫不畏惧不怕大场面他是一个勇者25场比赛之后他总是能在场上为我们做出正面的贡献纳吉的球商很高有机会成为一个真正有影响力的防守者一个可以从侧翼防到内线的球员内蒙古篮不住TeamBeagles收起全文d,0
看完十佳球我是真的很想到现场为他喊两嗓子了他是这样热爱又是这样坚持他所信奉的高山深潭就算前路无人闯过他依旧选择拼尽全力去做那个一切未知的第一人,0
不打怪的一天原神,2
突然被马龙白兰度圈粉了声音太喜欢了,0
原神我佛了说好的卡池很深呢原神,2
崽崽博UNIQ王一博这古风造型也太可了王一博新国风造型陌上人如玉公子世无双,1
祖马龙洗护清货祖马龙沐浴露15ml4个85元154黑莓与月桂叶杏桃花与蜂蜜红玫瑰祖马龙天竺葵与核桃磨砂50g75元祖马龙丝绒玫瑰与乌木润肤霜15ml35元祖马龙鼠尾草与海盐润肤霜50ml140元,0
我想起来了我上一个喜欢的马龙式男子是陈键锋,0
原神我怎么会这么菜救救孩子有人能带我刷火本吗救救孩子,2
王一博王嘉尔划拳我终于明白王一博现代剧几部都用原声那味都对就是生活中常现的各种人生离我们近很期待冰雨火王一博这就是街舞3很多爆火的古装剧都离不开专业配音演员的加持导演一句话点明白了得对古代人说话那味塑造的角色才会出彩离我们远的人生有不同才看得津津有味期待展开全文c,1
王一博粉丝王一博我正在为王一博打榜王一博已获得16146148票本周实时排名第名本月第2名wx搜索小程序偶像影响力加入王一博队伍一起用爱解锁最强福利偶像影响力榜,1
体育ESPN评选新的历史最伟大球员Top100201120凯文加内特19德克诺维茨基18摩西马龙17卡尔马龙16杰里韦斯特15朱利叶斯欧文14凯文杜兰特现役13斯蒂芬库里现役12哈基姆奥拉朱旺11奥斯卡罗伯特森体育迷失恋33天,0
王一博粉丝王一博我正在为王一博打榜王一博已获得41652337票本周实时排名第1名本月第1名wx搜索小程序偶像守护榜加入王一博队伍一起用爱解锁最强福利偶像守护榜,1
原神达达利亚图片来自推特作者同意转载链接O网页链接原神原神,2
客订祖马龙香薰全套包装送礼超有面的寻香祖玛珑发货时间vx449138370代理L老刘正品DW手表专卖的秒拍视频,0
原神我最爱的刻师傅,2
巴顿预计会缺席56周记得好像和以前的钱德勒伤的一个位置这对于掘金来说是一次重大打击他们好不容易弄出来的王牌首发又无法同时上场现在用克雷格打首发小前锋看起来球场空间差了不少也许马龙可以试试把埃尔南戈麦斯拿上首发,0
我正在游戏新春市集抢原神的礼包晒游戏最牛道具赢原神游戏福利ssxxxxxO游戏新春市集原神,2
马龙1020生日快乐一路走来充满欢乐也饱含泪水任时光流逝我们会陪你一起走下去永远支持你captain龙生日快乐2020一定会更好,0
新浪看点这是一道数学题掘金已开始挑选季后赛对手诸葛马龙会如愿吗O这是一道数学题掘金已开始挑选季后赛对手诸葛马龙会如愿吗,0
原神原神胡桃原神这波藏得真好胡桃快来吧小保底留着呢,2
我正在游戏新春市集抢原神的礼包晒游戏最牛道具赢原神游戏福利起飞O游戏新春市集原神,2
西安爆料小伙景区扮雕塑15分钟不眨眼双眼变通红流泪才被游客认出5月23日陕西西安马龙是大唐不夜城的一位演员负责扮演一个名为奋斗在路上的雕塑为达到逼真效果表演期间他坚持不眨眼最长能坚持15分钟双眼常常充血通红直到掉下眼泪才被游客认出是真人扮演一手videoL一手video的秒拍视频收起全文d,0
原神原神闪耀的群星庆祝原神的第一张ost原神,2
马龙被恨的人是没有痛苦的比方说你被人家恨你自我是没有痛苦的去恨别人的人却是伤痕累累啊所以很多人一辈子活在仇恨当中他天天过的日子像在地狱里一样因为他饭吃不好觉睡不香每一天都去记恨着别人,0
为什么西方不做新冠肺炎灭活疫苗听高福院士的回答新冠疫情L带你走近白衣天使的微博视频,3
王一博wyb王一博谢允想买这4本这家店的是正版吗UNIQ王一博,1
领导者通常是非常自信的但是过分的自信就变成了傲慢自大对于许多人来说把权力的升级当作他们智慧的证明但是真正明智的领导人会真诚地寻求反馈和批评积极开放勤于思考从善如流特朗普非常缺乏这些素养特朗普的判断具有很高的传染性几乎感染了与其接触的每位官员或顾问的思想和行为如果有人不能够紧跟总统他们就面临解雇或者随时可能被解雇已经解雇了好几个有独立思考的官员了饭碗对那些政客来说非常重要特朗普糟糕的判断很快传染了联邦政府的所有决策部门连合理的质疑都几乎没有更不要说遇到任何抵抗发布全球新冠统计数据1国民感染率西班牙瑞士意大利2治愈率中国伊朗德国3死亡率意大利西班牙荷兰从这次新冠疫情可以看出政府重视措施科学执行有力是应对突发事件的不二法宝新冠肺炎新冠关注新冠肺炎美科学家称武汉绝不是新冠病毒源头疫情全球疫情意大利疫情最新疫情地图收起全文d,3
璃月神功千里传音原神L昼二丶的微博视频,2
原神ch有nm毛病甘雨能强到超模钟离连加强都要一个版本傻批,2
美媒评NBA历史大前锋邓肯第一加内特第二马龙第三诺维斯基第四字母哥第十浓眉哥第13你认可这个排名吗NBA体育迷失恋33天,0
Atuan团我也摸了原神的凝光大姐姐原神,2
哈哈哈哈哈哈哈哈哈还是我马龙哥哥给力米奇比心,0
夸赞哥哥神手夸赞吧超过写BaiduMaLongBar马龙左右开弓形如流水脚下生风势吞山河王者出击精彩演绎微博体育目瞪口呆今日体坛,0
疫情误区新冠疫情防护中的十大误区二O视频播报疫情防护中的十大误区二L中文集团CNGROUP的微博视频,3
王一博王一博我正在为王一博打榜王一博已获得12335517票本周实时排名第1名本月第2名wx搜索小程序星之最加入王一博队伍一起用爱解锁最强福利星之最,1
摸个魈原神魈,2
马龙马龙哥哥,0
王一博有钱不可能养你一辈子帅气不可能炫耀一辈子男人是拿来过日子而不是拿来比较的所以不找帅不找富找个能包容你的如果他不能包容你的情绪和缺点就算条件好又有什么用呢其实最好的日子无非是你在闹他在笑如此温暖过一生,1
我正在游戏新春市集抢原神的礼包晒游戏最牛道具赢原神游戏福利科科O游戏新春市集原神,2
补充下我发出来不是鼓励大家免费点赞是害怕大家不懂马龙套路花钱点赞华晨宇,0
注射新冠疫苗后能不能做假体隆胸王爱武科普这是最近的新问题首先是可以做隆胸手术的隆胸但是需要等两次疫苗接种完了再说隆胸本身只是放假体和疫苗是不冲突的可是围手术期会用药比如抗感染的药物比如麻醉药这些药物会不会存在影响也可能性不大只是我们为了万全期间还是建议错开时间疫苗大家也不要把新冠疫苗想的太神秘疫苗的机制都是类似的和乙肝疫苗卡介苗破伤风疫苗等等都是让我们人体产生抗体的东西大家放心去接种收起全文d,3
原神才玩了十几天的我刚刚去看了下温迪的pv一句干点正事吧巴巴托斯差点没把我笑死哈哈哈哈哈哈哈哈,2
陈情令魏无羡王一博蓝忘机肖战王一博这画面超甜辛巴辛巴辛巴L最爱肖兔兔XZ的微博视频,1
Watermelon_王一博资源博王一博王一博谢允视频有翡拍摄花絮UNIQ王一博王一博,1
国际奥委会疫苗中国奥委会中国奥委会提议为参赛者提供疫苗国际奥委会要负担费用11日国际奥林匹克委员会主席巴赫在以在线形式举行的全体会议上公布对于中国奥林匹克委员会提出的为东京奥运会及2022年北京冬奥会参赛者提供新型冠状病毒疫苗的申请现已接受O网页链接,3
王一博龙拳太炸了wyb王一博今晚的龙拳舞台炸炸炸太好看了太喜欢了又要反复刷各种直拍站姐图摄王一博的舞台就是燃UNIQ王一博湖南卫视818晚会LFallenCity0805_王一博个站的微博视频,1
129祖马龙品牌黎漾女士淡香香水30mlO网页链接还有一万个领劵商品O网页链接,0
中国科兴疫苗第三期临床试验结果整体有效率只有5038covid19疫苗,3
纠结了两年才下狠心找代购买的毕竟一瓶顶祖马龙的三瓶但是太爱这个味道了Aerin的格拉斯玫瑰再没闻过比这个更好闻的玫瑰了清晨带着露水的玫瑰中调玫瑰甜度刚刚好木质香太爱了大概这会是我用完的第一瓶香水买了六七瓶都没用到五分之一其他的是不想用这个真舍不得收起全文d,0
马龙太甜了,0
最舒服的事之一就是每天晚上洗完澡擦身体乳护手霜敷上面膜眼膜涂好唇膏抹上护发精油吹干头发做完这一切之后躺在床上打开电脑闻着祖马龙家的熏香看电影好好生活呀内心os当女孩子真累2美国,0
美国新冠病毒新冠新冠肺炎疫情疫情全知道抗击疫情美利坚美利坚灯塔国美国人权,3
香奈儿蔚蓝爱马仕大地我郑重否定不好闻不要买虽然一博用了蓝李嘉琪的啥子推荐宝格丽城市森林只能说中规中矩吧盲买宝格丽大吉岭茶还是我这辈子闻到的最好闻的还有今天入手的啥子官网都没得的那个蓝的海洋系列也可以不要浓的祖马龙男生就别瞎喷蓝风铃小苍兰了遭不住鼠尾草吧或者佛手柑那这个黑瓶子的还可以至于什么三宅一生范思哲啥子日本的蓝瓶子的就靠边吧完毕收起全文d,0
王一博奋斗吧青春王一博我投给了王一博奋斗吧青春最阳光这个选项你也快来表态吧,1
原神cos莫娜看到都是有缘人L墨色的团子_墨舒的微博视频,2
悦悦美女线上夸𝘼𝙀𝙋𝘼𝙀𝙋洗发水味道闻着很舒服祖马龙蓝风铃的高级香洗完头发顺滑自蓬然松大师级头皮护理体验用过就不想换其它的那种省了跑美发店做头发护理,0
吃饱了去迎接我们的战士英雄们新冠新冠肺炎2铁岭铁岭县,3
放火烧山可莉完蛋一起炸鱼去摄影后期原po可爱妹妹橙子茶茶猫蚌埠约拍蚌埠约拍可莉原神人像摄影正片cos,2
马龙2019年加油哥哥一切顺顺利利captain龙,0
原神自打有了甘雨卢姥爷都不出场了,2
拜托了让我十连出魈吧过年了我想接老公回家哦捏该原神魈,2
小马乒乓世界开年封大户了麋鹿_11牛逼期待新纪录历年开年封封面布尔崖马龙开年封2008201520162017201820202021_补图查看图片,0
原神与老撕鸡陈大白组队你们说我这还要不要继续跟这俩坑货玩游戏了原神微博游戏大赏跨年游我L板娘小薇的微博视频,2
小马龙也太可爱了叭,0
有没有世界等级5的大佬帮个忙在线等原神,2
王一博支持耶啵弟弟香水首选祖马龙JoMaloneLondon祖玛珑彩妆首选植村秀植村秀中国王一博有翡,0
还是一波王一博王一博王一博2金华L大灰小黄的麻麻的微博视频,1
认真做法ing原神原神2美国洛杉矶,2
马龙团体世乒赛加油,0
2021121近日生活的不完全记录P1在成都的最后一餐P2飞机是也太无聊了叭P3一回家就马不停蹄的去弄头发了染了一个挂耳呢P4祖马龙的身体乳很好闻P5莱卡好像不太喜欢我P6这个热可可有点苦P7回高中回忆青春P8卡旺卡永远的神P10求求谭鸭血不要再让我开鸿运了,0
我爱整个胖球队布达佩斯明天要开战了有些激动奥运虽然几乎一直包揽金牌但每一次的胜利又何尝不是艰辛的不仅面临巨大的压力而且对手也在变强东京奥运会东道主的日本在规则上真的是想着法儿冲击中国啊布达佩斯一战注定关键还是吐槽一下抽签这签抽的男单真的是死亡半区本区了上半区小胖半决赛可能和影子杀手马龙相遇嗯自行体会下半区张本可能要碰见波尔额有点意思昕爷这次单打应该可以放开地打了还是希望昕爷能打穿下半区女单日常中日大战最关键的混双明年之前的练手看好新闻和胖丁收起全文d,0
618五折全场5折冷枚白描罗汉定价900元现价450元冷枚清代宫廷画家大约生于1669年卒于1742年字吉臣号金门画史山东胶州人焦秉贞弟子善画人物界画尤精仕女所画人物工丽妍雅笔墨洁净色彩韶秀其画法兼工带写点缀屋宇器皿笔极精细亦生动有致冷枚晚年在乾隆初期造办处内创作的作品与画稿约有五六十件套以上其题材非常广泛有人物佛道鸟兽马龙建筑园林宫廷器皿历史故事等等冷枚可谓是一个全能画家否则在康熙时期不会成为领衔画家到乾隆时也不会受到如此特殊的恩遇和重视冷枚在宫廷近半个世纪的绘画活动中由于才能突出成绩卓著颇受最高统治者的器重和赏识所以清人说冷枚以画供奉内廷最久他既是一位多产画家又是一位长寿画家在我国宫廷画院史上占有重要地位因此清代绘画评论家总把冷枚与焦秉贞沈喻三人并提视为康熙晚期三个著名的宫廷画家这本冷枚白描罗汉收藏于日本国立国会图书馆中是难得一见的冷枚白描代表作品全书以简洁朴素的单勾和复勾的线条描绘出了近乎极致丰富的画面人物形神兼备细腻传神衣饰飘带逼真购书地址冷枚白描罗汉商务印书馆收起全文d,0
因为喜欢你UNIQ王一博所以支持天天向上希望你一直可以开心王一博L用户6736544219的微博视频,1
120元降到80元北京调整新冠核酸检测价格1月29日记者从北京市医保局获悉为进一步做好北京市新冠肺炎疫情防控工作减轻群众检测费用负担经认真研究即日起对北京市新型冠状病毒核酸检测相关政策进行调整新冠病毒核酸检测价格由120元次降为80元次混合检测价格也同步调整北京市医保局明确调整新型冠状病毒核酸检测项目价格单样本检测价格调整为80元次同步调整混合检测价格即根据疫情需要按照市卫健部门技术要求和标准实施混合检测时5个样本混合检测每样本按不高于30元收费10个样本混合检测每样本按不高于20元收费上述价格为最高指导价格不得上浮下浮幅度不限相关部门将综合考虑检验技术发展进步和相关成本变化等因素对项目价格进行动态调整据悉此前相应的价格分别为120元次40元样本30元样本各有关医疗机构应当主动在显著位置公示新型冠状病毒核酸检测及混合检测价格严格按照规定向患者提供服务并收取费用规范自身价格行为各检测机构应同时提供不同服务供群众选择据悉此次调整涉及北京市公立医疗机构非营利性医疗机构医保定点医疗机构疾控中心以及相关单位人员自2021年1月28日起执行北京同心抗疫为爱而行健康科普汇北京疾控提醒您健康北京战疫有我北京战疫新冠肺炎关注新冠肺炎生活百科健康生活新冠终止疫情北京疫情疫情健康大连健康养生健康生活健康小知识健康一冬防疫疫情防控新型冠状病毒加油北京北京抗疫创建全国文明城区抗疫创卫进行时文明大兴青云古镇微博协和胖大夫潘慧北京大兴北京发布首都健康微信公众平台京南福地医药圈爱我大兴社区网健康大兴北京市社区卫生服务管理中心北京大兴北京健康教育北京市城市管理委员会收起全文d,3
原神佛系玩家是我,2
李叔也辛苦了龙队加油果窖_1988李叔就直接跟着胖球流浪到能回那天吧有您不愁没消息马龙加油哈,0
基督城酒店新冠病例的罪魁祸首竟是垃圾桶两个人在克赖斯特彻奇的隔离和检疫酒店被检测呈阳性人们怀疑罪魁祸首是一个垃圾桶公共卫生总监CarolineMcElnay博士说在CrownePlaza进行的调查包括观看CCTV录像表示垃圾箱可能是新冠病毒的来源2新西兰基督城新冠2新西兰收起全文d,3
啊啊啊马龙哥哥,0
原神荧深渊公主图片来自推特已授权链接O网页链接原神原神,2
我妈说马龙唱每首歌都像念经,0
原神寻迹寒山道原神陪少爷公子看风景阿贝多与派蒙同框啦,2
发布了头条文章师徒情深马龙张继科领衔国乒众将士给刘国梁道喜刘国梁一一回复O师徒情深马龙张继科领衔国乒众将士给刘国梁道喜刘国梁一一回复,0
被工作充满人生的间隙也有满满幸运泡泡玛特密林古堡原神2兰州,2
笑死了哈哈哈哈马龙你好土啊,0
抢钱啦抢钱啦原神,2
原神开播咯好嗨哟办卡看号打塔细节专业路线规划太有意思了8错过再等一年斗鱼直播平台O网页链接,2
原神ㅅㅂ和璞鸳我还没抽出来呢,2
紧急状态宣言呼吁减少八成人际接触日本发布了紧急状态宣言意味着政府可以采取包括限制民众私权的措施以防范疫情蔓延对象是东京埼玉千叶神奈川大阪兵库和福冈七个都府县首相安倍呼吁民众严格控制外出减少7080的人际接触O网页链接日本新冠紧急状态宣言安倍在新闻发布会上说按照现在的传染速度两周后东京的感染者将达一万人一个月后将超过八万人为此他敦促七个都府县的知事按照宣言要求呼吁民众自我约束节制外出并强调只要能将人际接触机会至少降低七成甚至努力减少八成那就可以在两周之后扭转感染者的增长势头同时首相安倍要求民众积极配合除了维持社会功能所必须的工种外尽可能在家办公如果必须去公司上班他要求将上班人数至少减少七成并采取错峰上班等措施针对前述七个都府县以外的民众他提出希望避免出现密闭空间密集场所和密切接触的三密情况另一方面他表示紧急状态宣言绝非海外一些国家采取的封城措施呼吁大家保持冷静并且要避免从宣言实施对象地区前往地方城镇收起全文d,3
某C爱吃葱artworks87069615原神甘雨原神CocogoatKurisukun的插画pixivO网页链接12胸見せ,2
祖马龙香水很著名哦感觉很好闻,0
1新冠会永久性地带来诸多生活习惯和工作方式上的改变甚至是婚姻和家庭构成2首先会把人群从办公室写字楼大城市人群密集区进行疏散3很多技术5G等和中国新城镇建设中西部大开发正好先见之明般地符合这个逆城市化发展百年变局空置率再创新高这些城市最严重O空置率再创新高这些城市最严重收起全文d,3
王一博冰雪运动推广大使说给玫瑰欣喜相逢王一博央视网体育国庆冰雪乐小央也很高兴能在这样一个特别的日子里与一博在CCTV5相遇期待更多小伙伴关注冰雪运动,1
疫苗疫苗接种L高州市融媒体中心的微博视频,3
王一博给对方一点宽容和理解,1
英国小队长News新冠疫苗接种套餐近日英国一家会员制的高端旅游公司推出了一个4万英镑约353万人民币的疫苗套餐供超级富豪们飞往迪拜和印度接种新冠疫苗英国英国疫情疫苗新冠疫苗,3
原神跟基友发现一只超可爱的小猫今日份的疯狂截图,2
新冠下的日本东京都知事小池百合子紧急记者见面会打响面向夜店等夜间营业场所的第一枪各种年轻人容易聚集的场所基本可能被一扫而光包括各种酒吧夜店卡拉OK全部对象范围内要求自肃,3
我知道是祖马龙哈哈哈哈哈哈哈,0
阿尔法龙晚安马龙2018年加油,0
噗po主专挑马龙闫安谁都打不上的一段po嘛,0
原神痛苦弓甘雨快乐弓,2
原神请问有美服的大佬愿意带我这个43级手残渣渣打一打无相么,2
王一博巧了我也不关注别的明星只关注你这个小,1
新冠源头,3
抢啊抢啊关注我带你观看更多视频我无法呼吸大型双标现场美国退出联合国人权理事会联合国人权高专谴责美警方暴力执法联合国人权二十周年联合国人权联合国人权高专联合国人权理事会联合国人权高专办联合国人权专家联合国人权委员会联合国核心人权文件汇编张伟主编全球疫情美国美国疫情新冠病毒新冠新冠肺炎疫情疫情全知道抗击疫情美利坚美利坚灯塔国威虎堂军事新闻茶余饭后我的2020新闻启示录美国部分示威者焚烧美国国旗美国部分示威者焚烧美国国旗美国明尼阿波利斯市进入紧急状态美国500多名士兵前往明尼阿波利斯等地美国示威现场发生枪击事件美国警察暴力执法致黑人死亡引抗议黑龙江吉林新闻哈尔滨新闻新疆塔里木北京天津生活河北燕京贵州云南西藏陕西身边事西安甘肃青海山西河南浙江湖北山东四川广西福建两广两湖广州从化齐齐哈尔安徽上海浙江江苏安徽江西桂林湖南香港内蒙古深圳宁夏义乌海南省澳门湛江深圳南京南昌辽宁L易道老庄8046的微博视频收起全文d,3
王一博王一博王一博不愧是你贵气小王子,1
行业疫苗,3
王一博爱你哦强烈支持一博新代言希望你一切都好不理世俗一路直上UNIQ王一博,1
粉丝认证号我刚刚领取了7天闪耀的王一博粉丝认证号No3001776好嗨森成为微博会员即刻保留认证号官方盖章你值得拥有O粉丝认证号王一博,1
这要被你爸听见乱说什么马龙,0
南方公园的疫苗特辑很写实美国疫情疫苗LE1108的微博视频,3
王一博王一博我正在为王一博打榜王一博已获得798781票本周实时排名第名本月第4名wx搜索小程序偶像影响力加入王一博队伍一起用爱解锁最强福利偶像影响力榜,1
非洲民众抗议辉瑞疫苗是给精英的中国疫苗是给我们的疫苗非洲O非洲民众抗议辉瑞疫苗是给精英的中国疫苗是给我们的,3
我一直以为我没拆的那瓶祖马龙是多囤的鼠尾草海盐原来其实是蓝风铃吗那要不要干脆拆了用啊,0
原神寒霜的雷杯,2
好家伙单抽出奇迹啊米哈游这是要让我回坑哈哈哈ಡωಡ原神2苏州,2
原神原神魈活动开启之后就要冲了冲着这个颜值我也要拥有他,2
街角已被点亮又落空王一博数据组王一博wyb王一博伊利欣活应援官和一起UNIQ王一博给爸妈送上最活力应援,1
龙队好棒一切看我的心情啊马龙就是goat,0
英国小队长News秋季推出变种病毒疫苗在2月11日和牛津大学联合开发新冠疫苗的制药公司阿斯利康AstraZeneca表示针对新冠变种的疫苗将在春季开始临床试验在秋天量产推出英国英国疫情疫苗,3
原神更新26国1地区登顶p6p7更新21国1地区登顶p3p5魈18国2地区登顶p1p2日韩赶上新游戏开服目前排氪金榜2魈的人气是真的高真的高不愧是我老公米哈游你这不意思意思很难解释哈原神原神收起全文d,2
2019年的夏天滑板加入了王一博的生活也因为滑板让他结识了一群新的朋友大家一起拼搏一起享受滑板带来的单纯快乐UNIQ王一博王一博冰雨火有翡陪你到世界之巅陈情令展开全文c,1
我正在游戏新春市集抢原神的礼包晒游戏最牛道具赢原神游戏福利wowO游戏新春市集原神,2
刹那之后寒灯空夜m_l嗷期待马龙龙,0
原神丘丘人是我们的朋友crTwishinyshynii,2
原神虽然不知道为什么上热搜但还是请大家来磕cptumblrevercelle侵删,2
因我母亲普通感冒去世为了指出是太原市太航医院的医疗责任我申请了医疗鉴定这个权利是国家赋予每个公民的医疗鉴定中太航医院和太原市卫健委对我指出医院的医疗责任无异议但不知为何太原市卫健委在拖了1年7个月后竟然剥夺了我的医疗鉴定权它玩忽职守滥用职权人权被随意剥夺投诉渠道被堵死已无路可走某斌就直接找医生我只能选择网上寻求帮助我实名举报太原市卫健委权力寻租太原市太航医院就是权力的受益者我真诚希望监察纪检卫生系统的上级部门能来审查先查我举报是否属实不属实法办我如果查出太原市卫健委确实违法请对蛀虫别手软我的资料他们2方全有患者儿子李杰日期20199如果本人突然不发贴了那就是在无依法处理医疗纠纷前就被某部门控制自由了那就意味着我的自由人权被侵犯本人既然敢发就无惧后果因为所说全部属实不要总想搞死发现问题的受害者却放了那些制造矛盾违法行政单位国际疫情新冠病毒新冠新冠肺炎疫情疫情全知道抗击疫情抗击新型肺炎第一线人类命运共同体疫情防控全球疫情疫情抗疫抗疫行动海外抗疫日记世界卫生组织谭德塞美国疫情全球疫情每日速递关注新冠肺炎共同战疫可阻断新冠感染的人源单克隆抗体收起全文d,3
