微博内容,类标签
395祖马龙Jomalone黑石榴PomegranateNoir一袭大胆红裙的诱惑石榴覆盆子李子等红宝石般美丽的鲜果在红胡椒的烘托下香气愈加醉人更伴有香水百合与木本香料的芬芳深邃神秘香雾朦胧迸发迷人芬芳为空间即刻打造个性印象,0
马上要进入18年的最后一个月了11月爱上了祖马龙每天都喜欢不一样味道的自己到手的两款都非常喜欢后调海盐很清新是干净的海风的味道英国梨前调有点水果香后调很温柔祖马龙留香很短真的是见识到了最喜欢味道是快散没了时候隐隐约约的香这时候最觉得自己还是个精猪女孩然后期待将要回来的蓝风铃ps今天比较开心的是有个来办事的原本想说对面的女的没说出口换成了奴子说明大家眼里我还是个小姑娘收起全文d,0
我就说原神这么火CHANXCO老师不可能不画莫娜原神,2
原神我真没想到卢姥爷会变成我队伍里最弱的看来我得给卢姥爷刷刷圣遗物了,2
美人蹙眉凝光原神,2
马龙小西红柿应该和葡萄做朋友Thames_只愿你好的金牌哥哥不过不要自我否定你就是最厉害的,0
王一博奶精王一博我正在为王一博打榜王一博已获得10395702票本周实时排名第1名本月第1名wx搜索小程序星之最加入王一博队伍一起用爱解锁最强福利星之最,1
原神悲伤的空图片来自推特已授权链接O网页链接原神原神,2
王一博陪你到世界之巅王一博安慕希品牌代言人期待明天的直播,1
原神胡桃动漫头像动漫女头pv终于放出辣已经准备好90级护摩就等闺女开池,2
原神刻晴刻晴cos剑光如我斩尽芜杂出镜原po摄影宵云钰后勤一方要晚睡早起蓝花受受和小钰的小弟刻师傅来牛杂了,2
好可爱王一博wyb王一博平安喜乐Watermelon_王一博资源博王一博来伊份品牌代言人王一博饭绘210205来伊份更新宣传视频造型饭绘UNIQ王一博王一博,1
像19岁的马龙,0
疫苗美国2021年美国疫苗接种计划O2021年美国疫苗接种计划,3
不会做饭但是能吃王一博天天向上wyb王一博王一博,1
原神最近原神的记录从12月初开始玩的抽卡是76787981其中常驻池2金全是武器没出过角色有迪卢克没有狼的末路有甘雨没有阿莫斯之弓入坑晚了没赶上可莉和温迪机制方面特别伤尤其温迪原神有没有温迪两种体验早期主c用的雷泽现在也在用雷泽up期间131抽0命至今没有迪奥娜和七七没有冰奶导致一直无法拥有双火的增伤全地图跟着2个up的攻略各扫了一遍但珉林碧水原苍风高地均不满探索度宝箱仙灵限时挑战岩之印等所有能加探索度的东西都找完了为什么不满就很奇怪而且是三个地区不满总的感觉确实不顺玩的阵容凑不出来4星角色抽卡也都是保底还不出角色探索度方面有比我宝箱少的但探索度全满趁着热情还在先玩着吧希望能转运等哪天热情没了还这么糟心那只能选择快乐的放开了如果玩游戏无法给我快乐的话放手是正确选择收起全文d,2
get疫苗2厦门,3
森林驿站101太原市一场大火带走13条生命根源就是职能部门人浮于事漏检导致表面上的火扑灭了可扎根于公务员心理混日子的邪火仍熊熊燃烧这就是太原市卫健委吞咽着患者鲜血踩着患者带血的纱布残肢尸体捞政绩向上爬太原市应该吸取教训整顿吏治抓蛀虫造福百姓否则还有冤魂会缓缓走来为民服务他不行祸害百姓他第一因我母亲普通感冒去世为了指出是太原市太航医院的医疗责任我申请了医疗鉴定这个权利是国家赋予每个公民的医疗鉴定中太航医院和太原市卫健委对我指出是医院的医疗责任以及病历的缺失无异议但不知为何太原市卫健委在拖了1年7个月后已过法律时效同医院又一起否认当时我指出的医疗责任为何有操作有内幕还剥夺了我的医疗鉴定权自此我丧失了可以定责医院的权利国家给公民解决医疗纠纷的渠道被野蛮堵死太原市卫健委由执法者变为违法者国家法律被他踩于脚下我人权被剥夺投诉渠道被堵死已无路可走我只能选择网上寻求帮助我实名举报太原市卫健委权力寻租太原市太航医院就是权力的受益者我真诚希望监察纪检卫生系统的上级部门能来审查先查我举报是否属实不属实法办我如果查出太原市卫健委确实违法请对曱甴别手软我的资料他们2方全有患者儿子李杰日期20184如果本人突然不发贴了那就是在无依法处理医疗纠纷前就被某部门控制自由了那就意味着我的自由人权被侵犯本人既然敢发就无惧后果因为所说全部属实不要总想搞死发现问题的受害者却放了那些制造矛盾违法行政单位太原检察太原政法太原中院后浪青春共筑防疫长城美利坚灯塔国美国人权美国大选川普总统美国国债我愿意为你守护奔涌吧后浪ATV头条日报香港头条大公网TVB香港商报华星卫视新闻亚洲电视法国那些事儿法国新闻欧洲新闻新冠病毒新冠新冠肺炎疫情疫情全知道抗击疫情抗击新型肺炎第一线人类命运共同体疫情防控全球疫情疫情抗疫抗疫行动海外抗疫日记世界卫生组织谭德塞美国疫情全球疫情每日速递关注新冠肺炎共同战疫国际疫情收起全文d,3
对ittf无语马龙的成绩已经一骑绝尘记录也不胜枚举他不需要用一些奇怪的记录来证明自己尤其是跨性别对比疯狂展望排名第五的运动员怎么回事曲今看到ittf给他定的各种奇葩目标真的很无言他又不是什么破纪录的机器男线成绩已经是第一人早不是什么追赶者有些展望实在可笑,0
原神传闻中的KFC联动风之翼从图上来看名叫异世寻味之翼该活动目前还没有官方实锤一切以官方消息为准,2
王一博wyb王一博天天向上他怎么又自信又腼腆呀,1
马龙2020WTT澳门国际乒乓球赛央视频回放1回放世乒联澳门国际乒乓球赛男单种子排位赛林高远13马龙O网页链接2回放世乒联澳门国际乒乓球赛男单种子排位赛第二轮许昕32马龙O网页链接3回放世乒联澳门国际乒乓球赛男单14决赛马龙32郑荣植O网页链接4回放世乒联澳门国际乒乓球赛男单半决赛马龙41林高远O网页链接5世乒联澳门国际乒乓球赛男单决赛马龙51王楚钦O网页链接收起全文d,0
开工首更侦探推理馆限时免费收听今晨醒来将新型冠状病毒疫情列为国际关注的突发公共卫生事件的新闻铺天盖地面对担忧和不安我们能做的就是为事件早日过去尽一份责任字节有趣决定为宅在家中的你献上一份薄礼我们的宗旨正如我们的标题宅家听案不给祖国添乱让听友们听到有温度的好节目是字节有趣全体员工能够为祖国做的些微小事新冠收起全文d,3
动漫壁纸美图原神感谢各位小伙伴们的赞和关注ﾉ画师Zumi,2
祖马龙限量10件套礼盒套装,0
马龙为什么这么可爱嗷呜,0
原神200个原石秋梨膏,2
王一博酷盖王一博青年演员王一博wyb正能量艺人王一博王一博平安喜乐王一博吧_WYBBar王一博wyb王一博代言肯德基福利来了快来和酷盖UNIQ王一博一起尽享欢乐,1
王一博王一博明月清风皆入你眼星光烂漫皆你是美好愿我怦然心动如往昔,1
回家之后花了三个多小时从头发丝到脚趾头精致了一把东西实在太多了皮肤好到史无前例2020给自己新挑战美白全身每个角落都不放过自制身体乳祖马龙身体乳小灯泡雪肌精擦全身应该有效果吧,0
杏鸽画师推送原神ˍ岸Yasuripixusers25891894artworks87356352,2
好运来祝你好运来原神原神甘雨,2
王一博天天向上wyb王一博今天也要爱护眼睛哦王一博的声音很好听啊沉静温和有平静的力量注意休息保护视力王一博给眼保健操配音又是一周新来到还在家中上网课的小朋友和大朋友们记得熟背眼保健操保护好自己的视力哦UNIQ王一博L天天向上的微博视频正直善良展开全文c,1
王一博UNIQ王一博你那么优秀是正能量的爱豆有那么多特长还那么勤奋为了喜爱的事物会拼命努力你专注的样子太迷人说什么将来要把女儿嫁给你之类的都是玩笑话作为一个普通的粉丝一个和你相差甚远的平头百姓只是默默关注希望你能越来越好虽然我也是狮子座虽然我很霸道展开全文c,1
上马龙下马虎呢,0
王一博有翡剧方否认王一博耍大牌王一博没有在人前说他以前有多苦表面清冷不易接近的他却会为问路的陌生人指路我们见到的都是礼貌谦和的他每一个跟他合作过的都称赞他敬业这么一个清楚自己的位置清楚地知道自己要什么为了达成梦想有着无比毅力又坚强的人你觉得他会在事业刚刚起步的展开全文c,1
全国累计确诊新型肺炎24324例新冠现在非常时期我们很理解也很配合我们温州回来的要居家隔离也有好好做到妈妈感冒发烧了需要留院观察也都配合但是每次做点工作就一群人到我家门口指指点点手指着我们鼻子说话真的太过分了也是第一次让你们送菜就说我们有点小事就叫你们那我们不能出去你们不送菜难道我们要不吃不喝吗医院突然要求妈妈留院观察衣服充电器都没有让你们帮忙拿去这要求也过分吗一群人说话也没人听我们说请求这样就能解决问题吗最过分的是看我录视频还把我手机打到地上甚至抢过去这样做思想工作我真的无法理解不知道能打什么电话举报2金华磐安县O网页链接收起全文d,3
美国疫苗又致人丧命瑞典老百姓发话给我1000万也不打据海外网1月2日的报道有240名以色列人在接种了美国辉瑞疫苗仍然感染了新冠病毒300多人出现严重不良反应另有4人在接种美国疫苗后死亡此外据海外网1月4日的报道1名葡萄牙医护人员在接种了美国辉瑞疫苗2天后死亡死因不明新加坡联合早报2020年12月上旬就披露美国辉瑞公司的新冠疫苗在测试阶段就导致6人死亡尽管如此为了和中国竞争美国仍然授权辉瑞疫苗紧急使用微博公开课疫苗发布了头条文章美国疫苗又致人丧命瑞典老百姓发话给我1000万也不打O美国疫苗又致人丧命瑞典老百姓发话给我1000万也不打收起全文d,3
简讯韩国新增例新冠确诊病例累计例新冠韩国疫情韩国中央防疫对策本部27日通报截至当天0时韩国较前一天0时新增感染新型冠状病毒COVID19确诊病例O网页链接,3
原神我打我自己看角色头像原神原神L原神海外搬运的微博视频,2
马龙新年快乐倒计时ฅωฅ,0
好好看王一博愿你平安王一博米奇比心王一博平安喜乐在一起王一博粉丝王一博天天向上王一博吧_WYBBar王一博wyb王一博nike官方合作伙伴又晒新鞋啦UNIQ王一博,1
王一博给宝宝吃讨厌生姜哈哈哈哈哈哈哈哈哈哈哈哈哈笑死人间小年糕笑死我了博博の猛男梦碎想做甜甜的跳跳糖哈哈哈哈哈哈哈哈音特奈神那乌让孩子吃完我无事忙哈哈哈哈哈给我儿子留点面子,1
专家打完第一针疫苗最好是在打完第二针疫苗之后再过两周再出国,3
所以我刚才为什么要去刷视频p图都不敢这么p居然是直播录像我不能接受原神原神,2
干细胞临床治疗新技术的进展在武汉已经完成超过200例的干细胞治疗从结果看干细胞应用于临床性效果良好干细胞正能量新冠L爱助细胞中心的微博视频,3
英国小队长News英国迎来第四种新疫苗据英媒报道英国将在几周内批准第四种疫苗有效率达89且对变异病毒也有效英国目前疫苗接种计划使用的疫苗分别是阿斯利康辉瑞牛津疫苗英国疫苗英国疫情,3
原神Reddit用户kisk123制作了像素风格的魈,2
原神公子钟离图片来自推特作者同意转载链接O网页链接原神原神,2
疫苗2北京,3
新冠病毒疫苗需要打几针关注新冠肺炎适用于哪些人群打完后能不能摘口罩通过一组图一起了解新冠,3
转看点快报大冷门97后国乒小将先胜马龙再胜许昕最后击败樊振东即可夺冠O网页链接,0
刚刚我下载了某音然后关注了王一博然后我一边刷一边笑再也停不下来了春晚,1
打疫苗哭成影帝快手快手LCGTN的快手视频,3
居家日用小苍兰沐浴露洗发水原价399元券后价199元进口祖马龙小苍兰香氛国际调香师团队倾心打造高贵淡雅怡人挑战72小时持久留香深层温和洁净滋润肌肤补水保湿改善肤质轻松洗出香嫩滑令肌肤水润嫩白赠送运费险超红带货挑战赛分享购物花式种草花式种草社区小苍兰沐浴露持久留香洗发水护发素套装网红同款沐浴露保湿收起全文d,0
又刷了一遍何同学的5g视频突然发现何同学下的歌都是马龙的哎谁能拒绝可爱的龙宝呢,0
原神达达利亚钟离魈图片来自推特已授权未经允许不得擅自转载链接O网页链接原神原神,2
可爱的男孩子原神cos试妆初次营业P图p的可辛苦了,2
一比一90祖马龙香水古典流苏大红英国梨100ml,0
祖马龙不知道哪款范丞丞这神秘的少年儿,0
太痛苦惹每天不干正事一直在找宝箱顺便给魈刷刷材料原神,2
我发布了原神快手快手L柒风的快手视频,2
原神原神酱酱直播玄学抽卡你们觉得这波手气怎么样彩蛋在视频后面L橘子酱是烧酒的微博视频,2
王一博有翡,1
今天的比赛就又是一场手感警告和概率警告马刺中距离持球投人人准如阿杜讲真假设把今天马刺投出这么多中距离的球员都换成阿杜保罗米豆这种中距离大神集体投出这种逆天的命中率也是小概率事件另外系列赛里一直担心的盖伊这一点今天爆了马应龙没有用对位盖伊有奇效的普拉姆利进行限制有点令人惊讶其实马刺今天防守做的并不好掘金近框终结表现也很逆天攻框做的也不错而且大量攻框的情况下失误率并不高只可惜马刺用复古的对攻方式竟然能获得一场大胜绝对是近年来最反魔球化的一场胜利关于抢七有几点想说的双方底牌其实第一场就亮完了无非就是猜拳问题都不能做到攻守均衡的情况下怎样打好手中的牌做好田忌赛马两位指导已经是算计到不能再仔细了两支球队即使摆进攻阵容侵略性都不是强项手感依然是生命线又回到了概率和数学期望问题马龙教练在用人上可以再果断一点其实系列赛开始前掘金球迷很担心盖伊这个点爆发毕竟掘金外线没人能对得上盖伊然而前几场普拉姆利大防小的对位收到了奇效今天这种对位却消失了另外巴顿是什么鬼防守端谁都对不上进攻端也一塌糊涂马龙教练可以坚定的缩短轮换重用一下比斯利毕竟比斯利进攻端有篮子防守端虽然体型偏小但是比赛动力很棒还是那句话掘金和马刺攻守平衡做不到的情况下掘金手里的牌点数还是要大一点同点数的牌也更多一点而且主场作战如果抢七模拟10000次掘金可能会赢下其中的6500次这是概率和数学期望问题但是篮球呢只有0和100这就是抢七的魅力所在吧2长沙中南大学资源与安全工程学院收起全文d,0
沐浴乳女士祖马龙沐浴液香水沐浴露持久留香349领券拍微博专享限时领券省钱白菜内部券内部优惠券神器,0
山东烟台市十二学教育科技有限公司是一家从事中小学网络教育的科技型小微企业疫情防控期间学校学生全面转向线上课程学习但是还有部分学校苦于没有线上教学平台特别是一些县城里的中小学校很难在短时间内找到合适的资源完成平台搭建和师资培训公司负责人王勋达说越是这种时候企业越要有担当3月份十二学公司宣布疫情防控期间免费开放教学资源短短三个月平台新注册学校125所覆盖老师9382人学生65483人许多学校和学生利用其网络课堂平台学到优质的线上课程免费开放注册后用户量激增平台服务器容量网速流量单点登录峰值不断承压在线客服驻校人员的线上接访工作量也在成倍递增受疫情影响公司很多项目暂缓或停滞流动资金也面临很大压力王勋达说随着业务量的激增公司的资金需求十分迫切按照传统信贷考核标准轻资产创新型的教育类企业并不是银行眼中的香饽饽然而这几年十二学公司却在银行的扶助下一步步发展壮大6月2日中国银行再次将公司的授信总量由400万元提升到1500万元后续将根据企业用款需求进一步投放贷款从两年前的150万元到如今的1500万元授信额我们对十二学公司鼎力支持该公司作为轻资产的企业没有多少可供抵押固定资产和其他担保措施我们创新授信方式从企业现有规模签约尚未落地的客户数未来拟拓展客户数增加人力及研发成本与拓展客户比例等多维度出发给企业做了综合评估中行烟台分行普惠金融部总经理孙守东说中行与十二学公司组建工作组开展驻校一对一服务手把手帮助老师学生家长创建账号协助校方完成平台转换按照校方不同需求组织个性化培训做好贴心服务目前中国银行正在深耕教育行业这片金融服务的蓝海为积极支持稳企业保就业中行近日发布中国银行支持教育行业中小微主体复工复产十条设立百亿元教育行业专项信贷规模优先保障受疫情影响的中小微主体的授信需求为存量客户提供展期续贷等服务创新特色化的授信业务新模式率先推出面向教育行业中小微主体的金融支持政策通过授信代发薪资金归集与增值现金管理分类结算财务顾问投贷联动银保联动等一揽子支持措施为大量优质教培机构纾困解难基金A股期货新冠收起全文d,3
提升美商最近开始养花与使用香水花加的野逸系列很符合我的审美一年前买的祖马龙忍冬半个月前突然想起来用喜欢这种微微的淡雅清甜可能是性格太燥反倒喜欢一切中性低调性冷淡的物品,0
王一博王一博我正在为王一博打榜王一博已获得10906103票本周实时排名第2名本月第1名wx搜索小程序星之最加入王一博队伍一起用爱解锁最强福利星之最王一博无感wyb王一博梦幻独家营业每天都要记得为全世界最好的UNIQ王一博加油哦2邵阳,1
晚安sheerios最近两周疯狂循环马龙的新专希望两位大脸歌手未来有合作soon出类似StayMyself的歌曲BeforeIdroppedPlusnoneofyallreallycaredNowtheyalwayssayCongratulationstothekid,0
123狂欢节wyb王一博喜马拉雅爱的代言人快来冲啊姐妹们,1
王一博微博之夜wyb王一博夸,1
起初是不想打现在是身体条件不允许疫苗2张掖,3
哈哈哈哈哈说得好认真,0
今天的晚安是祖马龙的红茶味整个皮肤和被子里都是自然的香味太喜欢啦沉寂了整个孕期和哺乳期没用一点终于我的快乐一点点都慢慢回来了,0
马龙今天的马龙肯定是比昨天更努力的马龙明天的马龙肯定是比今天更强大的马龙captain龙,0
618特价698祖马龙香水套装青柠罗勒与柑橘英国梨与小苍兰黑莓与月桂叶蓝风铃鼠尾草与海盐各9ml每支独立带喷头,0
小伙伴们获取到原神原石礼包了吗关注4399游戏盒评论区揪30个小可爱送4399游戏盒专属的原石礼包礼包内容北地烟熏鸡5大英雄的经验3原石20在新版本来临之际除了原石礼包外4399游戏盒还给大家准备了实物奖励活动前往4399游戏盒搜索数字口令51177即可以参与原神福利放送活动有机会获得荣耀平板游戏手机马克杯原神挂件派蒙手办徽章鼠标垫等好礼备注此礼包在4399游戏盒各处均有发布相同内容礼包不能重复使用如果已在其他地方进行领取或领取过相同礼包那么就将礼包赠与给没领取的小伙伴吧没获得的小伙伴也可前往4399游戏盒搜索口令64499通过4399游戏盒福利中心通过盒币兑换原神礼包总之就是送送送下周三开奖O抽奖详情收起全文d,2
上海启动动重点人群新冠疫苗接种工作你打疫苗了么新冠疫情L带你走近白衣天使的微博视频,3
王一博神的孩子在跳舞,1
一看荔枝冲动就买了买完发现是番荔枝原来番荔枝是释迦啊没文化真可怕快哭了快哭了快哭了祖马龙今年春夏有这缕花香就够了O网页链接O网页链接,0
原神魈钟离甘雨老父亲属性的钟离图片来自推特已授权链接O网页链接原神,2
每日医刻今日医疗圈新闻速递①辉瑞和Moderna提议加速新冠疫苗接种一次打两针遭美国政府科学家反对②国家即将启动胰岛素专项采购六省二区药品带量采购第二批即将开始③中国生物制药研制的预防化疗引起的恶心呕吐药物善启在美获批④欧洲药品管理局发布关于礼来和罗氏合作的双抗体疗法在欧盟治疗新冠确诊患者的建议⑤镁信健康宣布完成10亿元B轮融资蚂蚁集团上海生物医药创新工场联合领投新冠疫苗胰岛素带量采购化疗新冠镁信健康了解更多财健资讯请点击关注或扫描图片二维码收起全文d,3
王一博冬奥文化推广使者Watermelon_王一博资源博王一博王一博冬奥文化推广使者视频和冬奥文化推广使者王一博一起为运动健儿加油UNIQ王一博王一博,1
原神原神四格漫画第一话凌晨一点的天空岛从下面看还是从侧面看,2
马龙全锦赛加油首先谢谢阿龙的恩师们咱们阿龙要健健康康快快乐乐我也是时候可以再买一个杯子啦,0
居然有大半年没看龙打球了,0
英国房产通迈向自由的第一步复课英国疫苗解锁新年龄段人群英国伦敦伦敦英国英国时讯英国疫情英国留学英国生活伦敦生活伦敦留学新冠肺炎关注新冠肺炎疫苗L英国房产通的微博视频,3
王一博好可爱啊宝宝,1
新冠口罩马云草长莺飞进入四月新冠病毒已经持续了好几个月现阶段我国已经牢牢的控制住了病情它却在海外继续进行蔓延戴口罩的必要性戴上口罩很多人可能身体会感到难受可能会存在这样的疑问那就是到底什么时候可以O网页链接淘小铺,3
云南马龙文化大餐接地气群众家门口享乐趣O云南马龙文化大餐接地气群众家门口享乐趣,0
holamanzana硬核reaction有一点跟大佬不谋而合那就是乔佩西是最好的黑帮片演员没有之一高于马龙白兰度和艾尔帕西诺,0
王一博酒亓八五这套衣服我太喜欢了,1
王一博原著中我超爱蓝忘机隐忍勇敢正直专一是我心目中仅次于乔峰的好男人今年夏天因为王一博的演绎从此所有对这个人物的想象都有了画面我真的超爱蓝忘机和王一博的蓝忘机所以不论是从原著还是电视剧我都无法接受有人说蓝忘机是挂件男主说这种话的人我只能说你根本不喜欢展开全文c,1
我的魈哪个比较好暴伤高的时候感觉暴击率偏低皱眉圣遗物太难出好的了原神,2
20190905第四天孩子们都很可爱希望能健康成长这边山路较多昨天遇到一场车祸出门在外一定要注意安全今天结束了马龙区的工作已经平安到达陆良晚安,0
全球疫情最新数据显示感染新冠已突破200万人美国疫情更是一天新增13万记录中国也面临着入境人数的压力目前黑龙江内蒙广州是三个加时赛主要战场疫情复工大家真的要保护自己鼓励单车骑行要远离人群聚集的交通工具,3
原神同人甘雨原神不玩原神但是画原神同人的人只涨赞不涨粉,2
我有罪请上天惩罚我而不是在我把怪磨成一丝血的时候让我男朋友把我号给挤了原神无语,2
2曲靖马龙大剧院你是个机灵的人吗有没有可能踩船的细胞不小心狐狸的名字掉了这么多你是恋爱贷款的女性吗2曲靖马龙大剧院,0
疫苗开封疾控最新通知接种新冠疫苗前这些你得知道文明开封,3
新冠是史上最牛逼的病毒专治各种不服有一种自由叫做新冠自由,3
微博Android客户端Android客户端意见反馈版本8110型号OPPOR9s系统601cmnet云南省曲靖市马龙区旧县街道袜度村委会水海子村民的土地被强行建养猪场合理吗还把村民拉去关着合理吗2曲靖旧县镇,0
原神有一起联机帮我打怪的吗,2
王一博优越,1
晏且归常觉得自己嘴笨没法将心中的感受表达出来就只会说喜欢马龙真好,0
原神干完这一票蒙德归璃月2广州,2
密切接触者达31437人疫情沈阳疫情新冠疫情防控,3
王俊凯来聊个香水吗柏林少女真的好香很像酸梅汤喂反转巴黎真的很女人很有女人味但是有有点甜甜的撩撩的修女后味比较书卷气银色山泉说什么穿着白衬衣的少年如何让女生心动的味道我觉得没有一般祖马龙蓝风铃我不喜欢脏话这款香水蛮不走寻常路的果然是男香不过女孩喷好像也带感冥府之路我喜欢有种神秘的感觉黑鸦片真的味道好性感啊超级女人的感觉是男人喜欢的味道玫瑰陛下玫瑰味很浓大吉岭茶虽然很多人吹得天花乱坠但是我不喜欢白色浪漫小清新我觉得男生也可以喷无人区玫瑰的玫瑰味没那么浓zml橙花和英国梨我觉得也就一般还有孤儿怨真的很孤儿冷冷的我觉得还不错收起全文d,0
