微博内容,类标签
原神呸抄袭游戏hetui,2
丁宁樊振东对你们或对我来说布达佩斯世乒赛已经结束了这几天心情大起大落睡也睡不好还要熬夜看比赛说实话从来没想到过会是这样的结果我是一个追星的人可是我依旧为你们两个我最喜欢的运动员着迷丁宁丁宁我的大宝贝第一次看见你就是12年伦敦奥运会决赛赛场第一眼就希望你能赢或许只是单纯的决定你名字好听可那次比赛真的不想再提当时只是有点心疼你为你可惜毕竟那时候还小也不怎么关注这些再次相遇16年里约奥运会看到你就认出来这就是我当初希望能赢的那个女孩然后比赛就一场一场的追直到决赛你圆梦了也正是因为里约我喜欢上你了因为你身上那股劲真的很有感染力之后就一直关注着你追你的比赛看关于你的新闻到后来的全运会杜塞尔多夫世乒赛都让我觉得你是一个超级超级棒的人我知道从去年至今你的状态一直都不是很好到你还是任然在坚持着即便在这条道路上你已经圆满了正是因为这样的你让我更加爱你所以没关系只要你想在这条路上继续拼搏我们陪你战到底本以为今天比赛输了我会有多难过但真的结果出来后也就释怀了虽然还是会有遗憾但是没关系啊这场比赛你丁宁又不是输不起所以我们就放下过去从新出发吧加油我最棒的宁队樊振东樊振东乒乓超级超级可爱的小胖16年里约听说你认识你慢慢去熟悉你然后觉得你真的很好很好虽然我平常不像关注我爱豆和宁队一样时刻关注着你但我会尽量去看你的每一场比赛一直以来我都觉得你特别优秀你知道吗每次你和马龙会师决赛的时候我内心都会一直呐喊小胖你可以的加油你要战胜马龙更要战胜你自己这次世乒赛我一直都认为你会走到决赛然后拼一把拿下冠军接着冲击东京奥运冠军可是竞技体育就是这么残酷你平时再怎么优秀这场没发挥好就是结果比起丁宁你的单打更让我不能释怀想起就想哭或许是因为你真的很需要这块金牌来证明自己可是我们不能改变结果我们唯一能做的就是继续努力小胖你要相信通往成功的道路不会一帆风顺所以请你在这条坎坷的道路上一关一关的闯一场一场的拼直到等到你樊振东时代的到来就像他们说的一样我希望世乒赛冠军是你成功道路上的最后一站接着拼搏吧为东京努力我相信你一定能做到而且我会永远支持你加油最棒最可爱最好的小胖我最喜欢的两个运动员配对混双别提我有多开心配对这么短的时间能拿到这个成绩其实真的很不错了虽然我们的目标不止仅限于这里如果还有机会我希望还能在赛场上看到你们配对甚至希望东京混双上看到你们一起努力吧我爱的你们为了你们心中的那个目标加油收起全文d,0
ACCA太原市卫健委就是个混日子养老的单位里面的工作人员连自己干什么的也不知道疫情当前让这些脑满肠肥只知道欺压百姓的人去保护太原4百多万老百姓身体健康靠谱吗希望纪检抓蛀虫还百姓一方安宁为民服务他不行祸害百姓他第一因我母亲普通感冒去世为了指出是太原市太航医院的医疗责任我申请了医疗鉴定这个权利是国家赋予每个公民的医疗鉴定中太航医院和太原市卫健委对我指出是医院的医疗责任以及病历的缺失无异议但不知为何太原市卫健委在拖了1年7个月后已过法律时效同医院又一起否认当时我指出的医疗责任为何有操作有内幕还剥夺了我的医疗鉴定权自此我丧失了可以定责医院的权利国家给公民解决医疗纠纷的渠道被野蛮堵死太原市卫健委由执法者变为违法者国家法律被他踩于脚下我人权被剥夺投诉渠道被堵死已无路可走我只能选择网上寻求帮助我实名举报太原市卫健委权力寻租太原市太航医院就是权力的受益者我真诚希望监察纪检卫生系统的上级部门能来审查先查我举报是否属实不属实法办我如果查出太原市卫健委确实违法请对曱甴别手软我的资料他们2方全有患者儿子李杰日期20184如果本人突然不发贴了那就是在无依法处理医疗纠纷前就被某部门控制自由了那就意味着我的自由人权被侵犯本人既然敢发就无惧后果因为所说全部属实不要总想搞死发现问题的受害者却放了那些制造矛盾违法行政单位山西省人民政府太原检察太原政法新京报卢书记应该怎么办人民日报评女子不配合防疫登记茅台集团员工一律不允许离开仁怀微信屏蔽拼多多小红书等外链美国各大软件联合封杀特朗普拼多多回应解约发帖员工新冠疫苗保护效力7934意味着什么俄罗斯一女子体内发现18种变异新冠病毒谁帮我们养老意大利女子19年11月已感染新冠婴儿用抑菌霜后成大头娃娃该不该加仓白酒股全国多地倡议就地过年特朗普称绝不会承认败选这两张照片值得刷屏民法典将怎样影响我们的生活2021年第一条微博低龄未成年人刑责范围再调整一张照片告别2020阿里巴巴涉嫌垄断被立案调查侄子侄女可继承叔伯遗产微盘点国考行测股票今日看盘拜登特朗普省考美国大选四六级成绩国考国考公告国考职位表平安2020第十四个五年规划初级会计成绩中级会计四六级护考教师资格证微信福奇白宫基金A股创业板新冠疫苗疫苗核酸检测口罩美国疫情收起全文d,3
粉丝认证号我刚刚领取了王一博粉丝认证号No3086983马上领取粉丝认证号官方盖章你值得拥有O粉丝认证号王一博,1
电影第299部教父1入选了Top250的电影豆瓣评分93剧情不介绍了就说几个关键词吧1972年的电影3小时时长开篇婚礼把庞杂的人物关系交待清楚了被称为史上最牛B的电影开头也曾因此被诟病节奏缓慢教堂洗礼的镜头切换影片高潮马龙白兰度教父系列一共三部曲后两部慢慢看吧重点看阿尔帕西诺了Lkillara日记的微博视频收起全文d,0
游戏冷知识穿越回200年前玩原神是什么体验最近小编玩原神这个游戏有些上头以至于看到十九世纪德国浪漫主义大师卡帕斯弗里德里希的名作岩石礁海岸的时候很想展开风之翼飞进画里然后恍然大悟原来欣赏这样的景色感觉到舒适早在二百年前就在德国被印证了然而200年后的游戏制作方米忽悠是家上海的公司为什么人类完全不同的文化底蕴对自然却有着一样的感官呢这幅画里弗里德里希利用一块引人注目的参差不齐的岩石一片延伸出来的海岸明亮的地平线远处的层层云朵和一片黯淡的天空使我们进入到一种救赎的悲伤的情绪里我们或许会想象这样的场景经历一个无眠之夜后我们漫步在黎明前荒凉的海岬之上远离人群独自一人面对大自然最基本的力量那些小块的岩石曾经也像它们旁边的大岩石一样引人注目雄心壮志地迎接风雨但是漫长的岁月总有一天会把它们也腐蚀掉靠近海面的天空是无形的空虚的虚无的如同无杂质的银白色那么纯粹但是在其上方的云层捕捉到了云层背后的光线并且用它们自己的方式瞬时随意地把光线释放出来丝毫不理会我们的关注卡斯帕大卫弗里德里希17741840是19世纪德国最杰出的浪漫主义画家1816年起在德累斯顿学院任教弗里德里希专门描绘崇高的悲伤浪漫主义原神艺术收起全文d,2
钟师傅的民间体验原神,2
发布了头条文章疫苗接种分两步马尔代夫的椰林树影印尼的珊瑚鱼群都在向我招手新冠旅行疫苗出入境O疫苗接种分两步马尔代夫的椰林树影印尼的珊瑚鱼群都在向我招手,3
这篇文章很有意思形势严峻当下世界疫情甚至比枪林弹雨的战争更加可怕新冠红十字武汉解封O网页链接,3
从各地的新冠病例行动轨迹中我彷佛看到了各地的风土人情江苏卷难有难的道理2南宁,3
马龙加油ωBaiduMaLongBar马龙马龙2019中国公开赛加油资格赛新手请多关照马龙同学听说多和小编互动能有更多新鲜马龙掉落,0
同样是万人祭为什么画风能差那么多万人祭日本霓虹疫情祭祖黄帝陵祭祖辣眼睛新冠新冠肺炎已开始在日本流行轩辕文明,3
王一博喵不可言滴滴出行网约产品代言人王一博王一博王一博滴滴出行UNIQ王一博,1
马龙便是我们心目中国之娇子该有的样子奥迪英杰汇进取先锋马龙,0
马龙余本人i独宠毛不易第二个520无问毛不易数据特攻站毛不易向全世界安利毛不易可爱的人儿我已无法形容你的毛发那就小年快乐毛不易,0
可爱的意大利奶奶新冠意大利北部11个市镇封城隔离LLiu_Enming_刘恩铭的微博视频,3
再来吴哈哈小姐姐转关送脱单神器祖马龙香水一支在大学一定要谈一场甜蜜的恋爱啊,0
台湾医生感染新冠肺炎却没疫苗可打是谁在伤害一线抗疫医护为众人抱薪者不可使其冻毙与风雪一线医护人员冒着危险守护着我们每个国民的生命我们应该给这些英雄们最好的防护保证医生可以安全放心的救人在全国人民普及疫苗的时候台湾的医护人员却迟迟没有等到到底是谁在伤害一线的防疫医护人员呢vlog军事分享官军事中国台湾爱国正能量疫情疫苗新冠肺炎医生防疫防疫工作者L台湾辰瑞的两岸观察的微博视频收起全文d,3
王一博奶宣站王一博wyb王一博明暗光感大片花好月圆闹元宵UNIQ王一博今晚我们不见不散王一博,1
一位陌生人给我领路开隐秘箱子打怪在地图里面跑了两个多小时感觉里面的人都很好游戏也很治愈就是身边好朋友都不怎么玩原神,2
二度合作吧ciel李小姐哥真的想马龙了,0
推荐一下这个沐浴露味道真滴好闻起码本人是真的爱小苍兰包括祖马龙,0
新冠我队名宿现俱乐部频道直播解说员ScottMinto确诊新冠Minto现年49岁目前属于轻症病人祝愿他早日康复,3
希望尽快公布这得多惶恐啊新冠,3
美CDC新冠或持续到明年成季节性病毒卫报中文网360浏览器O网页链接摘录至少六周前华盛顿即已向北京提出派美国专家到中国提供协助的建议雷德菲尔德说但是到现在尚未得到中国官方的答复,3
王一博杨颖寸头微微一笑很倾城杨颖的表现怎么样,1
原神有没有好心人告诉我原神雪山星荧洞窟里奇怪的冰怎么过还差一下但是洞里没红石了泪流满面还一直不刷新泪流满面只有洞门口有一个会刷新的但是太远了根本送不过去这游戏也太难太阴间了吧泪流满面泪流满面泪流满面,2
马龙工作室马龙让国旗升起让国歌奏响为祖国的荣耀而奋斗我爱你中国祝福伟大的祖国母亲生日快乐,0
住南小风丶马龙哥cut,0
お触り禁止原神甘雨O网页链接,2
居然是喜歡小蒼梨那麼小清新我還以為是更勁爆的香水AP_美術館塔組女孩永不放棄滚爷竟然喜欢祖马龙哆啦A梦吃惊红绿搭配干活不累洛传说中谷山最喜欢的香水如果抽中了我我就不给右边然子_沉迷myboy俨然已成抽奖博主,0
恭候端王王一博出道六周年快乐wyb王一博王一博平安喜乐星星掉进海里糖果掉进梦里而你掉进我心里UNIQ王一博,1
O观察为何中国冠病疫苗接种率这么低将有什么后果新冠疫苗,3
王一博真的很棒一罐糖粥真的很厉害五啊姐姐似乎每个角色在宣传的时候都会面临许多的坎坷和不顺愈是不顺在我心中愈发立得住是这样的王一博的道路上从来没有金手指但我愿意接受这个事实因为我知道他会在这条荆棘之路走得很好王一博,1
什么马龙最高今天加盟NBA这意味着NBA要扩充到31支球队了,0
新闻看点导读他时隔4个月重返男乒第一王楚钦排名变化最大马龙排名第四各位点开这篇文章的朋友们想必都是很高的颜值吧我们真的是很有缘哦小编每天都会给大家带来不一样的体育资讯如果对小编的文章或者其O他时隔4个月重返男乒第一王楚钦排名变化最大马龙排名第四,0
原神啊啊宝贝漫画,2
原神凝光姐姐你的脸怎么了凝光我很方群玉阁没了,2
新冠二月二已经过去了但理发店还没开门,3
男乒马龙一直很稳但是现在身体确实不是在他的巅峰期了当然龙队还是非常厉害东京奥运会他有一个名额了由他带新很放心但是那个新人我还是希望是樊振东说实话我觉得国乒这代新人就小胖能够扛得住外战他大赛经验丰富心理素质肯定比其他人好能够撑得住场子技术不如马龙技巧多但是也不能否认他技术厉害队内打谁输谁赢我都不意外他们太熟悉彼此打法但奥运会外战不能输看看其他人外战成绩就知道其实心理素质很重要我很佩服张继科大赛型选手里约打封闭硬是闯到了决赛看过他好多比赛大型赛事是真的抗打总能够逆风翻盘被打到30他能翻回来你说心理怎么样女乒小将崛起真的很快都很能打丁宁是一直心理素质就很强大有技术还抗打刘诗雯我觉得她的技术很好但是心理素质从以往比赛来看还是差点收起全文d,0
疫情时期的菜单问卷一这段时间你做得最多的是哪道菜二为什么三你会配酒喝吗四如果配酒你最喜欢这道菜配什么酒欢迎大家在下方评论回答让历史记录你新冠新冠肺炎广州美食分众倪伟熊晓杰C小姐艺术维C,3
新冠疫情之下周末的出行基本都变成了戴着口罩逛公园然后临回家前在公园附近找个餐馆点好外卖顺路自提带回家春天来了山花烂漫不戴口罩的人越来越多野餐的跑步的似乎病毒已经不再是威胁了我却总觉得它不会这么轻易放过人类不能松懈啊筒子们,3
2021萤火虫漫展酷狗蘑菇萤火虫动漫音乐嘉年华原神西风骑士团火花骑士可莉前来报到可莉二妹aa我大星火啊官方萤火虫动漫游戏嘉年华抄送摄影9课官方微薄蛋壳安利协会吐槽部部长_FrosV黑企编辑部的流浪猫安利摄爱优摄萌妹传送门stage1st超视研冰域摄影联盟官博云漫展蛋壳安利协会有萌妹Nyato喵特九萌次元原神收起全文d,2
刹那之后一片冰心Anny为人善良宽厚做事坚韧执着是马龙啊Vivian要实现小心愿跟随马龙哥哥做最棒的果儿当然了这个道理希望更多人懂并不简单并不简单,0
刚刚在朋友圈问了一圈我来共享评论了腮红Suqqu渐变腮红我朋友说打十层都很自然的那种自然NarsGinaMacmelba这俩色系一样都很元气的感觉重点哑光Canmake0304小红书上的推荐也有很多香水爱马仕尼罗河朋友圈评论里推荐最多的一瓶光看瓶子就好想入手TT无人区玫瑰比较小众好评多祖马龙黑琥珀与姜百合祖马龙的香水不太容易踩雷是真的眼影本人实在太爱blingbling了唯一用过一款哑光是国产的一个牌子vnk巨哑光显色度也不错然后在小红书看到如下哑光眼影安利太好看了19950824自然色系奶茶色和大地色巨推呃没有特别拍过眼睛好粗糙的眼妆分享最后大眼必备我又要吹爆它真滴平价又好用unny纤长卷翘睫毛膏轻轻刷就睫毛精不容易苍蝇腿自然伪素颜心机大眼你值得拥有收起全文d,0
原神原神插画pixiv画师推荐琴迪卢克Twiwhgkdud_d,2
祖马龙品牌黎漾女士持久淡香香水30ml原629现179领下O网页链接自助找券O网页链接,0
王一博绝了,1
马龙厉害龙神,0
原神原神壁纸分享,2
原神我也不知道是不是我的问题我看的所有提瓦特男团的mad都跳的是女团舞,2
王一博Wyb王一博组团去烧王一博裤子我很爱哥哥的也超级喜欢哥哥的穿搭是我理想男孩的穿搭但是有几条裤子我真的很想烧UNIQ王一博,1
新冠最最最难的一次,3
想到一觉起来就能见到打比赛的马龙选手真激动,0
原神做了一期胡桃的全语音视频有中日两版O原神胡桃角色语音全整理,2
Captain龙资源汇总马龙图片190806洛杉矶到达,0
我很久没有画原神实验更多的后视画特色人物甘雨参考使用我用一些瓷器美学创造了这个作品我认为它很好地与她的蓝色主题PSD34kHDJpg步骤另一个版本httpsakimichanmeDeviantArtO网页链接PixivO网页链接原神游戏sakimichan绘图甘雨收起全文d,2
保健床垫的套路好省素宝宝疫苗,3
卫康士免疫商学院第四课狂犬病是如何传播的卫康士狂犬病疫苗长沙狂犬病L卫康士预防医学连锁门诊的微博视频,3
马龙走一个,0
昨天出魈今天卢老爷我的欧气所剩无几原神,2
王一博陪你到世界之巅wybUNIQ王一博,1
随手拍的喜欢的照片没有给祖马龙打广告他们家的店实在是太香了进去的一瞬间我的鼻子就直接失灵了啥也闻不到,0
王一博再也不是那个王甜甜了这娃长大了不好骗了L饭圈小鲜肉的微博视频,1
疫情笼罩下的都市依然有青年向往成为医生摄影疫情新冠外卖小哥2上海,3
果窖_1988锤pp那一下就很哥哥给弟弟打气了马龙真是贴心又强大的存在Ineeda哥哥,0
王一博wyb王一博平安喜乐王一博神的孩子在跳舞UNIQ王一博,1
王一博翟至味太可爱了佟大为哥哥陈乔恩姐姐逗猫棒撩弟L凌乱雅正一个小瑘啵的微博视频,1
原神给大都逗乐了原神,2
寻个人叫叨叨三十几级头像是空就刚刚咨询我帮忙打无相岩把移出好友键看成加入世界了来道个歉还有加个好友原神,2
今日份的坏女人是我们敬爱的女士原神2济南利农花园,2
祖马龙英国橡木与红醋栗留香时间真的很长代价是前调又浓又冲整条胳膊闻起来跟烟灰缸似的但是后调真的巨他妈温柔好闻冬天喷再适合不过了,0
原神FGO同人主页原神同人主页君是PiPi吗是MiMi吗永恒之战一触即发冒险者你准备好了吗老虎何奇妙画室原神FGO同人,2
马云给援助湖北医生的免费午餐湖北新冠武汉援鄂武汉红十字07JRYHo06,3
祖马龙可以推荐哪款,0
安分守己做你的底气放心去闯世界再怎么不好你要知道总有人陪你王一博王一博王一博出道五周年快乐UNIQ王一博,1
晚安呐王一宝王一博粉丝后援会王一博wyb王一博晚安UNIQ王一博,1
艺起新闻河北手绘新冠作品走热医学科普出新意近期一组名为画说新冠科学防控新型冠状病毒肺炎宣传手册的手绘作品在网络平台上受到网友广泛关注让医学科普玩出了新花样该作品由河北省新冠肺炎救治专家组组长河北医科大学第二医院呼吸与重症医学医科主任阎锡新连同画家榆木先生编著绘制河北美术出版社编辑出版以图画的形式宣传普及新冠肺炎疫情防控知识为民众提供防疫指引该书先期推出免费的数字展现形式在网络平台上传播收起全文d,3
九价hpv湖北人不是病毒隔离病毒不是隔离湖北人红红火火恍恍惚惚的两天完完全全在飞机上度过的两天在进行个两次新冠排查两次核酸检测后终于打上了九价第二针可真不容易跑遍大半个中国打疫苗我真的很上心了最后在回来的时候福州只要在湖北待过都不给绿码我觉得这样做的不太对我想说的是作为湖北人没有错不是所有的湖北人都有新冠不是所有的湖北人必须有新冠这次疫情给湖北人的歧视太大了我希望大家不要带着有色眼镜去看湖北我是湖北人我骄傲收起全文d,3
七七来了手工粘土超轻粘土原神,2
韩国有1人接种阿斯利康新冠疫苗后死亡政府调查中韩国京畿道高阳市某养老设施住院人员A某50多岁接种阿斯利康新冠病毒COVID19疫苗后死亡防疫部门正在调查死因NEWSPIMO网页链接,3
原神rkgk钟离,2
又一个宝可梦25周年的合作歌手公开PM波兹马龙预计将于0227带来虚拟演唱会宝可梦25周年更多详见O宝可梦25周年都有啥上L宸轩Timo的微博视频,0
张继科和马龙,0
多想能早点认识马龙呀,0
原神可能这就是抽卡游戏的快乐吧刚还在骂刻师傅吃了我的大保底2如皋市L今天我有猫子了吗的微博视频,2
互粉大厅互粉互粉涨粉大厅关注新冠肺炎新冠肺炎新冠疫苗来了口罩还需要吗钟南山院士的答案是毫无疑问的YES欧美2021超越2020疫情疫情依然严重得一塌糊涂每日百万级别的增长死亡累计273万特朗普下台拜登宣布上任百天实现三大目标之一就是全民戴口罩今日看到美国国家公园发布口罩强制令的最新报道在中美关系趋缓的大背景下欧美国家已经从它们唯一认证可以进口天津泰达价廉物美的口罩420亿只天津泰达在武汉抗疫行动中做出了卓越贡献得到新闻联播的报道作为天津国企改革的排头兵相信能够在全球跨年抗击新型肺炎我们在行动的阻击战中为中国驰援世界抗疫做出更大的贡献已经接受辅导三年公司治理完全达标的渤海证券也即将开启IPO的大门为天津经济发展和世界抗疫行动做出重要贡献就挺突然的股票基金今日看盘A股财经投资理财微博股票上证指数今日股市个股分析股市分析投资理财天津泰达渤海证券上市钟南山关注新冠肺炎收起全文d,3
全球疫情意大利疫情新冠新冠病毒攻击中枢神经系统今日贴纸打卡全球三连我在中国2无锡,3
UNIQ王一博睡在王一博被窝里UNIQ王一笑王一博wyb上好佳薯我有这味眼疾手快功夫深快来接招吧UNIQ王一博,1
恭喜祖马龙的蓝风铃一招毙命击败迪奥小姐成为我最喜爱的香水伴着喜欢的香水味真的会工作整天都心情好好啊不对蓝风铃不持久只能心情好半天,0
幽默搞笑你猜我猜你经典照片背后的故事马龙白兰度拍摄史蒂夫夏皮罗SteveSchapiro时间1971年地点美国夏皮罗1934年生于纽约从十来岁就对于摄影开始充满兴趣起先他在街头寻找灵感20世纪60年代初他开始在美国拍摄流动短工和瘾君子随后他开始拍摄,0
cap龍_茶果哇收藏,0
千树万树大鸭梨曲今赞赞赞跟着马龙做公益Lordylord赞赞赞,0
85号宝贝24未来由我放手一搏王一博我想变的足够好再见你时可以自信地笑UNIQ王一博,1
王一博中国滑板运动推广大使王一博王一博滑板运动推广大使王一博前路阳光满照岁岁步步如愿以偿UNIQ王一博,1
原神15,2
龙腾家族malong球迷会马龙健康最重要安心养伤期待归来去看比赛的朋友做好合理安排,0
中国将安排临时航班接回部分在印中国公民印度全球疫情美国美国疫情新冠病毒新冠新冠肺炎疫情疫情全知道抗击疫情美利坚美利坚灯塔国威虎堂军事新闻茶余饭后我的2020新闻启示录美国部分示威者焚烧美国国旗美国部分示威者焚烧美国国旗美国明尼阿波利斯市进入紧急状态美国500多名士兵前往明尼阿波利斯等地美国示威现场发生枪击事件美国警察暴力执法致黑人死亡引抗议黑龙江吉林新闻哈尔滨新闻新疆塔里木北京天津生活河北燕京贵州云南西藏陕西身边事西安甘肃青海山西河南浙江湖北山东四川广西福建两广两湖广州从化齐齐哈尔安徽上海浙江江苏安徽江西桂林湖南香港内蒙古深圳宁夏义乌海南省澳门湛江深圳南京南昌辽宁L易道老庄8046的微博视频收起全文d,3
临睡前又想到小马的名字MaRio嘴角又勾起来了真好这个名字真的是带着浓浓的马龙色彩和无限的体育人的浪漫啊小马你要保佑爸爸身体健康所向披靡,0
突然想到个问题我们是对萨斯群体免疫了吗新冠sars,3
成都新增3例本土确诊新冠2020年注定是不平凡的一年对于我来说更是如此驰援武汉刻骨铭心终生难忘终将成为我人生一笔宝贵的财富让我更加热爱我的职业医生回忆这段经历历历在目我也要用文字记录下这段难忘的经历在一起,3
OntheWaterfront码头风云这一幕我后来看纪录片的时候才知道完全是马龙白兰度临场发挥的女主Edie在掏手套的时候不慎掉了一只马龙就趁机捡起来在手上不断的把玩面对想要摆脱他的Edie迟迟不愿归还甚至戴在自己手上Edie最后为了离开不得不从他手上拽抢了下来这是男女主角的第一次对台马龙白兰度用一个道具就表现出了一个心怀正义又玩世不恭的黑帮小混混角色而Edie的眼中你可以看到有些窘迫有些尴尬有些焦虑又急于退避也许是发现了剧情超出了剧本的安排安霍纳迪在他对于电影评论的书中这么讲问题不在于演员能不能演自己而在于他该不该让虚荣心值得质疑的选择或者令人出戏的浮夸表演影响角色的塑造码头风云中的马龙白兰度已经在欲望号街车之后大红大紫但此时他的角色只是一个小打手面对他害死人的妹妹有一些歉意也有一些好感仅此而已而像国内电影那些奶油鲜肉吊炸天般的背台词演技实在惨不忍睹不管一部电影的演员造型有多么亮眼它都应该服务于故事而不是分散观众的注意力收起全文d,0
新浪看点放弃东京奥运会张本智和要向马龙看齐抱怨日本对他期待过高O放弃东京奥运会张本智和要向马龙看齐抱怨日本对他期待过高,0
